QUEST_UNUSED_20150317_000001	A ha, you're on your way to see Master Pardoner. I wish you luck.
QUEST_UNUSED_20150317_000002	Note the long way Hashipusho.
QUEST_UNUSED_20150317_000003	So. Korezo. Pardoner does not allow you to introductory. Sound fall that silver was Like this donation was bought {nl} indulgences leads to our salvation. {Nl} wealth also, that it be noted that it is a great blessing of goddess.
QUEST_UNUSED_20150317_000004	Pardoner be viewed back to your master Te. {Nl} if had the fire pot looking for a very long time.
QUEST_UNUSED_20150317_000005	Gatekeeper owl image
QUEST_UNUSED_20150317_000006	Or Tesla-like has created us by cutting the tree. {Nl} So, we owl, you always say want to return the favor. {Nl}
QUEST_UNUSED_20150317_000007	So I what is. You may ask. Would you like Tesla electrolysis collected sculpture of marble from {nl} Cathedral?
QUEST_UNUSED_20150317_000008	If marble of the cathedral, but it likes Tesla-like?
QUEST_UNUSED_20150317_000009	If it were a gift of owl image {nl} the babe, but evidence for my life. {Nl}
QUEST_UNUSED_20150317_000010	Anyway .. What seemed happy visitor comes something today, I will Hey drawing.
QUEST_UNUSED_20150317_000011	When I saw the first time in your Klaipeda, it was thought to be whether the delicate arm sword Ya can shake. {Nl} But, now I became a hero in the hero that many people praise. {Nl}
QUEST_UNUSED_20150317_000012	However, I want to make sure your courage directly. banshee {nl} covers the evil aura the dark forest. You are not a proper challenge harder ones.
QUEST_UNUSED_20150317_000013	Isolation. Just merely hunting. In {nl}, Itogetone waiting on the Klaipeda.
QUEST_UNUSED_20150317_000014	Have been. Was waiting. {Nl} would be given a reward worthy of your container if this degree.
QUEST_UNUSED_20150317_000015	Hehe, I'm really enthusiastic. {Nl} I remembered when you were still convergence wizard. Then also you were really enthusiastic. {Nl}
QUEST_UNUSED_20150317_000016	Now I want to know you grew how. If {nl} banshee et al defile the forest, do not you to the appropriate challenge?
QUEST_UNUSED_20150317_000017	Rather than test, it is considered to be a good thing. In {nl}, and later also met at the Klaipeda.
QUEST_UNUSED_20150317_000018	Yes, brilliantly Hatchiu~otone. and {nl} is a what kind of figure is when the next meet, further anxious?
QUEST_UNUSED_20150317_000019	Plate when you saw the first time, I wonder not die immediately parser too stand up. I thought. {Nl} now I think that it has become more famous than me. {Nl}
QUEST_UNUSED_20150317_000020	You will really try to the will bet described meets applied to its reputation. {Nl} it is to exterminate all the nasty banshee covering this forest. How is it?
QUEST_UNUSED_20150317_000021	What so I'm going important that actually bet. I met me is, it is not more important. In {nl}, waiting on the Klaipeda.
QUEST_UNUSED_20150317_000022	Have been. You really've got to impress me. {Nl} Do you accept now expect a more grown-up appearance?
QUEST_UNUSED_20150317_000023	I think it 's assume is filled with the grace of goddess than when you first came to the Klaipeda. {Nl} I want to know your faith is how deep. {Nl}
QUEST_UNUSED_20150317_000024	Of course, it is not the same thing Let again in an abstract standard. {Nl} and I drive off the banshee that bring the evil aura in this forest in the name of the goddess.
QUEST_UNUSED_20150317_000025	Goddess less our enemy and we do not have differences. In {nl}, I will see you on the Klaipeda.
QUEST_UNUSED_20150317_000026	I'm was Mashi Oh. You showed great faith. {Nl} and I gave me also my great inspiration. {Nl} This is do my little castle. By all means, please write in the correct thing.
QUEST_UNUSED_20150317_000027	Previous quiet here there is no time temporarily or quiet now monsters.
QUEST_UNUSED_20150317_000028	If you leave only my monster, it is to find and attack the soul that gather here.
QUEST_UNUSED_20150317_000029	People are now better Denis mood decreased even a little.
QUEST_UNUSED_20150317_000030	People has decided to let buried the remains of family here. {Nl} now it has been left on the land for uncovering monster all.
QUEST_UNUSED_20150317_000031	Here is time that that was heard little by little sad cries of bereaved family was ... the best of times.
QUEST_UNUSED_20150317_000032	Although relics you have not met yet is large, even look but I think that was good.
QUEST_UNUSED_20150317_000033	Image of other owl has come back soul must be India. {Nl} that a problem has occurred in the vicinity of the barrier is clear.
QUEST_UNUSED_20150317_000034	What might, but I feel that we are only in something
QUEST_UNUSED_20150317_000035	It 's was Asmodian still. {Nl} Here people the tranquility in had defiled.
QUEST_UNUSED_20150317_000036	Soul fled to the north might know the information about the person.
QUEST_UNUSED_20150317_000037	Lost soul
QUEST_UNUSED_20150317_000038	I you're alive. {Nl} However, is never safe you.
QUEST_UNUSED_20150317_000039	Asmodian does not know what sniff, but ... my barrier, you need to open always.
QUEST_UNUSED_20150317_000040	I went to find an image of the owl at all of deeper. {Nl} or we will help me be able to escape from here?
QUEST_UNUSED_20150317_000041	Monster we will chase it tries to absorb the soul. {Nl} to do would steeped in evil forces getting caught caught in them.
QUEST_UNUSED_20150317_000042	Thank you very much! {Nl} I can leave aiming this gap.
QUEST_UNUSED_20150317_000043	Regret many souls
QUEST_UNUSED_20150317_000044	I know. Soul went north before {nl} will not be able to get there. {Nl} However, the length can go to the image of the other owl in the upper. {Nl} for Sakumori our top of the hill, I do not Yes can go.
QUEST_UNUSED_20150317_000045	Monster Why chase us. {Nl} It is painful. Also died ..
QUEST_UNUSED_20150317_000046	The word is it true? Nante clogged length of {nl}.
QUEST_UNUSED_20150317_000047	It is not ginger. {Nl} once I let you know that the soul is where the opposite. {Nl} There is one Proceeding north owl image. And try to go there.
QUEST_UNUSED_20150317_000048	I want to leave before that gather people again.
QUEST_UNUSED_20150317_000049	Sacred owl image
QUEST_UNUSED_20150317_000050	I have been attacked following the de scan all vinegar was mutated from the other day. {Nl} also my body that was made of wood If you leave this, you will be broken soon!
QUEST_UNUSED_20150317_000051	Yes not to want to create to wander me deposited obtained remains and soul again ...
QUEST_UNUSED_20150317_000052	It is unscrupulous people while small.
QUEST_UNUSED_20150317_000053	sad, but our image does not allow you to carry out the mission given now sculptor like. {Nl} to be able to protect myself. {Nl}
QUEST_UNUSED_20150317_000054	Soul responsible too many.
QUEST_UNUSED_20150317_000055	It is great!
QUEST_UNUSED_20150317_000056	Please proceed to the south. {Nl} there will be a statue to go crack like me.
QUEST_UNUSED_20150317_000057	Melancholy owl image
QUEST_UNUSED_20150317_000058	It is strange that living people come here. Do not look at the soul of {nl}, seems a few years have passed.
QUEST_UNUSED_20150317_000059	Thanks to you, the last few years you will be able to hold out.
QUEST_UNUSED_20150317_000060	monster you've witnessed is unreasonable of hollow vendor that drove into a corner us. {Nl} in order to prevent the monsters, you will need to delete the empty owl. {Nl} ne because herd of hollow vendor is using the trap. {Nl} you need to make sure the image of the valley deep in the empty owl.
QUEST_UNUSED_20150317_000061	Soul will find the the owl. {Nl} will cause bite into the empty owl. {Nl} people soul knows very well the fact that get lost to find us
QUEST_UNUSED_20150317_000062	To that utilize a large number of image.
QUEST_UNUSED_20150317_000063	The soul who have been said, it was the place where the soul has been found our owl. The {nl} now, it would be filled with traps of hollow vendor unreasonable is installed. {Nl} pitfalls of herd of hollow vendor will be the threat to anyone.
QUEST_UNUSED_20150317_000064	If soul you have lost the way, we will look for another soul. {Nl} bright trap, I'm tempted so the soul.
QUEST_UNUSED_20150317_000065	I I have had a lot of pitfalls.
QUEST_UNUSED_20150317_000066	Hollow Venter is to such should be in the neighborhood of Yorusu~euru. {Nl} It is strange.
QUEST_UNUSED_20150317_000067	Peripheral hollow vendors need to defeat a swarm of ants seems to display. {Nl} If you do not come out, will must be drag.
QUEST_UNUSED_20150317_000068	Or Will the monster Where appeared?
QUEST_UNUSED_20150317_000069	If this does not come out. {Nl} There is a idea.
QUEST_UNUSED_20150317_000070	Even this Nante does not come out a hollow Venter of key, there will be in the place where it was told to me always {nl}.
QUEST_UNUSED_20150317_000071	You will clearly represent the figure and you arrive.
QUEST_UNUSED_20150317_000072	This is the key .. barrier.
QUEST_UNUSED_20150317_000073	I open the front door with a key. {Nl} there will be a soul of assistant who will lead the soul to the other side of the barrier. {Nl} the soul might be able to help you.
QUEST_UNUSED_20150317_000074	Sometimes in the soul, there are those who serve and left to than receive India. The soul is such a category.
QUEST_UNUSED_20150317_000075	Assistant soul
QUEST_UNUSED_20150317_000076	Hello! {Nl} Oh, I Are You to be folded alive.
QUEST_UNUSED_20150317_000077	I've already passed the time to receive India. However, I was not acquired absolutely. {Nl} before you come, I is where you had to give up without a soul if unless assistance. {Nl} Now go and please open the barrier. Please tell sure {nl} and toward the owl image here now and safety of!
QUEST_UNUSED_20150317_000078	Me? To my story, is often too circumstances ...
QUEST_UNUSED_20150317_000079	When getting rid of Asmodian, had its load is thought lost. {Nl} I it was not. Thank you for opening the door.
QUEST_UNUSED_20150317_000080	Please listen to the advice in the soul of the assistant. {Nl} get lost and need help to soul.
QUEST_UNUSED_20150317_000081	I troubled. The force is, also let's do if the Asmodian?
QUEST_UNUSED_20150317_000082	Oh, but I you say the soul. {Nl} It has been lost in the place a high hill.
QUEST_UNUSED_20150317_000083	If visible, I will inform the direction of the machine. {Nl} There dark slime a lot on the road in the visible. {Nl} will clearly be a major threat to you.
QUEST_UNUSED_20150317_000084	Thing is for sure, it is never that it is not until the group. {Nl} However, I looks very confusing.
QUEST_UNUSED_20150317_000085	Soul of unknown name
QUEST_UNUSED_20150317_000086	We owl was waiting for you. {Nl} welcome.
QUEST_UNUSED_20150317_000087	So has around there or black. {Nl} sculptor like is looking at this forest, How sad conviction.
QUEST_UNUSED_20150317_000088	It is also is a sore chest look only remains that are scattered in front of it.
QUEST_UNUSED_20150317_000089	Red Puragiga are threatening us. Please see that you walk around there {nl}.
QUEST_UNUSED_20150317_000090	And between which there is a black Sakumori .. you will not be able to pass through. {Nl} is full of black Sakumori on top of the hill.
QUEST_UNUSED_20150317_000091	How to protect I was thinking. And but's ear {nl} Fisherman swallowed soul, DP will be felt. {Nl} If Fisherman visited swallowed DP.
QUEST_UNUSED_20150317_000092	I wait for the owl image
QUEST_UNUSED_20150317_000093	Silence of the forest (1)
QUEST_UNUSED_20150317_000094	I'll get rid of the Black Zigri
QUEST_UNUSED_20150317_000095	Silence of the forest (2)
QUEST_UNUSED_20150317_000096	The remains of the Notice / soul I told weak owl image.
QUEST_UNUSED_20150317_000097	Silence of the forest (3)
QUEST_UNUSED_20150317_000098	We propose is to confirm the barrier
QUEST_UNUSED_20150317_000099	Silence of the forest (4)
QUEST_UNUSED_20150317_000100	To provide that the try to find the soul
QUEST_UNUSED_20150317_000101	Soul that has entered into the poison (1)
QUEST_UNUSED_20150317_000102	I'll get rid of the Puragi
QUEST_UNUSED_20150317_000103	Soul that has entered into the poison (2)
QUEST_UNUSED_20150317_000104	I'll get rid of the Black Sakamoli
QUEST_UNUSED_20150317_000105	Soul that has entered into the poison (3)
QUEST_UNUSED_20150317_000106	To provide as try to check the owl image
QUEST_UNUSED_20150317_000107	Soul that has entered into the poison (4)
QUEST_UNUSED_20150317_000108	Checking /MAKING/2.5/TRACK_BEFORE/None
QUEST_UNUSED_20150317_000109	Relief request of owl image
QUEST_UNUSED_20150317_000110	I'll get rid of the Desmodus
QUEST_UNUSED_20150317_000111	Asmodian soaked in the woods (1)
QUEST_UNUSED_20150317_000112	We propose to give help
QUEST_UNUSED_20150317_000113	Asmodian soaked in the forest (2)
QUEST_UNUSED_20150317_000114	We propose that the visit the owl image
QUEST_UNUSED_20150317_000115	Soul of Hunter (1)
QUEST_UNUSED_20150317_000116	We propose is to confirm the owl image
QUEST_UNUSED_20150317_000117	Soul of Hunter (2)
QUEST_UNUSED_20150317_000118	We propose that you want to remove the trap
QUEST_UNUSED_20150317_000119	Soul of Hunter (3)
QUEST_UNUSED_20150317_000120	I'll get rid of the Hallowventers
QUEST_UNUSED_20150317_000121	Soul Hunter (4)
QUEST_UNUSED_20150317_000122	I'll get rid of the Hallowventer
QUEST_UNUSED_20150317_000123	Opening the barrier (1)
QUEST_UNUSED_20150317_000124	Opening the barrier (2)
QUEST_UNUSED_20150317_000125	I willing to talk of soul in owl image
QUEST_UNUSED_20150317_000126	soul get lost (1)
QUEST_UNUSED_20150317_000127	soul get lost (2)
QUEST_UNUSED_20150317_000128	I'll get rid of the Dark Slime
QUEST_UNUSED_20150317_000129	soul get lost (3)
QUEST_UNUSED_20150317_000130	Attack of BiteRegina
QUEST_UNUSED_20150317_000131	Attack of Werewolf
QUEST_UNUSED_20150317_000132	Notice /! / Please defeat Werewolf!
QUEST_UNUSED_20150317_000133	Ma was occupied the tower of wizard monarch
QUEST_UNUSED_20150317_000134	
QUEST_UNUSED_20150317_000135	Behind closed doors of secret
QUEST_UNUSED_20150317_000136	I'll take the bet
QUEST_UNUSED_20150317_000137	I accept the test
QUEST_UNUSED_20150317_000138	Positive of curiosity
QUEST_UNUSED_20150317_000139	I'll do it
QUEST_UNUSED_20150317_000140	I interact with weak owl image
QUEST_UNUSED_20150317_000141	
QUEST_UNUSED_20150317_000142	
QUEST_UNUSED_20150317_000143	Black or so treatment
QUEST_UNUSED_20150317_000144	I will get rid of black or so
QUEST_UNUSED_20150317_000145	The recovered the remains
QUEST_UNUSED_20150317_000146	
QUEST_UNUSED_20150317_000147	Check the soul of the barrier
QUEST_UNUSED_20150317_000148	Come back to make sure the soul of the barrier
QUEST_UNUSED_20150317_000149	Lost souls and conversation
QUEST_UNUSED_20150317_000150	To talk to the lost souls to climb along the north of the road
QUEST_UNUSED_20150317_000151	I will talk to the lost souls
QUEST_UNUSED_20150317_000152	Red plastic machine treatment
QUEST_UNUSED_20150317_000153	I do red plastic machine treatment
QUEST_UNUSED_20150317_000154	Regret many souls and conversation
QUEST_UNUSED_20150317_000155	I will talk to regret many souls
QUEST_UNUSED_20150317_000156	Black Sakumori treatment
QUEST_UNUSED_20150317_000157	I getting rid of black Sakumori
QUEST_UNUSED_20150317_000158	Kurosaka Molly treatment
QUEST_UNUSED_20150317_000159	Check the owl image
QUEST_UNUSED_20150317_000160	I check the owl image
QUEST_UNUSED_20150317_000161	monster extermination to surging
QUEST_UNUSED_20150317_000162	I will exterminate the monster surging
QUEST_UNUSED_20150317_000163	Conversation with sacred owl image
QUEST_UNUSED_20150317_000164	I interact with the sacred owl image
QUEST_UNUSED_20150317_000165	All Death Church
QUEST_UNUSED_20150317_000166	All Death I getting rid of scan
QUEST_UNUSED_20150317_000167	Fisherman, and part recovery of DP
QUEST_UNUSED_20150317_000168	Fisherman, it has regained part of DP
QUEST_UNUSED_20150317_000169	Red Fisherman treatment
QUEST_UNUSED_20150317_000170	Conversation with gloomy owl image
QUEST_UNUSED_20150317_000171	I interact with gloomy owl image
QUEST_UNUSED_20150317_000172	Check the empty owl image
QUEST_UNUSED_20150317_000173	I check the empty owl image
QUEST_UNUSED_20150317_000174	Pitfalls Delete soul
QUEST_UNUSED_20150317_000175	You want to delete by searching the pitfalls of soul
QUEST_UNUSED_20150317_000176	Load treatment of Necroventer
QUEST_UNUSED_20150317_000177	I will exterminate the load of Necroventer
QUEST_UNUSED_20150317_000178	Load treatment of soul of Hunter
QUEST_UNUSED_20150317_000179	Treatment of key keeper Hello vendor
QUEST_UNUSED_20150317_000180	I get the key to defeat key keeper Hello Venter
QUEST_UNUSED_20150317_000181	Key keeper
QUEST_UNUSED_20150317_000182	Load of hollow vendor
QUEST_UNUSED_20150317_000183	Soul and conversation of Assistant
QUEST_UNUSED_20150317_000184	I talk to the soul of the Assistant
QUEST_UNUSED_20150317_000185	I beat the monster to interfere
QUEST_UNUSED_20150317_000186	I have defeated the monster that interfere
QUEST_UNUSED_20150317_000187	Remnants extermination of Necroventer
QUEST_UNUSED_20150317_000188	Black slime extermination
QUEST_UNUSED_20150317_000189	I will defeat the black slime
QUEST_UNUSED_20150317_000190	Check the suspicious location
QUEST_UNUSED_20150317_000191	I confirm the suspected location
QUEST_UNUSED_20150317_000192	During the time limit, the defense of the region
QUEST_UNUSED_20150317_000193	I survive from between the time limit pounce monster attacks
QUEST_UNUSED_20150317_000194	Soul a conversation with unknown name
QUEST_UNUSED_20150317_000195	I will talk to the soul of unknown name
QUEST_UNUSED_20150317_000196	Monster extermination to block the road
QUEST_UNUSED_20150317_000197	Please to defeat the BiteRegina
QUEST_UNUSED_20150317_000198	BiteRegina treatment
QUEST_UNUSED_20150317_000199	Werewolf appeared
QUEST_UNUSED_20150317_000200	Werewolf extermination that appeared suddenly
QUEST_UNUSED_20150317_000201	Werewolf extermination
QUEST_UNUSED_20150317_000202	Hamin treatment
QUEST_UNUSED_20150317_000203	Ma monarch search that occupied the tower of the wizard
QUEST_UNUSED_20150317_000204	Please find between monarch Helgasercle occupied the tower of the wizard.
QUEST_UNUSED_20150317_000205	
QUEST_UNUSED_20150317_000206	Suddenly appeared Swordsman master and conversation
QUEST_UNUSED_20150317_000207	Somehow, Swordsman master noticed in front of you. Please try to divide the conversation.
QUEST_UNUSED_20150317_000208	Hidden Quest occurrence
QUEST_UNUSED_20150317_000209	Hidden Quest has occurred. Please Kill Banshee behind closed doors of Katyn.
QUEST_UNUSED_20150317_000210	The test of Swordsman master I was successfully completed. Please go find a Klaipeda of Swordsman master.
QUEST_UNUSED_20150317_000211	Banshee treatment
QUEST_UNUSED_20150317_000212	Suddenly appeared wizard master and conversation
QUEST_UNUSED_20150317_000213	Somehow, wizard master noticed in front of you. And try the conversation {nl}
QUEST_UNUSED_20150317_000214	Find Wizard Master
QUEST_UNUSED_20150317_000215	The test of the wizard master I was successfully completed. Please go find a Klaipeda of wizard master.
QUEST_UNUSED_20150317_000216	Archer Master and conversation that appeared suddenly
QUEST_UNUSED_20150317_000217	Somehow, I noticed bow master in front of you. Please try to divide the conversation.
QUEST_UNUSED_20150317_000218	Hidden Quest has occurred. Please Kill Banshee behind closed doors of Katyn
QUEST_UNUSED_20150317_000219	The master of the test of Archer I was successfully completed. Please go to find a Klaipeda of Archer of master.
QUEST_UNUSED_20150317_000220	Cleric master and conversation that appeared suddenly
QUEST_UNUSED_20150317_000221	Somehow, Cleric master noticed in front of you. Please try to divide the conversation.
QUEST_UNUSED_20150317_000222	The test of Cleric master I was successfully completed. Please go find a Klaipeda of Cleric master.
QUEST_UNUSED_20150317_000223	Gatekeeper owl is good to examine you. Please try to talk to the gatekeeper owl.
QUEST_UNUSED_20150317_000224	Available from the Cathedral of marble sculpture
QUEST_UNUSED_20150317_000225	Words owl image of gatekeeper owl, and you want to give back to the sculptor Tesla. Please obtain a sculpture of marble from the Cathedral of monsters.
QUEST_UNUSED_20150317_000226	Marble sculpture transferred to the sculptor Tesla
QUEST_UNUSED_20150317_000227	
QUEST_UNUSED_20150323_000228	Ïø®Î†à Í≥†Í∞ú ÏßÑÏûÖ
QUEST_UNUSED_20150323_000229	Ïø®Î†à Í≥†Í∞úÎ°??¥Îèô?úÎã§
QUEST_UNUSED_20150323_000230	Ïø®Î†à Í≥†Í∞ú?ÖÍµ¨???©Ïñ¥???àÎäî ?†Í≥®?®ÏùÑ Î™®ÏïÑ?®Îã§
QUEST_UNUSED_20150323_000231	?ÄÎ¶¨ÏÑù Ï°∞Í∞Å??Ï∂©Î∂Ñ??Íµ¨Ìïú Í≤?Í∞ôÏäµ?àÎã§. ÎπÑÏóê?Ä Í≥ÑÍ≥°???àÎäî Ï°∞Í∞ÅÍ∞Ä ?åÏä¨?ºÏóêÍ≤??ÄÎ¶¨ÏÑù Ï°∞Í∞Å??Í∞Ä?∏Îã§ Ï£ºÏÑ∏??
QUEST_UNUSED_20150714_000232	
QUEST_UNUSED_20150714_000233	
QUEST_UNUSED_20150714_000234	
QUEST_UNUSED_20150714_000235	
QUEST_UNUSED_20150714_000236	
QUEST_UNUSED_20150714_000237	
QUEST_UNUSED_20150714_000238	
QUEST_UNUSED_20150714_000239	
QUEST_UNUSED_20150714_000240	
QUEST_UNUSED_20150714_000241	
QUEST_UNUSED_20150714_000242	
QUEST_UNUSED_20150714_000243	
QUEST_UNUSED_20150714_000244	
QUEST_UNUSED_20150714_000245	
QUEST_UNUSED_20150714_000246	
QUEST_UNUSED_20150714_000247	
QUEST_UNUSED_20150714_000248	
QUEST_UNUSED_20150714_000249	
QUEST_UNUSED_20150714_000250	
QUEST_UNUSED_20150714_000251	
QUEST_UNUSED_20150714_000252	
QUEST_UNUSED_20150714_000253	
QUEST_UNUSED_20150714_000254	
QUEST_UNUSED_20150714_000255	
QUEST_UNUSED_20150714_000256	
QUEST_UNUSED_20150714_000257	
QUEST_UNUSED_20150714_000258	
QUEST_UNUSED_20150714_000259	
QUEST_UNUSED_20150714_000260	
QUEST_UNUSED_20150714_000261	
QUEST_UNUSED_20150714_000262	
QUEST_UNUSED_20150714_000263	
QUEST_UNUSED_20150714_000264	
QUEST_UNUSED_20150714_000265	
QUEST_UNUSED_20150714_000266	
QUEST_UNUSED_20150714_000267	
QUEST_UNUSED_20150714_000268	
QUEST_UNUSED_20150714_000269	
QUEST_UNUSED_20150714_000270	
QUEST_UNUSED_20150714_000271	
QUEST_UNUSED_20150714_000272	
QUEST_UNUSED_20150714_000273	
QUEST_UNUSED_20150714_000274	
QUEST_UNUSED_20150717_000275	
QUEST_UNUSED_20150717_000276	
QUEST_UNUSED_20150717_000277	
QUEST_UNUSED_20150717_000278	
QUEST_UNUSED_20150717_000279	
QUEST_UNUSED_20150717_000280	
QUEST_UNUSED_20150717_000281	
QUEST_UNUSED_20150717_000282	
QUEST_UNUSED_20150717_000283	
QUEST_UNUSED_20150717_000284	
QUEST_UNUSED_20150717_000285	
QUEST_UNUSED_20150717_000286	
QUEST_UNUSED_20150717_000287	
QUEST_UNUSED_20150717_000288	
QUEST_UNUSED_20150717_000289	
QUEST_UNUSED_20150717_000290	
QUEST_UNUSED_20150717_000291	
QUEST_UNUSED_20150717_000292	
