QUEST_LV_0100_20150312_001222	저희를 구해주신 계시자님께 여신의 가호가 깃들길 늘 기도드리고 있답니다.
QUEST_LV_0100_20150312_001223	피난민들을 돕고 있어요.{nl}몬스터가 마을을 습격했거든요.
QUEST_LV_0100_20150312_001224	광산 소장 브링커
QUEST_LV_0100_20150312_001225	아직은 많이 불안하오.{nl}그래도 예전보단 나은 게 모두 당신 덕 아니겠소?
QUEST_LV_0100_20150312_001226	커닝햄의 이야기가 사실이었다니.. 조금 연구해 볼 필요가 있겠습니다.
QUEST_LV_0100_20150312_001227	모든 것에는 마나라는 샘이 있어요.{nl}그리고 원한다면, 서로가 서로의 마나를 이을 수도 있겠죠.{nl}마치 수로를 파는 것처럼요.
QUEST_LV_0100_20150312_001228	혹시 곡괭이질 하는 부베들을 보았소?{nl}수정도 아니고, 도대체 무얼 찾는 건지..
QUEST_LV_0100_20150312_001229	우릴 구해줘서 정말 고맙소.{nl}
QUEST_LV_0100_20150312_001230	아직도 폐쇄된 구역에 들어갈 거라면 부베들이 가지고 있는 묘한 돌을 모아 보시오.{nl}그걸 수정으로 막힌 벽에 갖다 대니까 스르륵 열리더군.
QUEST_LV_0100_20150312_001231	여기서 뭘 하시는 거지요?{nl}빨리 광산으로 들어가세요.{nl}1층에서 만나기로 하지 않았습니까?
QUEST_LV_0100_20150312_001232	그 어떤 마족도 여길 넘어갈 수 없을 겁니다.{nl}팔라딘 마스터님을 방해할 수 없도록 제가 목숨을 바쳐서라도 사수할 겁니다.
QUEST_LV_0100_20150312_001233	확고한 신념은 우리의 방패일세.{nl}우리는 항상 여신의 뜻에 따라 정의와 신념을 위해 싸워 왔네.
QUEST_LV_0100_20150312_001234	장하다.{nl}팔라딘 마스터로써 자네의 업적에 경의를 표하겠네.
QUEST_LV_0100_20150312_001235	파수꾼 하메스
QUEST_LV_0100_20150312_001236	마족에게서 어떻게든 여길 지켜내야해.{nl}여긴 신성한 땅이란 말이다.
QUEST_LV_0100_20150312_001237	그 맹약만 아니었어도 벌써 도망갔겠지만.{nl}그래도 난 위대한 파수꾼의 아들이라고.
QUEST_LV_0100_20150312_001238	어떻게든 마족들을 막아 내야지요.{nl}성당의 형제들에게 위험을 떠넘길 순 없습니다.
QUEST_LV_0100_20150312_001239	결계 때문에 들어갈 수가 없구나.{nl}문을 열려면 지하 1층으로 돌아서 들어가야겠어.
QUEST_LV_0100_20150312_001240	자네를 다시 만났을 때는 이 세상에 평화가 찾아와 있을까.. 꼭 그랬으면 좋겠네.
QUEST_LV_0100_20150312_001241	마족이 여기까지 밀고 내려올거라는 건 예상 못했어.{nl}다른 형제들이 잘 버텨주길 바래야지.
QUEST_LV_0100_20150312_001242	지켜야 할 게 많으니까 왠간하면 마족들을 최대한 자극하지 말고 조용히 처리해야해.{nl}계시자인 네가 와 주니 정말 든든하네.
QUEST_LV_0100_20150312_001243	솔직히 팔라딘들만으론 버텨낼 수 없을 거라 생각했어.{nl}믿음이 부족했군.
QUEST_LV_0100_20150312_001244	숨는 것보단 당당하게 나와 싸우는 게 더 좋아.{nl}상대가 마족이라면 더 좋고.
QUEST_LV_0100_20150312_001245	인간이 마왕을 물리칠 수도 있는 거군요.{nl}방금 듣고서도 정말 믿기지가 않네요.
QUEST_LV_0100_20150312_001246	제스티를 죽이지 못한 건 아쉽네만 그래도 참 대단하구나.{nl}이제 막바지야..
QUEST_LV_0100_20150312_001247	정말 고생이 많았지.{nl}자네의 앞길에 행운이 깃들기를 빌도록 하지.
QUEST_LV_0100_20150312_001248	이제부턴 여기 계신 분들의 안전에 더욱 신경 써야겠습니다.{nl}요나스님을 모시던 시종은 어딜 간 걸까.
QUEST_LV_0100_20150312_001249	연구에 몰두하다 보면 몬스터가 오는 지도 모를 때가 있어.{nl}그 땐, 정말 아찔했지.
QUEST_LV_0100_20150312_001250	다음부터라도 주위를 잘 살피게. {nl}나까지 휘말릴 뻔 했지 않았는가.
QUEST_LV_0100_20150312_001251	왠만하면 다 기억하고 있다고 생각했는데.{nl}치매가 오는건가. 같이 일하던 그 양반 얼굴이 기억이 안나.
QUEST_LV_0100_20150312_001252	예전에 같이 일하던 사람이 있었는데.{nl}이상하게 기억이 안 난단 말야.
QUEST_LV_0100_20150312_001253	이런 곳에서 뭉그적거릴 시간이 없는데..
QUEST_LV_0100_20150312_001254	저번에 도와주셨던 건 정말 감사합니다.{nl}지원품이라곤 연구자료 뿐인데 몬스터가 왜 노리는 걸까요.
QUEST_LV_0100_20150312_001255	닐스에게 참 못할 짓을 했어.{nl}다 기억나 버리니 이거 창피하구먼.
QUEST_LV_0100_20150312_001256	경비병
QUEST_LV_0100_20150312_001257	여기서 발굴된 유물은 외부로 반출하실 수 없습니다.{nl}아무리 계시자님이더라도 말입니다.
QUEST_LV_0100_20150312_001258	이곳은 많은 학자들이 연구하는 곳이므로 정숙해 주세요.
QUEST_LV_0100_20150312_001259	물자가 귀한 때일수록 나 같은 상인들의 수완이 빛을 발하는 게 아니겠소? {nl}그게 세상 이치요.
QUEST_LV_0100_20150312_001260	이게 뭐라고 몬스터들이 가져간담.{nl}그나마 자료가 이 정도라도 남아있어서 다행이에요.
QUEST_LV_0100_20150312_001261	살면서 이렇게 위험한데까지 나오긴 처음이요.{nl}이렇게 척박한 곳인데 몬스터가 왠말인지.
QUEST_LV_0100_20150312_001262	고라쓰
QUEST_LV_0100_20150312_001263	실종된 사람들이 한 둘이 아니라던데 이 친구는 또 어딜 간 거지?
QUEST_LV_0100_20150312_001264	바다트
QUEST_LV_0100_20150312_001265	또 연구자료를 잃어버렸어.{nl}이게 도대체 몇 번째야?
QUEST_LV_0100_20150312_001266	석공 피포티
QUEST_LV_0100_20150312_001267	그런 일은 하지 말았어야 했는데.{nl}다 나 때문이야.
QUEST_LV_0100_20150312_001268	사학자들에게 얌전히 조언이나 해 주다가 돌아갈 것을.{nl}다 내 잘못이야.
QUEST_LV_0100_20150312_001269	결정석을 가지고 부러진 기둥 협곡의 구스타스의 제자들을 찾아주세요.{nl}봉인에 대해 가르쳐 드릴 겁니다.
QUEST_LV_0100_20150312_001270	케빈
QUEST_LV_0100_20150312_001271	여긴 정말 이상한 곳이야.{nl}학자 샌님들도, 검 밖에 모르는 용병들도 모두 여기서 헤어나질 못하고 있잖아?{nl}물론 우리도 마찬가지지만.
QUEST_LV_0100_20150312_001272	조각가 힐다
QUEST_LV_0100_20150312_001273	이 기둥들을 보세요.{nl}정말 아름답지 않습니까?
QUEST_LV_0100_20150312_001274	이 기둥들의 아름다움은 몬스터의 무서움도 다 잊게 해주는군요.{nl}정말 대단해요.
QUEST_LV_0100_20150312_001275	멋진 장식이 있는 기둥들도 좋지만 어떤 기둥들은 읽을 수도 있어요.{nl}가끔 살펴보는 것도 좋겠지요.
QUEST_LV_0100_20150312_001276	이 황량한 협곡이 아름다운 이유는 어딘가에 비밀을 숨겨두고 있기 때문이지.
QUEST_LV_0100_20150312_001277	이제 가문의 첫 번째 사명이 이루어졌을 뿐이다.{nl}지금부터 시작이겠지.
QUEST_LV_0100_20150312_001278	보급대 대장 비오
QUEST_LV_0100_20150312_001279	오늘은 좀 잠잠하군.{nl}몬스터들 말이오.
QUEST_LV_0100_20150312_001280	우린 베테랑이오.{nl}용병 생활이 몇 년인데 소식이 끊겼다고 해서 당황할 시기는 지났지.
QUEST_LV_0100_20150312_001281	용병 에타
QUEST_LV_0100_20150312_001282	금방 돌아갈테니까 걱정 말게.{nl}예전 같았으면 이런 것 쯤은..
QUEST_LV_0100_20150312_001283	대장님이 이번엔 무슨 잔소리를 하시려나..
QUEST_LV_0100_20150312_001284	고고학자 라우디
QUEST_LV_0100_20150312_001285	여신과 마족.. 자카리엘 왕릉과 유적의 비밀..
QUEST_LV_0100_20150312_001286	모르쿠스 요나스
QUEST_LV_0100_20150312_001287	영감님이 지겹도록 말하던 그 사람은 진짜 오긴 하는 건가..
QUEST_LV_0100_20150312_001288	영감님이 그랬어. {nl}운명을 거스르는 것도 결국은 운명 안에 포함된 거라고.{nl}우리가 이렇게 발버둥치는 것도 전부 예정에 포함된 것이라는 말이겠지?
QUEST_LV_0100_20150312_001289	왜 아무도 기억을 못하는 걸까요.{nl}분명히 은발의 남자가.. 흠.
QUEST_LV_0100_20150312_001290	알 수 없는 누군가가 꾸미고 있는 알 수 없는 일.. {nl}아, 이건 불안을 넘어서서 정말 무섭네요..
QUEST_LV_0100_20150312_001291	연구에 매진해야 할 때인데, 전혀 집중이 되질 않아.{nl}게다가 조수는 또 어딜 간 건지.
QUEST_LV_0100_20150312_001292	아이리네가 없었으면 정말로 죽었을 거요.{nl}아, 물론 당신도 고맙소.
QUEST_LV_0100_20150312_001293	아이리네는 내 생명의 은인이요.{nl}당신도 물론이고.
QUEST_LV_0100_20150312_001294	이야기는 들었지만 사실 잘 믿겨지진 않습니다.{nl}부베 투사를 해치웠다니요.
QUEST_LV_0100_20150312_001295	선생님은 어디 계신 걸까요. 정말 걱정이 돼서 미칠 것만 같아요.
QUEST_LV_0100_20150312_001296	데지크 선생님이 없었으면 전 정말 몬스터들 사이에서 미쳐버렸을 거예요.{nl}아, 물론 당신이 구해주신 것도 감사하죠.
QUEST_LV_0100_20150312_001297	여긴 곧 철수할 예정입니다만, 어쩐 일이십니까?{nl}상부에서 신규 인력을 보내 준다는 말은 없었는데..
QUEST_LV_0100_20150312_001298	빨리 철수해야죠.{nl}어떤 돌이 어떤 몬스터를 불러올지 아무도 모르니까요.{nl}대체 이게 뭔 난리람..
QUEST_LV_0100_20150312_001299	고고학적 가치가 떨어져서 철수해야 한다는 게 말이 된다고 생각하시나요?{nl}밟는 땅마다 유물 천지인데!!
QUEST_LV_0100_20150312_001300	내 느낌이 틀리지 않을 거예요. 절대로 무슨 일인가가 일어나고 있어요. {nl}이대로 포기할 수 없어.
QUEST_LV_0100_20150312_001301	내가 원하는 게 분명히 있을텐데 이거 도저히 방법이 없단 말야.{nl}흠. 이를 어쩐다.
QUEST_LV_0100_20150312_001302	이 멋진 곳에서 철수해야 한다니 마음이 참 아프구먼.{nl}하지만 할 수 없지.
QUEST_LV_0100_20150312_001303	미쳤다고 여기 더 있고 싶겠어?{nl}나는 최대한 빠르게 여길 뜰거야. 나중에 또 보자고!
QUEST_LV_0100_20150312_001304	사학자 시레니아 오델
QUEST_LV_0100_20150312_001305	이 느낌은.. {nl}사학자로서의 느낌일까요, 아니면 인간의 본성에서 나오는 공포일까요..
QUEST_LV_0100_20150312_001306	탐험가 바키스
QUEST_LV_0100_20150312_001307	탐험가? 물론 위험하지.{nl}하지만 뭔가를 발견했을 때의 그 짜릿함이 날 계속 이끌어.
QUEST_LV_0100_20150312_001308	사학자 렉시퍼
QUEST_LV_0100_20150312_001309	옛말에 이런 말이 있습니다.{nl}괴물과 싸우는 사람은 스스로 괴물이 되지 않도록 조심해야 한다.{nl}그대가 오랫동안 심연을 들여다보면, 심연 역시 그대를 들여다본다..{nl}
QUEST_LV_0100_20150312_001310	왠지 당신과는 곧 다시 만날 날이 올 것 같군요.{nl}그럼 그때까지 안녕히..
QUEST_LV_0100_20150312_001311	사학자들이 초대해서 여기까지 왔어.{nl}석공으로써 조언이 듣고싶다나.
QUEST_LV_0100_20150312_001312	사학자들에게 얌전히 조언이나 해 주다가 돌아갈 것을.{nl}다 내 잘못이겠지.
QUEST_LV_0100_20150312_001313	연락관 베일
QUEST_LV_0100_20150312_001314	등록되어있지 않은 분의 안전까지 저희가 책임져 드릴 수 없습니다.{nl}웬만하면 안전한 곳으로 돌아가십시오.
QUEST_LV_0100_20150312_001315	도움이 되지 못해 죄송합니다만, 저희 명단엔 없군요.
QUEST_LV_0100_20150312_001316	사학자 콜린
QUEST_LV_0100_20150312_001317	글쎄요, 아무리 생각해도 전 아는 바가 없군요.{nl}음.. 전혀요. 
QUEST_LV_0100_20150312_001318	어휴, 이 많은 자료를 언제 다 정리한담?
QUEST_LV_0100_20150312_001319	마족의 이름을 사칭하는 사람도 있다니, 확실히 제정신은 아닌 것 같네요.
QUEST_LV_0100_20150312_001320	부상당한 사학자 라우라스
QUEST_LV_0100_20150312_001321	발굴지를 휘젓고 다니는 남자가 있어.{nl}제정신이 아니야. 어떻게 몬스터를 부리는 거지?
QUEST_LV_0100_20150312_001322	빨리요! 어떻게든 렉시퍼를 방해해야 해요.{nl}여신의 의지가 뭐든지 간에 그의 손에 들어가 봤자 좋을 일이 없을 테니까요.
QUEST_LV_0100_20150312_001323	루클리스 추모비 탁본
QUEST_LV_0100_20150312_001324	누가 루클리스의 목을 베었는가.{nl}누가 루클리스를 반역자라 하는가.{nl}
QUEST_LV_0100_20150312_001325	그의 영혼이 사그라들자 국왕의 폭정은 날뛰었고 백성의 삶은 피폐해졌다.{nl}그와 함께 죽지 못한 이 죄인의 몸, 그의 정신을 이 추모비에 남기려 한다.{nl}
QUEST_LV_0100_20150312_001326	그대가 검사가 아니어도 좋다.{nl}그대가 선택받은 자가 아니어도 좋다.{nl}
QUEST_LV_0100_20150312_001327	허나 루클리스가 그대에게 남겨줄 빛은 혼란한 세상을 위해 사용되어야 한다.{nl}만일 그대가 경솔하여 살생에만 몰두한다면 양날의 검이 되어 그대의 목을 겨누리라.{nl}
QUEST_LV_0100_20150312_001328	제 연구를 도와 줄 분을 찾고 있습니다.{nl}반역자 루클리스를 연구한다는 이유로 지원이 끊겨버렸거든요.{nl}{nl}
QUEST_LV_0100_20150312_001329	모든 게 제 불찰입니다.{nl}스미드가 죽어버리다니.. 제가 혼자 남아 무얼 하겠습니까.
QUEST_LV_0100_20150312_001330	어디 뭐 값나가는 거 없을까?{nl}일단 레이몬드에게 고용된 몸이긴 하다만.
QUEST_LV_0100_20150312_001331	무명비
QUEST_LV_0100_20150312_001332	지금은 읽을 수 없다.
QUEST_LV_0100_20150312_001333	여긴 말도 못하게 위험한 곳이죠.{nl}스승님은 위험하다면서 곁에 붙어 가만있으라고 하셨지만.. {nl}루클리스의 비밀을 밝힐 기회 앞에서 가만 있을 수가 있어야 말이죠. 
QUEST_LV_0100_20150312_001334	그래서 이렇게.. 조금 멀리 나와 있습니다.
QUEST_LV_0100_20150312_001335	이건 정말 대단합니다! 학자로서 정말 더 탐구하고 싶어지는걸요! {nl}하지만 이렇게 나와 있는 것이 괜찮은 일인지는..
QUEST_LV_0100_20150312_001336	물질의 제련을 통하여 자신의 영혼을 더 높은 곳으로 이끄는 것.{nl}그게 우리 알케미스트들의 궁극적인 목표입니다.
QUEST_LV_0100_20150312_001337	네더보바인이 또 난동인가?{nl}어떤 몬스터든 우리 로델레로가 버티고 있는 한 페디미안으로 한 발자국도 들어올 수 없지.{nl}
QUEST_LV_0100_20150312_001338	네더보바인을 퇴치하러 가신다고요. {nl}훌륭합니다. 응원하겠습니다.
QUEST_LV_0100_20150312_001339	시간을 다루는 마법이야말로 모든 마법의 정수라고 할 수 있지요.{nl}아가일라 플러리님께서 하신 말씀이에요.
QUEST_LV_0100_20150312_001340	원래 난 숲에서 살았지만 뜻이 있어서 페디미안으로 왔어.{nl}페디미안의 반 이상이 날아갔는데 나라도 도움이 된다면 도와야지.
QUEST_LV_0100_20150312_001341	페디미안 밖에서 네더보바인이 난동 중이라는 이야기는 들었습니다.{nl}수행 중인 몸으로써 적극적으로 나서지 못한다는 게 부끄럽군요.
QUEST_LV_0100_20150312_001342	독이 불공평하다는건 정말 모르고 하는 소리야.{nl}이겨야 살아남지. 정정당당하기만 해서는 이 험난한 세상을 살아갈 수 없어.
QUEST_LV_0100_20150312_001343	페디미안 밖에서 난동 중인 네더보바인을 처치하러 간다며?{nl}네가 아니었으면 내가 나섰을 텐데.{nl}아깝네. 그럼 수고해줘.
QUEST_LV_0100_20150312_001344	아름다웠던 이 도시가 이렇게 파괴되고도 아직도 위협이 되는 것들이 많지.{nl}내가 나서는 것도 좋겠다만.. 관두지. {nl}공짜로 봉사해 줄 녀석들은 널렸으니까.{nl}
QUEST_LV_0100_20150312_001345	네더보바인이라니.. 그래도 처치하겠다고 나서주신 분이 계셔서 다행입니다.
QUEST_LV_0100_20150312_001346	할 수만 있다면 예전으로 되돌아가고 싶어요.{nl}지금의 저라면, 제 마법으로 페디미안을 구하고도 남았을 거예요.
QUEST_LV_0100_20150312_001347	범상치 않은 분이라고 생각했어요.{nl}나서 주신 것만으로 감사한 일입니다.
QUEST_LV_0100_20150312_001348	좀 더 자세히 살펴보고 싶은데 방해꾼들이 너무 많네요.{nl}잠시 동안만 몬스터에게서 보호해 주실 수 있을까요?
QUEST_LV_0100_20150312_001349	이렇게 멋진 양식들을 제 눈으로 보게 될 거라곤 생각 못했어요.{nl}기둥의 뜰로 가면 더 멋진 게 있을지도 몰라요. 따라오세요.
QUEST_LV_0100_20150312_001350	배회하는 영혼은 전리품을 페디미안의 누군가에게 전해주길 바라는 것 같다.
QUEST_LV_0100_20150312_001351	작업을 완료하자 유니콘이 나타났다
QUEST_LV_0100_20150312_001352	라이모나스님의 안부 고맙습니다.{nl}어서 클라페다로 들어가시지요. 우스카님께서 기다리고 계십니다.
QUEST_LV_0100_20150312_001353	클라페다 경비대장에게 내 안부 전해주는 거, 꼭 잊지 말게.
QUEST_LV_0100_20150312_001354	준비가 다 되시면 곧바로 동쪽 숲에 주둔하고 있는 아라스를 만나 주십시오.
QUEST_LV_0100_20150312_001355	어서오세요!{nl}앗, 계시자님이시군요. 정말 뵙고 싶었어요.{nl}
QUEST_LV_0100_20150312_001356	이건 워프 스크롤이에요.{nl}사용하면 원하는 여신상으로 이동하거나 원래 자리로 되돌아 올 수 있지요.{nl}
QUEST_LV_0100_20150312_001357	기사단에서 요청한 것보다 더 넉넉하게 드릴 터이니 꼭 여신님들을 찾아주세요.
QUEST_LV_0100_20150312_001358	아직도 대형 케파가 남아 있는 것 같아요.{nl}한번 살펴 봐 주시겠어요?
QUEST_LV_0100_20150312_001359	역시 있었지요?{nl}제 감은 틀린 적이 없다니까요.
QUEST_LV_0100_20150312_001360	클라페다가 코 앞인데도 보급사정이 열악합니다.{nl}여기도 이런데 다른데는 어떻겠습니까.
QUEST_LV_0100_20150312_001361	제 부하들이 돌아올 시간이 지났는데도 감감 무소식입니다.{nl}제가 바빠서 직접 나서지 못한다는 걸 알고 있거든요.
QUEST_LV_0100_20150312_001362	부하들은 들롱 쉼터로 간다고 했습니다.{nl}골렘이 나올지도 모르는데 참 태평한 부하들입니다.
QUEST_LV_0100_20150312_001363	락토르투가가 곧 여길 덮칠 겁니다.{nl}절대로 방어선을 넘지 못하도록 힘을 빌려주십시오.
QUEST_LV_0100_20150312_001364	혹시 새끼 포아타를 보신 적 없습니까?{nl}빨리 멀리 내쫓아야 어미가 얼씬거리지 않을 텐데요.
QUEST_LV_0100_20150312_001365	부베들이 마을 바깥에 기지까지 만들어 놨어.{nl}이젠 병사들도 없는데 기지의 부베들을 내쫓지 않으면 정말 큰일날지도 몰라.
QUEST_LV_0100_20150312_001366	자네라도 이렇게 나서 주니 참 고맙네그려.
QUEST_LV_0100_20150312_001367	이 감사를 어찌 표현해야 할지.{nl}이건 분명히 여신께서 자네를 보내주신게 분명해.
QUEST_LV_0100_20150312_001368	이 환자분께서 체이퍼가 나타났을 거라고 하셔서요.{nl}혹시 모르니 한 번 살펴보고 와 주시겠어요?
QUEST_LV_0100_20150312_001369	전 지금 이 분을 치료 해야 해서.. 그럼 잘 부탁드리겠습니다.
QUEST_LV_0100_20150312_001370	그 피난민 분들이 아마, 몬스터들 때문에 여기까지 못 오고 있을 거예요.
QUEST_LV_0100_20150312_001371	그냥 넘기기엔 여기서 오래 근무하신 분이라 마음에 걸리네요.
QUEST_LV_0100_20150312_001372	감사합니다. 이제 안심하고 마을로 돌아갈 수 있겠어요.{nl}여신의 가호가 늘 함께 하길.
QUEST_LV_0100_20150312_001373	부하들은 한 번 골렘한테 걸려 봐야 정신을 차릴 겁니다.
QUEST_LV_0100_20150312_001374	평소엔 아무리 찾아봐도 보이지 않는단 말예요.{nl}참 이상하지요?
QUEST_LV_0100_20150312_001375	그 친구가 무사히 돌아갔다니 다행이군요.{nl}이 근처에 몰렉이 돌아다닌다는 이야길 들어서 불안했거든요.
QUEST_LV_0100_20150312_001376	봉인을 푸신 후엔 계속해서 그 곳의 형제들에게서 다음 봉인의 안내를 받으십시오.
QUEST_LV_0100_20150312_001377	봉인해제 결정석을 가지고 계시는군요.{nl}요나스님께서 보내신 분이 맞지요?{nl}
QUEST_LV_0100_20150312_001378	이제부터 아주 중요한 봉인들을 풀 겁니다.{nl}파사가 절벽 위에 첫 번째 봉인이 있습니다.
QUEST_LV_0100_20150312_001379	파사가 언덕의 봉인을 훌륭히 푸셨다는 이야기를 전해 들었습니다.{nl}이젠 기둥의 뜰에 있는 형제들에게서 안내를 받으세요. 
QUEST_LV_0100_20150312_001380	봉인을 푸셨으면 부러진 기둥 협곡의 다음 봉인으로 가셔야 할 겁니다.
QUEST_LV_0100_20150312_001381	봉인을 푼 뒤에는 구스타스 요나스님을 찾아가세요.{nl}아주 반갑게 맞아주실 거예요.
QUEST_LV_0100_20150312_001382	몬스터들은 정리 되었나요?{nl}사실 중요한 일은 지금부터입니다.
QUEST_LV_0100_20150312_001383	너무 위험해서 제가 미처 가져오지 못한 유물들의 회수를 부탁드리고 싶습니다.{nl}알쿠네 언덕길에 있는 돌기둥을 조사하시면 됩니다.
QUEST_LV_0100_20150312_001384	가끔 유적 장치들이 동작할 때가 있는데 무슨 일이 벌어질 지 모릅니다.{nl}부디 조심하세요.
QUEST_LV_0100_20150312_001385	그래. 잘 해주었다.{nl}그럼 난 이만 가보도록 하지.
QUEST_LV_0100_20150312_001386	기운 빠진 경비병
QUEST_LV_0100_20150312_001387	흔적 없는 폐허에서 호그마들에게 그만 당해버렸어요.{nl}다행히 목숨은 건졌지만, 상자를 되찾아야 할 텐데요..
QUEST_LV_0100_20150312_001388	마음 써 줘서 정말 고맙네요.{nl}호그마들이 지키고 있을 테니 조심하세요.
QUEST_LV_0100_20150312_001389	아마 멀리 가져가진 않았을거예요.{nl}목걸이만이라도 안전해야 할 텐데요.
QUEST_LV_0100_20150312_001390	상자 안엔 아무것도 없었다고요?{nl}맙소사, 정말 큰일이에요.
QUEST_LV_0100_20150312_001391	다른 건 몰라도 그 목걸이만큼은 반드시 찾아야 해요.{nl}그렇지 않으면 아마 전 쫓겨날 테니까요.
QUEST_LV_0100_20150312_001392	이 스크롤을 사용하면 목걸이에서 빛이 날 거예요.{nl}땅에 떨어져 있든, 호그마가 가지고 있든 금방 찾을 수 있겠지요.
QUEST_LV_0100_20150312_001393	아마 그런 목걸이라면 우두머리가 탐을 내지 않을까요?
QUEST_LV_0100_20150312_001394	정말 감사합니다!{nl}여기서 조금만 더 체력을 회복하고 나서 경비대로 복귀해야겠어요.
QUEST_LV_0100_20150312_001395	뭘 망설이고 있지? {nl}시간을 끌어서 네게 좋을 것이 없을 텐데.
QUEST_LV_0100_20150312_001396	기운 없는 경비병
QUEST_LV_0100_20150312_001397	아직도 기운이 없네요. 아까는 너무 놀라서..
QUEST_LV_0100_20150312_001398	렉시퍼는 도대체 무엇을 하려는 걸까요?
QUEST_LV_0100_20150312_001399	체데크의 제단도 당해버렸다고요?{nl}하지만 나머지 제단을 지킨다면, 아직 우리에게도 승산은 있을 거에요.
QUEST_LV_0100_20150312_001400	어서 스비에사의 제단으로 가 주세요.{nl}저도 곧 따라가겠어요.
QUEST_LV_0100_20150312_001401	뒤돌아 보지 말고 바로 달리세요!
QUEST_LV_0100_20150312_001402	석재를 살펴보다 보면 분명 덴옵틱이 나타날 겁니다.
QUEST_LV_0100_20150312_001403	자, 여기 봉인을 해제하는 스크롤을 주겠네.
QUEST_LV_0100_20150312_001404	이렇게 가야 한다니..{nl}어머니, 효도도 못했는데..
QUEST_LV_0100_20150312_001405	죄송합니다.. 죄송합니다..
QUEST_LV_0100_20150312_001406	그건 무엇입니까?{nl}서큐버스의 눈..? 물리치신 것도 반갑지만 그걸 좀 줘 보세요!
QUEST_LV_0100_20150312_001407	말씀 드렸었다시피.. 전 손재주가 좀 좋아서, 어릴 때 부터 관심이 많았어요.{nl}연금술, 마법, 약재.. 그 서큐버스의 눈을 좀 압니다!{nl}대성당의 축복을 간직한 예쁜 목걸이가 탐이 나서 서큐버스가 제 눈에 넣어버린 그 눈!{nl}제가 그걸로 다시 목걸이를 만들어 드릴게요!
QUEST_LV_0100_20150312_001408	오래 안걸립니다.{nl}잠시만요.
QUEST_LV_0100_20150312_001409	다 됐습니다!{nl}계시자님께 잘 어울리겠어요!
QUEST_LV_0100_20150312_001410	이건 포기하고 중앙에 있는 대형 이동 마법진으로 가자.
QUEST_LV_0100_20150312_001411	마족이 탑을 공격한 건 이번이 처음이 아니지만 이렇게까지 길어지진 않았어.{nl}덕분에 세간에선 가비야께서 사라진 걸로 되어 있다지?
QUEST_LV_0100_20150312_001412	함정이였어.{nl}마치 우리의 움직임을 전부 읽고 있는 것 같아.{nl}
QUEST_LV_0100_20150312_001413	어쩔 수 없어.{nl}좀 늦더라도 이동 마법진은 포기하고 탑으로 밀려드는 몬스터 먼저 해결하자.{nl}{nl}
QUEST_LV_0100_20150312_001414	폐쇄장치는 복도의 왼쪽 끝에 있어.{nl}장치만 빨리 작동시키고 윗층으로 가자.
QUEST_LV_0100_20150312_001415	폐쇄장치는 왼쪽 복도 끝에 있어.{nl}분위기로 봐서는 아직 멀쩡한 것 같아.
QUEST_LV_0100_20150312_001416	됐어! {nl}이제 더 이상 몬스터가 늘어날 일은 없을거야.{nl}
