QUEST_LV_0200_20150323_003729	The goddesses may not agree, but I want to get the revenge.{nl}The influence of the disaster that occured at the capital city of the humans is spreading quickly here.{nl}As the demons killed our sisters and took away their belongings, we also have to do the same thing.
QUEST_LV_0200_20150323_003730	{nl}Could you defeat the demons at the intersection of Huradeti and collect the teeth of those demons?{nl}
QUEST_LV_0200_20150323_003731	This is cute compared to what they did.
QUEST_LV_0200_20150323_003732	Thanks. Please keep it secret to the goddesses.
QUEST_LV_0200_20150323_003733	We could come this far because you helped us.{nl}If we could finish the job well, I think we will be able to protect the prison for a while.{nl}Are you ready to block the metastasis space?
QUEST_LV_0200_20150323_003734	While I was away from this place, the metastasis space became more stronger..{nl}If we move Haubuck in this situation, our seal would be unleashed and we will miss Haubuck.{nl}There's something that you should do it for me.
QUEST_LV_0200_20150323_003735	I don't feel good since I feel like I left a big burden on your shoulders.{nl}But, I can't help you if we can't finish this task.{nl}The power of the demons is lacking too much.
QUEST_LV_0200_20150323_003736	{nl}I will give you the rune of the night star. {nl}But, you should combine the runes with the traces of the metastasis that are on the demons that came here.{nl}Defeat the demons at the Aushura worship place.{nl}It will be an important medium to collect the power of the demons.
QUEST_LV_0200_20150323_003737	I should have listened to Laima's warnings from the beginning.
QUEST_LV_0200_20150323_003738	I've collected enough Runes of the night star.{nl}I will use this to pull the spirits of demons.{nl}Receive the rune of the night star.
QUEST_LV_0200_20150323_003739	Use the rune of the night star to the demons and neutralize those demons.{nl}The demons that became neutralized would come to me.{nl}I will combine them with the spirits of Haubuck here.
QUEST_LV_0200_20150323_003740	The goddesses and the demons can't control each other's spirits easily, but it is possible through the revelator like you.
QUEST_LV_0200_20150323_003741	Thank you revelator..{nl}The demons you've sent, the Kupoles are combining the with the spirit of Haubuck.
QUEST_LV_0200_20150323_003742	The demons are also gathered at Ishishula which is little bit far from here.{nl}Use the rune of the night star there and neutralize them.{nl}My Kupoles would go there and receive them..
QUEST_LV_0200_20150323_003743	Since you helped me, the influence of me and the Kupoles is recovering in the prison.{nl}We can go anywhere and we can appear from anywhere.{nl}And I am always looking at you. Be confident revelator..
QUEST_LV_0200_20150323_003744	Due to your help, the Kupoles are combining with the spirits of Haubuck.{nl}We almost filled them..
QUEST_LV_0200_20150323_003745	There's a way to get more power of the demon spirits.{nl}Retrieve the symbols of the condemned criminals that we placed on them so that they can't use their power.{nl}Go to Etmesta isolated area and suppress the guys there. If you use the rune of the night star, you would be able to receive the symbol.
QUEST_LV_0200_20150323_003746	Me and the Kupoles could go anywhere in the prison, but I could not observe all of them besides.{nl}I engraved the symbol of the condemned criminal who committed most deadly sins so that they can't use their power.
QUEST_LV_0200_20150323_003747	With these symbols, we would be able to increase the size of Haubuck's spirits even more.
QUEST_LV_0200_20150323_003748	We collected enough power of the demon spirits to block the metastasis space.{nl}As me and my Kupoles block the metastasis space, you should protect us.
QUEST_LV_0200_20150323_003749	The root of the disaster that came to this place doesn't exist here anymore. You should receive the credit for this, revelator.{nl}Now we will call Haubuck. And we will eliminate the metastasis space here.
QUEST_LV_0200_20150323_003750	{nl}I am going to be here. If you need my help, come any time..
QUEST_LV_0200_20150323_003751	The demons hid into various places in the 5th district before I was able to fill the metastasis space when I arrived here..{nl}And many of them are concentrated near Banaga Monitor District, so please defeat them.
QUEST_LV_0200_20150323_003752	The number of Kupoles is increasing a lot..
QUEST_LV_0200_20150323_003753	If I disappear from this place a bit, this space would go wide again.{nl}I hope you find Laima fast..
QUEST_LV_0200_20150323_003754	Dionis is recovering fast due to you. Someday, she would protect us again near me..{nl}But she is suffering from the slow recovery while I am protecting this place.{nl}Can you defeat the demons that are at the Pasaru isolated place get me the empty spirits.
QUEST_LV_0200_20150323_003755	When Dionis gets recovered, you would be able to stabilize this prison without me.
QUEST_LV_0200_20150323_003756	Thanks. When Dionis comes back, it will be okay even if I leave this place for a while.
QUEST_LV_0200_20150323_003757	The small metastasis space is widening at the areas where we can't reach.{nl}The Kupoles all went to different districts so I have no way to block the metastasis space.{nl}Can you do it?
QUEST_LV_0200_20150323_003758	I have big debts to you, Gidrone and Aldona.
QUEST_LV_0200_20150323_003759	Thank you revelator.
QUEST_LV_0200_20150323_003760	As Aldona ordered me, I've been wating for you.
QUEST_LV_0200_20150323_003761	Do you think the circumstances would be better if we were to receive Laima's warning little sooner from Vakarine?
QUEST_LV_0200_20150323_003762	You ended the lengthy battle..{nl}Aldona and Gidrone, I will send the revelator so you guys should wait.
QUEST_LV_0200_20150323_003763	Please leave me alone..
QUEST_LV_0200_20150323_003764	The tricks fo the demons are becoming more vicious.{nl}That demon is waiting for the next victim by hiding its vicious energy.{nl}
QUEST_LV_0200_20150323_003765	It seems that Naktis found out why we came to the great cathedral.{nl}If that's not it, there's no reason that those demons are going after the reports that should be passed to Adel.
QUEST_LV_0200_20150323_003766	There's a marble which keeps spreading the curses.{nl}It's ineffective to destroy it. We can only stop the spreading of the curse through a sacred ritual ceremony.{nl}
QUEST_LV_0200_20150323_003767	If you find the marble next time, please bring it to me.
QUEST_LV_0200_20150323_003768	It seems that they are spreading the thoughts of Naktis..{nl}If we investigate about it, we may be able to use it well.
QUEST_LV_0200_20150323_003769	It is made by an interesting principle.{nl}Anyways, thanks for your cooperation.{nl}
QUEST_LV_0200_20150323_003770	Ah, if you get a chance to come back to the main church.. {nl}Could you pass this document to Aden disciple?
QUEST_LV_0200_20150323_003771	There were always holy prayers echoing in this great cathedral.{nl}But, after Naktis gets into this place, I can only see unfaithful behaviors.{nl}
QUEST_LV_0200_20150323_003772	My mission is to retrieve the sacred artifacts, but I can't stand and watch this anymore.{nl}Can you defeat the monsters that are roaming around the great cathedral?
QUEST_LV_0200_20150323_003773	Everyone is mad, but they are enduring it because they all have their missions.{nl}But, I can't stand..
QUEST_LV_0200_20150323_003774	There are many who trample on this sacred place.{nl}I can't forgive them.
QUEST_LV_0200_20150323_003775	I can still visualize those vicious beings.{nl}I can't forgive them in the name of the goddesses.
QUEST_LV_0200_20150323_003776	They should be ready to receive the punishment of the goddesses.{nl}I mean eternally.
QUEST_LV_0200_20150323_003777	I hope the goddesses always protect you.
QUEST_LV_0200_20150323_003778	The number of the demons reduced a lot, but there are still many of them.{nl}I can't forgive any of those demons.
QUEST_LV_0200_20150323_003779	If this cathedral gets purified, all credits would go to you.{nl}But, we still have a long way to go.
QUEST_LV_0200_20150323_003780	The demons that are spreading the vicious curses are still walking on the great cathedral.{nl}As a disciple under the name of the goddesses, how could I just leave this.
QUEST_LV_0200_20150323_003781	The disciples always have patience and mercy in their minds when they train.{nl}But, their patience and mercy are not for the demons.
QUEST_LV_0200_20150323_003782	You've done well, but there are still many demons left.{nl}When this mission is over, I am planning to receive the mission of purification.
QUEST_LV_0200_20150323_003783	We are in trouble. Hurry to Uolie worship place..{nl}I will tell you more about it when you get there.{nl}
QUEST_LV_0200_20150323_003784	But, the path has collapsed so the road is disconnected.{nl}There's no other way besides the wary around through the Pentence Route.{nl}Please Hurry!
QUEST_LV_0200_20150323_003785	Cursed Pilgrim
QUEST_LV_0200_20150323_003786	I am so hungry although I am keep eating.. Please get me some food..
QUEST_LV_0200_20150323_003787	Don't go without me.. Please get me something to eat..
QUEST_LV_0200_20150323_003788	Oh my god, so you are the one who saved me.{nl}I am sorry, but my body is not yet recovered..
QUEST_LV_0200_20150323_003789	I will take care of him beside until he gets completely removed from his curse.{nl}Maybe, I could also cure the other curses.
QUEST_LV_0200_20150323_003790	The curse of gluttony makes a person not to digest the food well.{nl}That's why the cursed people are always hungry. {nl}
QUEST_LV_0200_20150323_003791	After he gets out from the curse, he will be totally exhausted so I will take care of him beside.
QUEST_LV_0200_20150323_003792	Gitise
QUEST_LV_0200_20150323_003793	Revelator, we are in trouble. Please help us!{nl}As you can see, the workers are dying due to the poison of the monsters.
QUEST_LV_0200_20150323_003794	While we were clearing the forest to obtain some food as Uska ordered us, the incident occured.{nl}The monsters here were in fact not that vicious before, but now they have the poison.. I don't know what happened to them..
QUEST_LV_0200_20150323_003795	Pyromancer Master may help since he owes me something. {nl}Please. I am counting on you.
QUEST_LV_0200_20150323_003796	I know well because I am from this region.{nl}Even on Medis Diena, those monsters ran away from the people instead of using the poison.
QUEST_LV_0200_20150323_003797	But they attacked the workers with the poison.{nl}If we don't complete the farm, then we would have trouble supplying the food..
QUEST_LV_0200_20150323_003798	The monsters on that land?{nl}I can't belive it. I know it well since I used to go there a lot.
QUEST_LV_0200_20150323_003799	Long time ago, I had helped Pyromancer Master before..{nl}He is the only one we can rely on now.
QUEST_LV_0200_20150323_003800	But if Gitis told you like that, then it would be true.{nl}I owe something to Gitis.. Good. Let's find a way together.
QUEST_LV_0200_20150323_003801	First, we should find out why the monsters became vicious.{nl}Go back to the land and get me the samples of the monsters.
QUEST_LV_0200_20150323_003802	Pyromancer Master told you that he would help?{nl}That is so fortunate.
QUEST_LV_0200_20150323_003803	The monsters became vicious and the poison..{nl}There are so many things these days that can't be trusted.
QUEST_LV_0200_20150323_003804	Your skills are as I heard.{nl}Could you wait a sec? It wouldn't take that long to check.
QUEST_LV_0200_20150323_003805	I can feel the energy of the spell with the unknown poison.{nl}I am sure that the true nature of them lies somewhere on the land..
QUEST_LV_0200_20150323_003806	I can feel somthing scary from the samples.{nl}Please be careful..
QUEST_LV_0200_20150323_003807	The leather and the dagger with the magic field engraved on them.{nl}Unfortunately, they are not my specialities so I don't know about them well.
QUEST_LV_0200_20150323_003808	From this place, it will be better if we ask Bokor Master.{nl}No one can compete with him in terms of spells.
QUEST_LV_0200_20150323_003809	You want to know what spell is casted upon these objects?{nl}Hmm. It is a very filthy spell.{nl}
QUEST_LV_0200_20150323_003810	That's right. This spell spreads the poison that is pasted on the dagger.{nl}Everything near it.
QUEST_LV_0200_20150323_003811	You will find the answer to the question when you ask Bokor Master.{nl}I am sorry that I can't help you anymore.
QUEST_LV_0200_20150323_003812	But, I don't know what this poison is.{nl}But the dagger.. How about you go meet Ranger Master?
QUEST_LV_0200_20150323_003813	This dagger. Where is this from?{nl}Before you make me mad, you better tell me fast.
QUEST_LV_0200_20150323_003814	Ranger Master studied daggers for some time in the past.{nl}That was due to Ebonipon..Anyways he will give you the answer.
QUEST_LV_0200_20150323_003815	They were casted with the spell to spread the poison on that land?{nl}Hmm. I received a help from the unexpected place.{nl}
QUEST_LV_0200_20150323_003816	Anyways, this dagger belongs to Ebonipon. You can know by looking at the shape of the blade and the symbol. {nl}But I can't detoxify it. Anyways, we've got some clues.
QUEST_LV_0200_20150323_003817	Don't worry about that. Hunter master knows well about the poison.{nl}He is chasing after Ebonipon with me so he will definitely welcome you.
QUEST_LV_0200_20150323_003818	Can I help you with anything?{nl}So you want to know how to detoxify this poison...
QUEST_LV_0200_20150323_003819	How could he dare come to Klaipeda..{nl}Ebonipon. I will not miss you this time.
QUEST_LV_0200_20150323_003820	What happened to Pyromancer's task?
QUEST_LV_0200_20150323_003821	So should I just report about the task to Pyromancer Master?
QUEST_LV_0200_20150323_003822	Thanks for helping me.
QUEST_LV_0200_20150323_003823	I should reward you since you helped me.
QUEST_LV_0200_20150323_003824	These are the research documents. Tell Creomancer Master that you would hand over the research documents on behalf of Gitise.
QUEST_LV_0200_20150323_003825	It is so fortunate that it resolved well enough.
QUEST_LV_0200_20150323_003826	These are the research documents that I asked from Gitise. I will use them well.
QUEST_LV_0200_20150323_003827	Please take it to him quickly.
QUEST_LV_0200_20150323_003828	I am feeling little better now.
QUEST_LV_0200_20150323_003829	Soldier Denise
QUEST_LV_0200_20150323_003830	The expiry date for the farm construction is coming.{nl}Monsters have became suddenly vicious so the workers can't get their touches on them.
QUEST_LV_0200_20150323_003831	The other soldiers went to defeat Gorgon and I can't leave this place.{nl}The only one I can trust is you. I am counting on you.
QUEST_LV_0200_20150323_003832	Really? Thanks..{nl}The location is the joint arable land. I am counting on you!
QUEST_LV_0200_20150323_003833	Do you think this makes sense?{nl}Those monsters used to be scared of humans, but they now attack humans with their poison.
QUEST_LV_0200_20150323_003834	If it weren't you, Uska must have scolded me.. Thank you so much.{nl}Anyways, how come there is no order of return?
QUEST_LV_0200_20150323_003835	Ah, I am worried about it too much.{nl}I heard the monsters here were naive before, but they turned violent suddenly.{nl}
QUEST_LV_0200_20150323_003836	I don't know how the world would be like.{nl}And Alan, my colleague. He is protecting the entrance gate of the farm himself.{nl}
QUEST_LV_0200_20150323_003837	Can you really do that?{nl}If that's so, please take care of Alan before the other soldiers return.
QUEST_LV_0200_20150323_003838	Soldier Alan
QUEST_LV_0200_20150323_003839	Don't come! Monsters are coming!{nl}Damn, How would I able to stand anymore alone..
QUEST_LV_0200_20150323_003840	It's so fortunate that you are here.{nl}How come I can't hear anything from the soldiers who went to defeat Gorgon.
QUEST_LV_0200_20150323_003841	Was Alan okay?{nl}It is so fortunate that you were here, otherwise the whole district would have been swept away.
QUEST_LV_0200_20150323_003842	So you are the revelator that I heard from the rumors. Thank you so much.{nl}I don't know why those monsters turned out like that.
QUEST_LV_0200_20150323_003843	Louise
QUEST_LV_0200_20150323_003844	I received the farm land from Gitese, but it's such a mess.{nl}Especially Ridimed. But, what can I do with my hands that only touched hoes before.
QUEST_LV_0200_20150323_003845	I didn't know what to do, but it was so fortunate that I've met the goddesses.{nl}I am counting on you. It's already late to manage the crops.
QUEST_LV_0200_20150323_003846	So you really drove that tedious Ridimed away?{nl}That's such a good news.
QUEST_LV_0200_20150323_003847	It's so good to hear that you drove the Ridimed away.{nl}Now we should think about what to do.{nl}
QUEST_LV_0200_20150323_003848	I think it would be helpful if you can at least make a fence.{nl}Can you help me little more?
QUEST_LV_0200_20150323_003849	There are lots of woods from the cut down trees at the cultivation area.{nl}If you could bring me those, maybe we can make a fence.
QUEST_LV_0200_20150323_003850	Among the farms that were damaged on Medis Diena, there are lots of farms that can't be recovered.{nl}They either received vicious energies or there are too many monsters in them.{nl}
QUEST_LV_0200_20150323_003851	So it is Uska's thought that you should make the farm again by cultivating the forest.{nl}The restoration at the moment is important, but we can't do anything if we can't obtain the food supplies.{nl}
QUEST_LV_0200_20150323_003852	If the monsters were naive, I would have done it myself.{nl}We didn't have to make the fence in the first place.
QUEST_LV_0200_20150323_003853	Fortunately the woods are normal.{nl}Please wait a bit. I will make the fence quickly.
QUEST_LV_0200_20150323_003854	The scarecrow should scare the monsters, but it's size is too small.{nl}You should increase the size of the scarecrow. It will be good if you could use monsters' fluffy hair.
QUEST_LV_0200_20150323_003855	The size of the scarecrow should be bigger than humans.{nl}I will increase the size of the scarecrow using the hair of the monsters.
QUEST_LV_0200_20150323_003856	Good. Now we are ready to set the fence.{nl}There are still many monsters so I hope you can help me to do this.
QUEST_LV_0200_20150323_003857	I am worried about the monsters, but I am also worried whether we could reach the amount.{nl}Strangely, the crops don't grow anymore.
QUEST_LV_0200_20150323_003858	I appreciate you for making the fence.{nl}It will help the citizens of Klaipeda.
QUEST_LV_0200_20150323_003859	Researcher Gares
QUEST_LV_0200_20150323_003860	The speed of the crops' growth is too bad.{nl}If we don't solve this, we may miss the right time to harvest.. could you help me?
QUEST_LV_0200_20150323_003861	As Uska ordered, Gitis is leading the construction.{nl}Instead of taking the danger of restoring the farm that was polluted on Medis Diena, they want to cultivate the forest.{nl}
QUEST_LV_0200_20150323_003862	Originally, that land belonged to the city so the owner of the farm didn't have to come.{nl}But since there's food problem, they made the farm in the name of the city.
QUEST_LV_0200_20150323_003863	First, could you get me the samples of Sakmoli?{nl}That monster is plant-type so it must have received the same influence as the crops.
QUEST_LV_0200_20150323_003864	This is our last chance.{nl}If we don't find out why the crops grow slowly, we may have to give up on this place.
QUEST_LV_0200_20150323_003865	So you've got them.{nl}Please wait a bit. We will get the result soon.
QUEST_LV_0200_20150323_003866	So the monster suppressor was the problem.{nl}We were trying to prevent the number of monsters from increasing, but we almost ruined the crops as well.
QUEST_LV_0200_20150323_003867	First, please retrieve the monster suppressor.{nl}If we have a weaker device, we would switch it, but we can't do anything about it now.
QUEST_LV_0200_20150323_003868	These were made for plant-type monsters so they would also influence the crops for sure.{nl}It was my mistake that I didn't think about it deeply.
QUEST_LV_0200_20150323_003869	If it weren't you, we could have spoiled the harvest which we put in our enormous efforts in.{nl}They should grow well now right?
QUEST_LV_0200_20150323_003870	They are late. I mean, my colleagues who went to Ishigiti herb fields to defeat Gorgon.{nl}I don't wanna think that they were annihilated.
QUEST_LV_0200_20150323_003871	Soldier Purse
QUEST_LV_0200_20150323_003872	Run! Gorgon is coming!
QUEST_LV_0200_20150323_003873	I hope I was wrong.{nl}The monsters are going crazy..
QUEST_LV_0200_20150323_003874	You defeated Gorgon youself?{nl}It is fortunate that my colleagues are safe, but I don't know what they did as soldiers..{nl}
QUEST_LV_0200_20150323_003875	I will report to Uska that you saved this farm.{nl}Thank you so much!
QUEST_LV_0200_20150323_003876	Help me! Gorgon is chasing after us!
QUEST_LV_0200_20150323_003877	The person who is leading the mission at Dvasia Peak is Julian.{nl}Julian will really welcome me.
QUEST_LV_0200_20150323_003878	Thanks for your words.{nl}But it would be better to support Julian's squad at Dvasia Peak instead of this place.{nl}
QUEST_LV_0200_20150323_003879	I heard that the hardness and the elasticity of the wood sticks of Firent at Nepritas Cliffs is good.{nl}You can get the rope that was made from tieing those sticks from Red Pantos with spears. Please get me those first.
QUEST_LV_0200_20150323_003880	At first, they were gathered to Uskis Arable Land and Spring Light Wood.{nl}But, not after a long time, they came to this place.{nl}They must be going after the honey.
QUEST_LV_0200_20150323_003881	I think I can trust you more than any other revelators.{nl}If it's okay for you, could you look for Maras at Vilna Forest up there?
QUEST_LV_0200_20150323_003882	If something suspicious appears again near the wood observatory tower, please hand it over to Ramar.{nl}I.. really don't know.
QUEST_LV_0200_20150323_003883	You've gathered them a lot.{nl}I think this will be enough.
QUEST_LV_0200_20150323_003884	Damage is bigger than the one that was caused no the seal on the Uskis Arable Land.{nl}The vicious energy is flowing more stronger.{nl}
QUEST_LV_0200_20150323_003885	One thing I am worried about..{nl}That symbol has been destruced already so it may not be sealed perfectly.{nl}
QUEST_LV_0200_20150323_003886	I believe that the goddesses would protect us.{nl}But, we will also do our best to repair the seal.
QUEST_LV_0200_20150323_003887	I heard about the thorny forest before.{nl}That place was the forest before right? What should we do if our village turns like that?
QUEST_LV_0200_20150323_003888	I can't endure monsters' violence anymore.{nl}We will protect the village from now on instead of relying on the disciples only.
QUEST_LV_0200_20150323_003889	This didn't occur because Austeja goddess was absent right?{nl}However, if that's so, what should I do from now?
QUEST_LV_0200_20150323_003890	I will give you the scroll of purification so use this to the demons and defeat them.{nl}The fluids of demons would let you obtain the solvent that is purified with the sacred energy of the great cathedral.
QUEST_LV_0200_20150323_003891	You were able to avoid the curse, but you could not get away from the monsters.{nl}Maybe it was wrong to come here to do pilgrimage.
QUEST_LV_0200_20150323_003892	You will pay for your intent of obtaining the revelation.{nl}Of course, you should obtain the fourth key of Maven as well.
QUEST_LV_0200_20150323_003893	Finally, the last key.{nl}I've been waiting for this moment for hundreds of years..{nl}Somethig fills my mind.{nl}
QUEST_LV_0200_20150323_003894	The last secret is in the small reception room.{nl}You should remember the order of the candles and their amount.
QUEST_LV_0200_20150323_003895	The message of Maven
QUEST_LV_0200_20150323_003896	I am glad that the masterpiece of my life became the protective place of the revelation.{nl}But, you and my mission is not over yet.{nl}
QUEST_LV_0200_20150323_003897	Savior. Please open all the doors of Pasara Altar.{nl}If you really wish to obtain the revelation of the goddesses, you will receive it at the end..
QUEST_LV_0200_20150323_003898	My guide will end here.{nl}It was so fortunate that I was able to guide you well..{nl}
QUEST_LV_0200_20150323_003899	I am going back to the goddesses.{nl}Please.. save the kingdom and the goddesses.
QUEST_LV_0200_20150323_003900	Let's extract the energy of the curse from the Penitence Route and make it appear.{nl}While I am concentrating, please activate all the altars of purification.{nl}{nl}
QUEST_LV_0200_20150323_003901	The curse of Naktis makes people suffer just by looking at it.{nl}It makes people miserable.
QUEST_LV_0200_20150323_003902	We have no other choice, but to find the solutions for each curse.{nl}It's like there are different treatments to different diseases.
QUEST_LV_0200_20150323_003903	I want to go back to my hometown.{nl}Demons, curse.. I am tired of everything now.
QUEST_LV_0200_20150323_003904	When the next disciples come, I am planning to return to my hometown with them.{nl}It will be really good if I could return home while I am alive.
QUEST_LV_0200_20150323_003905	There's not only the curse of Naktis in this world.{nl}The curse of Roxonado Petricifation is still effective these days after hundreds of years.
QUEST_LV_0200_20150323_003906	The documents that are normal must still be present in the deeper side of the great cathedral..{nl}I am so sad that I wasn't able to see those.
QUEST_LV_0200_20150323_003907	I would say that was the wisdom of Maven.{nl}Maven thought that the great cathedral would not be normal all the time.{nl}
QUEST_LV_0200_20150323_003908	So if we could just recharge the magical power, any kinds of magics will be okay.{nl}Even if that's a magical power from the demons.
