QUEST_LV_0200_20150401_005668	Hmm? You defeated it since it was trying eat humans?{nl}Ah.. okay..{nl}Okay. I will report to the baron.
QUEST_LV_0200_20150401_005669	Somehow, I came up front.{nl}It's embarassing.{nl}I am just a tennant here.
QUEST_LV_0200_20150401_005670	We can make lots of weapons with the leather and the stonese.{nl}Right now, we don't have enough leather.
QUEST_LV_0200_20150401_005671	The monsters are perfect to get the materials.{nl}You can also get the leathers from the monsters.
QUEST_LV_0200_20150401_005672	Now we should collect some poison.{nl}It will be used diversely.
QUEST_LV_0200_20150401_005673	{nl}My grandmother taught me this method.{nl}It is the method to obtain some specific substancees from the things nearby.
QUEST_LV_0200_20150401_005674	The farming tools are used to crave the land so they can be also used as weapons.{nl}But, we definitely need the cooperation from the tenant famers..
QUEST_LV_0200_20150401_005675	Please extract some Nioles from there.{nl}Niole is a thankful flower.{nl}You can make soups with the grains and they can also be used as herbs.
QUEST_LV_0200_20150401_005676	The problem is that the food storage often gets attacked by the monsters.{nl}I have a colleague who is protecting there, but it's always dangerous.{nl}Could you help me a bit?
QUEST_LV_0200_20150401_005677	The food storage is at Vinoga Brewery.
QUEST_LV_0200_20150401_005678	I am counting on you for the storage
QUEST_LV_0200_20150401_005679	I am working for that day.
QUEST_LV_0200_20150401_005680	You've defeated all the monsters that were attacking the storage!{nl}Thanks.{nl}As we were about to attack, the storage keeper hid well since you helped.{nl}I should tell him to protect the storage well.
QUEST_LV_0200_20150401_005681	Are you the revelator?{nl}I often hear your stories even when I am in this kind of rural area.{nl}I am removing the magic fields that are stuck in the tenants' farm.
QUEST_LV_0200_20150401_005682	{nl}We are doing this kind of tasks to help Horaceus.{nl}Of course, I am doing the tasks for me as well.
QUEST_LV_0200_20150401_005683	I've doing this job til now..{nl}Now, we have about 3 left.
QUEST_LV_0200_20150401_005684	The seal magic field that was discovered in the fallow ground.. We should eliminate them.{nl}I can't break them since they have protective barrier.{nl}I will give you the stone of the blessing so try to break it by throwing this.{nl}
QUEST_LV_0200_20150401_005685	There's a magic field at the entrance of Tarvas.{nl}You should break that first.{nl}But the monsters always disturb it..
QUEST_LV_0200_20150401_005686	Now we are almost done!{nl}Thank you so much!
QUEST_LV_0200_20150401_005687	It seems that the pieces that he gave to me belong to the statue of the goddess.{nl}This must be.. the trace of those barons manipulating something on this ground and breaking it afterwards.{nl}You who collected these..
QUEST_LV_0200_20150401_005688	I am collecting the traces here.{nl}I can't tell you in details, but I am preparing for something big.{nl}To do that, I need to persuade the tenant farmers.{nl}So I am collecting those.
QUEST_LV_0200_20150401_005689	There's a magic field before you reach Ramus Intersection.{nl}And the smoke is coming up from the ground.{nl}That's called the strange energy.
QUEST_LV_0200_20150401_005691	Monsters fall into the eternal sleep.. dying..{nl}The monsters die due to the energy that is coming out from there..{nl}The monsters are tiresome and vicious.
QUEST_LV_0200_20150401_005692	{nl}The monsters fall into the eternal sleep due to that energy, that proves that the energy is not bad.
QUEST_LV_0200_20150401_005693	The amount of the crops after harvesting reduced a lot from some point of time in the past.{nl}Even if we care a lot, the crops wither easily.{nl}I think it may be due to the magic field that the barons created on this land.{nl}Could you help me out?
QUEST_LV_0200_20150401_005694	{nl}That's why the amount of the crops was reduced.{nl}I am trying to find the reason for it.
QUEST_LV_0200_20150401_005695	This magic field has some kind of protective barrier so it's not easy to break it.{nl}So I am trying to light it up.{nl}To break the shield, I should maintain the flame.
QUEST_LV_0200_20150401_005696	{nl}Should we kill those orange Dandells and throw kindlings on them?{nl}Try it.
QUEST_LV_0200_20150401_005697	The barons are pludering a lot these days and the magic fields like that have been created a lot across this region. Some of them are less shiny.{nl}Anyways, you get hurt from the ones that shine more so it's hard to eliminate them.
QUEST_LV_0200_20150401_005698	You came at the right time. I connected the pieces with some sticky stuff.{nl}.. As I expected. This is the statue of the goddess.{nl}I could only glue them like this with my skill.. It will break again if I don't do it well.{nl}I am sorry that I just glued them like this..
QUEST_LV_0200_20150401_005699	{nl}Hey, take it.
QUEST_LV_0200_20150401_005700	Oh really?{nl}Very well done!{nl}Too bad about the statue.. but the goddesses would forgive this.
QUEST_LV_0200_20150401_005701	There's a uncompleted seal magic field down there.{nl}The seal is not complete yet so the strange energy is coming out from it, but the problem is that it doesn't look like that.
QUEST_LV_0200_20150401_005702	{nl}It is suspicious.{nl}I have to connect these pieces, so can you find out more about the energy?
QUEST_LV_0200_20150401_005703	To accomplish a big task..{nl}You should first collect the clues.{nl}You can only persuade the tenant farmers with them.
QUEST_LV_0200_20150401_005704	The crops aren't growing.. There aren't anything to eat..
QUEST_LV_0200_20150401_005705	The enhancement of the magic field and the magical power supply are closely related to each other.
QUEST_LV_0200_20150401_005706	We are keep going to do the task to find ours and let the truth spreads.{nl}But, your task will end here.{nl}You can go on your way.{nl}I really thank you for helping us this far.
QUEST_LV_0200_20150401_005707	Revelator.{nl}We are now ready.{nl}Now, we are going to do our work.
QUEST_LV_0200_20150401_005708	Then, I will go into your small pocket.{nl}Don't forget. Trust no one.
QUEST_LV_0200_20150401_005709	The goddess wants you to eliminate all demons in the prison.{nl}The demons became unforgivable creatures after the day of the divine tree.
QUEST_LV_0200_20150401_005710	But, since the demons are coming through the space of the metastasis, it's not going to be easy.{nl}You should resist the demons that are trying to free the demon lord, Blut.
QUEST_LV_0200_20150401_005711	This place is not the world of humans or the demons' world, but it is another isolated place.{nl}We've locked the demons in this prison that are not helpful in this world.{nl}
QUEST_LV_0200_20150401_005712	It was like that before Medis Diena, but the circumstances have changed a lot.{nl}We now have reasons to destroy the demons. They caused Medis Diena.{nl}
QUEST_LV_0200_20150401_005713	But, it's not easy since the space of metastasis is keep enlarging.{nl}The demons are keep coming through the space of the metastasis.
QUEST_LV_0200_20150401_005714	Lots of demons are gathering at Rituala to paricipate the ritual to free Bluts.{nl}Please first defeat them.
QUEST_LV_0200_20150401_005715	The subordinates of the demon lord, Blut are trying to escape from here by breaking the power of the barrier.{nl}}Haubuck's help will be useful this time.
QUEST_LV_0200_20150401_005716	Well done. You've blocked the most emergent thing.{nl}Now it the time to block the power of the demon lord, Blut.
QUEST_LV_0200_20150401_005717	Finally I met the one whom my spirit was looking for.{nl}I am the demon lord, Haubuck. I have a suggetion to you.{nl}
QUEST_LV_0200_20150401_005718	Please help me to get a part of my spirit.{nl}The place where the goddess of the night star, Vakarine exists.. It will be an interesting suggestion to you.
QUEST_LV_0200_20150401_005719	Okay. The deal is established.{nl}Don't worry. I won't hurt you.
QUEST_LV_0200_20150401_005720	Strange.{nl}Unlike other humans, I can't possess your body.{nl}
QUEST_LV_0200_20150401_005721	We have no other choice. Take my seal piece and go in there.{nl}I will guide you from there.
QUEST_LV_0200_20150401_005722	Now, Gidrone is holding Blut.{nl}But, I don't know how much we can endure by ourselves.{nl}
QUEST_LV_0200_20150401_005723	We should somehow reduce the influence of the demon lord, Blut.{nl}Please take the secreting gland of Blut away from Blut's allies at Byeaulleo Hideout.
QUEST_LV_0200_20150401_005724	He is the head of the demons that are locked in this district.{nl}They are trying to control this prison somehow and looking for chances to escape from here.{nl}
QUEST_LV_0200_20150401_005725	Actually, Blut told the others proudly that Haubuck turned out like that because of him.{nl}There were followers to the demons that were increasing their influence and Haubuck was leading all that.{nl}
QUEST_LV_0200_20150401_005726	Blut thought that Haubuck was being presumptuous so he told about it to Giltine.{nl}That's why he got ripped off by Helgasercle.
QUEST_LV_0200_20150401_005727	Vakarine and the other Kupols are also having hard time.{nl}Let's finish our task here fast and go to a different district to help.
QUEST_LV_0200_20150401_005728	It will be a great help to Gidrone.{nl}I will eliminate this. Blut would feel like that he lost his feelers.
QUEST_LV_0200_20150401_005729	To defeat the demon lord, Blut completely, our power is not enough.{nl}I didn't want to do this, but let's try getting some help from Haubuck.{nl}
QUEST_LV_0200_20150401_005730	There's something which Blut accumulated the power in at the altar in the concentrated control district.{nl}Only demons could control it, but we have Haubuck.
QUEST_LV_0200_20150401_005731	When Haubuck absorbs that power, please go help Gidrone right away.{nl}To Nujicalti Hall. Hurry. We don't have enough time.
QUEST_LV_0200_20150401_005732	We are the attendants who are serving the goddesses.{nl}Our work differs depending on which goddess we serve.
QUEST_LV_0200_20150401_005733	Our original task was to manage and supervise the prison.{nl}Now, with Vakarine's control, our task is to close the space of the metastasis and defeat the demons.
QUEST_LV_0200_20150401_005734	The power of the demons reject the power of the goddesses.{nl}This role completely depends on Haubuck.
QUEST_LV_0200_20150401_005735	So you are the one who Vakarine mentioned.{nl}Good. The goddess will lead the everything.
QUEST_LV_0200_20150401_005736	I've locked Blut in the barrier of the prison, but he won't endure there for long time.{nl}We should attack all at once. Are you ready?
QUEST_LV_0200_20150401_005737	If we weren't able to defeat Blut here, Vakarine may have fallen down together.{nl}Hurry to the 2nd district. Medeina is waiting there.
QUEST_LV_0200_20150401_005738	Damn. The demons that lost their leader, Blut is trying to escape to the outer world.{nl}If they succeed on breaking the weak part of the barrier, a catastrophe would result.
QUEST_LV_0200_20150401_005739	The area where the influence of the goddesses could reach is getting smaller.{nl}We should somehow help out the goddesses..
QUEST_LV_0200_20150401_005740	Well done.{nl}If the demons come out to the outer world, a catastrophe would result.
QUEST_LV_0200_20150401_005741	The human expedition team actually came here.{nl}But, unfortunately, they all died.{nl}
QUEST_LV_0200_20150401_005742	I want to calm their spirits by finding their belongings.{nl}But, it's not easy since the demons are carrying them like their booties.
QUEST_LV_0200_20150401_005743	Humans should not come here.
QUEST_LV_0200_20150401_005744	Thanks. {nl}I hope there are no more sacrifices like this..
QUEST_LV_0200_20150401_005745	Kupol Medeina
QUEST_LV_0200_20150401_005746	We are in a trouble.{nl}The barrier of the goddess is breaking due to the mighty power of the demon lord, Nuaele.{nl}
QUEST_LV_0200_20150401_005747	Aldona went to face against Nuaele since he wants to resist some more.{nl}If you could reduce the mighty power of Nualele a bit.. It will help Aldona a lot!
QUEST_LV_0200_20150401_005748	The barrier of the goddess is like a great wall surrounding this prison.{nl}It will block the demons coming into the prison or escaping from here.{nl}
QUEST_LV_0200_20150401_005749	The space of the metastasis started to be created on the barrier due to the day of the divine tree.{nl}Vakarine is having hard time since she should maintain the barrier and face the demons at the same time.
QUEST_LV_0200_20150401_005750	Please hurry to the 1st district before the demons meet Nuaele. {nl}I want you to eliminate them.
QUEST_LV_0200_20150401_005751	Goddesses.{nl}Please protect Aldona..
QUEST_LV_0200_20150401_005752	Well done.{nl}Since you've defeated many demons and their power will be reduce a lot.
QUEST_LV_0200_20150401_005753	Nuaele is luring his subordinates and spreading his influence with the pieces of the seal of Haubuck.{nl}Haubuck should feel something.{nl}
QUEST_LV_0200_20150401_005754	There are more methods to increase the power of Haubuck using that.{nl}Haubuck would also want that.
QUEST_LV_0200_20150401_005755	Nuaele was in fact not that strong demon lord.{nl}But, after obtaining the seal piece of Haubuck, he spreaded his influence at a astonishingly fast pace.{nl}
QUEST_LV_0200_20150401_005756	After losing his master, Haubuck's subordinates started to follow him who has the piece of the seal.{nl}They are like betrayers to Haubuck.
QUEST_LV_0200_20150401_005757	Haubuck is retriving his manes that he gave to his subordinates as a symbol of their faithfulness.{nl}Now, go to the 2nd isolated area. They must be gathered there.
QUEST_LV_0200_20150401_005758	The subordinates of Haubuck are still following Nuaele as if he is Haubuck.{nl}But, if Haubuck retrieves his manes, they will know who is their true master.{nl}
QUEST_LV_0200_20150401_005759	Now, the demon lord, Nuaele would know it.{nl}In order to escapse from this prison, he should not only rely on his subordinates.{nl}But, its too late now.
QUEST_LV_0200_20150401_005760	By the way, Nuaele's behavior is somewhat strange.{nl}In fact, with the power that he accumulated secretly for a long time, he may just break the barrier and go out.{nl}
QUEST_LV_0200_20150401_005761	But, for us, we are waiting for someone that we don't know. {nl}I guess we should interrogate the subordinates of Nuaele.
QUEST_LV_0200_20150401_005762	I will give you the marbles that I received from the goddess.{nl}We, Kupols can't do it, but since Haubuck is a demon, he would be able to read our mind.
QUEST_LV_0200_20150401_005763	When the power of the goddesses get weak, the mighty power of us, Kupols also get weak.{nl}Furthermore, trying to disturb the minds of the demons, it's impossible.
QUEST_LV_0200_20150401_005764	He was thinking about changing the prison into his demonic world from the first place.{nl}If this place falls under the hands of him, even Ausrine can't do anything.
QUEST_LV_0200_20150401_005765	Since we've found the objective of Nuaele, let's get moving fast.{nl}
QUEST_LV_0200_20150401_005766	How about we first attack * monster at the 4th isolated area?{nl}If we could defeat it, it's like we are defeating one of the strongest weapons of Nuaele.
QUEST_LV_0200_20150401_005767	Haubuck was once the strong demon lord who led the biggest herd.{nl}After he was sealed, I thought no one as strong as him would appear again.{nl}
QUEST_LV_0200_20150401_005768	But, Nuaele is imitating as if he is Haubuck with the piece of the seal.{nl}He became the strongest demon lord at least in this place.
QUEST_LV_0200_20150401_005769	You will see the end of someone who tried to use other's power instead of using his power.
QUEST_LV_0200_20150401_005770	He was in fact the subordinate of Haubuck. Haubuck won't need him anymore.{nl}After Haubuck was sealed, he ran to Nuaele and handed over the seal piece to him.
QUEST_LV_0200_20150401_005771	Nuaele is disappeared, but his ramnents are gathering at the 1st isolated area.{nl}They are going to continue his mission. Get rid of those demons.
QUEST_LV_0200_20150401_005772	You gotta be careful more.{nl}Haubuck and Nuaele became the symbolic figures to them.
QUEST_LV_0200_20150401_005773	Many demons came here via the space of the metastasis to support the demon lord.{nl}It will be the same in other places as well. It became quiet as a result.
QUEST_LV_0200_20150401_005775	If it continues like this, the demons will stand up again.{nl}Help us so that the demons that are locked in the prison do not look down on us.
QUEST_LV_0200_20150401_005776	The demons look down on us.{nl}It will take a long time before the rules here get established here.
QUEST_LV_0200_20150401_005777	I will pass these necklaces to the sisters myself.{nl}May the goddesses protect you.
QUEST_LV_0200_20150401_005778	Nuaele is having the ritual ceremony to summon the demons in his district.{nl}But, all of his arms are legs are disconnected so its going to be easy to defeat him.{nl}
QUEST_LV_0200_20150401_005779	Go meet Aldona. {nl}He would take you to the area of Nuaele.
QUEST_LV_0200_20150401_005780	Without Aldona's help, you will never enter the area of Nuaele.{nl}You should be guided by Aldona.
QUEST_LV_0200_20150401_005781	Nuaele's behavior was something that can't be accepted.{nl}If he stayed quietly, he would have been forgiven.{nl}
QUEST_LV_0200_20150401_005782	Let's go to 3rd district.{nl}Vakarine is waiting for your help.
QUEST_LV_0200_20150401_005783	Haubuck and the savior.{nl}With help from you, I can now punish the demon lord, Baltrus.{nl}But the threat of the space of the metastasis still exists.{nl}
QUEST_LV_0200_20150401_005784	My poor Dionis..{nl}I will remove the strong power that is controlling her and close the space of the metastasis.{nl}
QUEST_LV_0200_20150401_005785	Complete the key of night star by helping Gidrone.{nl}With that key, you will be able to remove the power from Dionis.
QUEST_LV_0200_20150401_005786	The strong power that we tried to protect from Baltrus is controlling the ego of Dionis.{nl}Fortunately, that power can be detached and be put in the key of the night star.{nl}
QUEST_LV_0200_20150401_005787	Plese close the space of the metastasis that are on the scar of the metastasis first.{nl}Because of the waves coming out from the space, I can't hardly focus on the ritual.
QUEST_LV_0200_20150401_005788	We don't know exactly what is the strong power that is controlling Dionis.{nl}We just know that it could close the space of the metastasis and it should not be stolen.{nl}
QUEST_LV_0200_20150401_005789	While the goddess was maintaining the barrier of the prison, she also had to fight against Baltrus at the same time.{nl}If the goddess gets defeated, that power can't be protected..{nl}
QUEST_LV_0200_20150401_005790	The goddess had to make a hard decision.{nl}Until the prison gets stabilized, she will seal the power to Dionis who is like family to her.
QUEST_LV_0200_20150401_005791	Dionis is the guardian who Vakarine most takes care.{nl}She reluctantly sealed the strong power to Dionis and fell into the deep sadness..
QUEST_LV_0200_20150401_005792	We can start the ritual now.{nl}When the key of the night star gets completed, we could probably retrieve the ego.
QUEST_LV_0200_20150401_005793	We could go to Orualma grand corridor to put the power of the goddess into the key of the night star.{nl}As I am charging the key, please protect me from the demons.
QUEST_LV_0200_20150401_005794	It's all completed. Please hand over this key to Aldona.{nl}Aldona is blocking the attacks of Dionis so please hurry up.
QUEST_LV_0200_20150401_005795	Soon.. We would collapse.{nl}Dionis is too strong to face against by us, Kupols.{nl}
QUEST_LV_0200_20150401_005796	Vakarine saved some power to prepare for the worst outcome.{nl}With the key of the night star, please unleash the seals of Rewalda, Casa and Rada seals.
QUEST_LV_0200_20150401_005797	The problem is the time.{nl}If you are late, Vakarine can't do anything.
QUEST_LV_0200_20150401_005798	The power of the goddesses is accumulating at the magical suppressor.{nl}We are now all ready. And we have enough time.
QUEST_LV_0200_20150401_005799	We will now remove the power from Dionis.{nl}If we fail, Dionis may escape from here with the power.{nl}
QUEST_LV_0200_20150401_005800	It's going to bring the same result like unleashing tens of demon lords.{nl}You should approach it carefully. Tell me when you are ready.
QUEST_LV_0200_20150401_005801	The direction where Haubuck ran away is the 4th district where Daiva is protecting.{nl}First, go back to the goddess. I will take care of Dionis.
QUEST_LV_0200_20150401_005802	Savior. You are now ready to know the truth.{nl}The reason why I am just leaving Haubuck like that is because he too is the key to close the space of the metastasis.{nl}
QUEST_LV_0200_20150401_005803	The power that he took away from Dionis is called the chain of revivification.{nl}He was planning to close the space of the metastasis using that chain and the spirit of Haubuck.{nl}
QUEST_LV_0200_20150401_005804	But since you are here, it's not too late.{nl}The 4th district, the place where he ran away to is like a maze. Daiva will be able to chase after him.
QUEST_LV_0200_20150401_005805	How come Vakarine left Haubuck to go crazy like that..{nl}I guess she must have a reason for that.
QUEST_LV_0200_20150401_005806	Even if we defeat Baltrus, that doesn't mean we have peace in this prison.{nl}The demons who lost their leader is going crazy here.{nl}
QUEST_LV_0200_20150401_005807	His subordinates are keep gathering at the grand corridor of Orualma. {nl}Please defeat them.
QUEST_LV_0200_20150401_005808	We, Kupols are different.{nl}Even if the goddesses are not around, we don't get violent.{nl}
QUEST_LV_0200_20150401_005809	We are the symbol of the rules and the principles.
QUEST_LV_0200_20150401_005810	The goddesses rest at the grand corridor and recover her power.{nl}That's why it has to be safe all the time from the demons. Thank you so much.
QUEST_LV_0200_20150401_005811	Dionis is weak.{nl}If you could find his toenails, he will recover his energy.{nl}
QUEST_LV_0200_20150401_005812	There are many demons who ran away after getting attacked by Dionis near Rewalda seal.{nl}You may find the toe nails of Dionis from them.
QUEST_LV_0200_20150401_005813	Dionis was originally the normal creature from the human world.{nl}Vakarine accepted him who was playing with the demons violently.{nl}
QUEST_LV_0200_20150401_005814	Now he is the most faithful guardian of Vakarine.{nl}He lost his conciousness due to that power, but he must be suffering a lot himself.
QUEST_LV_0200_20150401_005815	Vakarine will recover fast when Dionis recovers.{nl}There are many things for Dionis to do other than that.
QUEST_LV_0200_20150401_005816	Thanks. {nl}This will greatly help Dionis who is very weak at the moment.
QUEST_LV_0200_20150401_005817	When Dionis lost his ego, Rada seal may have broken down.{nl}Fortunately, he regained his conciousness before that, but he could not save the symbol of the star.{nl}
QUEST_LV_0200_20150401_005818	Please collect the pieces of the symbol of the star that are scattered near Rada seal.{nl}It will help the goddess to recover her power.
QUEST_LV_0200_20150401_005819	The power of Dionis is astonishing.{nl}Even violent Baltrus was busy running away instead of touching him.
QUEST_LV_0200_20150401_005820	Thanks. {nl}If the goddesses recover, Dionis would also recover.
QUEST_LV_0200_20150401_005821	Haubuck just passed here.{nl}I am sure that he is trying to break the barrier of the goddess who hasn't been fully recovered and escape by breaking the barrier.{nl}
QUEST_LV_0200_20150401_005822	The barrier at the Nevirau collapsed area is most weak so he must have went there.{nl}Hurry and follow him. I will block the route.
QUEST_LV_0200_20150401_005823	Now, Haubuck is risking everything he's got.{nl}Now is the only chance that he can restore everything about him.
QUEST_LV_0200_20150401_005824	It won't be effective even if Haubuck tries anything.{nl}I will be keep pushing him. Let's chase him til the end.
QUEST_LV_0200_20150401_005825	It seems that the subordinates of Haubuck are coming again.{nl}I think he's trying to deceive us by giving the pieces of the spirit to his subordinates, and that's also what we want.{nl}
QUEST_LV_0200_20150401_005826	Please collect the pieces of the spirit by defeating the subordinates of Haubuck at the internal isolated area.{nl}Our objective is to collect more pieces of his spirit.
QUEST_LV_0200_20150401_005827	I will chase after Haubuck while I am collecting the pieces of the spirit.{nl}Let's meet in front of Idinga poisonous area.
QUEST_LV_0200_20150401_005828	Even if Haubuck does something, this is inside the prison.{nl}As long as we are chasing, Haubuck could never run away.
QUEST_LV_0200_20150401_005829	Well done. {nl}They have succeeded stopping our way, but they won't have enough time.
QUEST_LV_0200_20150401_005830	They are trying to escape by borrowing the bodies of his subordinates. {nl}Let's keep searching by defeating the demons that contains Haubuck. Until he gives up.
QUEST_LV_0200_20150401_005831	Please take this illuminating sphere of the night star.{nl}We can find Haubuck easily with this.
QUEST_LV_0200_20150401_005832	I will push Haubuck to the single path where he won't be able to run away.{nl}If he tries to give up and run away, I will block here.
QUEST_LV_0200_20150401_005833	Don't worry too much even if he runs away.{nl}It's going well as planned.
QUEST_LV_0200_20150401_005834	Success!{nl}No more escaping.
QUEST_LV_0200_20150401_005835	We will start the hunting from now on.{nl}There is only single path in front so Haubuck would resist hard.{nl}
QUEST_LV_0200_20150401_005836	Push Haubuck into Galutin poisonous room.{nl}Don't worry since Sigita is blocking Haubuck's exit at the opposite side.
