QUEST_LV_0200_20150317_001934	Since you passed the order to the soldier, Paulter, go back to the commander, Julian and talk to him.
QUEST_LV_0200_20150317_001935	Talk with the commander, Oruke
QUEST_LV_0200_20150317_001936	The commander Julian wants you to support the army since Oruke soldiers were wounded a lot due to many battles. Talk with the commander Oruke at Beltui Intersections.
QUEST_LV_0200_20150317_001937	You defeated Infrogalas that suddenly attacked. Talk with the commander, Oruke.
QUEST_LV_0200_20150317_001938	Defeat the Wood Goblin that is attacking
QUEST_LV_0200_20150317_001939	Talk with the Owl Sculpture that is leaving
QUEST_LV_0200_20150317_001940	There is an owl sculpture that seems to have something to say. Talk with the owl sculpture that is leaving.
QUEST_LV_0200_20150317_001941	Defeat TreeGool at Byreti empty lot
QUEST_LV_0200_20150317_001942	The soldiers want to help out the owls that are leaving. On behalf of the owls that are leaving, defeat TreeGools at Byreti empty lot.
QUEST_LV_0200_20150317_001943	Report to the Owl Sculptures that are leaving
QUEST_LV_0200_20150317_001944	It seems that you defeated all TreeGools you can find. Report to the owl sculpture that is leaving.
QUEST_LV_0200_20150317_001945	Defeat TreeGools
QUEST_LV_0200_20150317_001946	Talk with Oruke
QUEST_LV_0200_20150317_001947	The commander, Oruke was astonished by your skills after seeing you defeating the monsters that attacked suddenly. Talk with the commander, Oruke.
QUEST_LV_0200_20150317_001948	Look for the soldier at Niurus Highway
QUEST_LV_0200_20150317_001949	The commander, Oruke is saying that the soldiers who were dispatched to the operation did not come back. Go to Niurus Highway and look for the soldiers.
QUEST_LV_0200_20150317_001950	Talk with the soldier, Kalus
QUEST_LV_0200_20150317_001951	You saved the soldier, Kalus who was running away from the monsters. Talk with the soldier, Kalus.
QUEST_LV_0200_20150317_001952	Defeat the monster that is threatening the soldiers
QUEST_LV_0200_20150317_001953	Talk with the owl sculpture that is settled
QUEST_LV_0200_20150317_001954	There is an owl sculpture that is hesistating. Talk with the owl sculpture that is settled.
QUEST_LV_0200_20150317_001955	Defeat Wood Goblins around
QUEST_LV_0200_20150317_001956	The owl that is settled wants to pay back to the soldiers who saved it. To help the soldiers, please defeat nearby RavineLervas.
QUEST_LV_0200_20150317_001957	You defeated all nearby RavineLervas. Talk with the settled owl.
QUEST_LV_0200_20150317_001958	Defeat RavineLervas
QUEST_LV_0200_20150317_001959	Talk with the soldier Dainews
QUEST_LV_0200_20150317_001960	The soldier Dainews is trembling from the fear. To look for the other soldiers, Talk with Dainews.
QUEST_LV_0200_20150317_001961	Look for the other soldiers in Drieza dried fields.
QUEST_LV_0200_20150317_001962	The soldier, Dainews told you that there may be other soldiers on Drieza dried fields. Go to Drieza dried fields and look for the soldiers there.
QUEST_LV_0200_20150317_001963	Defeat ronbaum
QUEST_LV_0200_20150317_001964	Find the grave at the Sunset Flag Forest
QUEST_LV_0200_20150317_001965	Find the grave at the Sunset Flag Forest
QUEST_LV_0200_20150317_001966	Defeat the gigantic monster at Kaklas Cliffs
QUEST_LV_0200_20150317_001967	Please defeat the gigantic mushroom-like looking monster at Kakals Cliffs
QUEST_LV_0200_20150317_001968	Defeat Mushwort
QUEST_LV_0200_20150317_001969	The gigantic monster was Mushwort
QUEST_LV_0200_20150317_001970	Find the messenger
QUEST_LV_0200_20150317_001971	Commander Vacenin is so messenger in the depths of the forest is worried. Please go after him if you Probably not want to become around Sagittarius.
QUEST_LV_0200_20150317_001972	Find the messenger at the worried place
QUEST_LV_0200_20150317_001973	The commander Basenin is worried about the messenger and asked you to search for him. Find the messenger near the worried place.
QUEST_LV_0200_20150317_001974	Talk with the fallen messenger
QUEST_LV_0200_20150317_001975	Retrieve the bag of the messenger and talk to him.
QUEST_LV_0200_20150317_001976	Defeat the monsters who attacked the messenger
QUEST_LV_0200_20150317_001977	Talk with Scott
QUEST_LV_0200_20150317_001978	He has to go to Katyn Forest to look for the sculptor, but it is too dangerous to cross there due to an unknown incident. Ask him what you can do for him.
QUEST_LV_0200_20150317_001979	Scott wants to investigate the moss. Please collect the moss from the dock.
QUEST_LV_0200_20150317_001980	We have enough moss to be investigated. Go back to Scott
QUEST_LV_0200_20150317_001981	Collect %s stuck on a rock
QUEST_LV_0200_20150317_001982	Scott heard from the soldiers from the felled area that the grass that has unique color is growing. Collect the unique grass from Naudingas felled area.
QUEST_LV_0200_20150317_001983	You have collected enough unique grass. Go back to Scott.
QUEST_LV_0200_20150317_001984	Gather %s
QUEST_LV_0200_20150317_001985	You should cross here to look for the sculptor of Katyn Forest which the revelation of the goddess is indicating, but the man with unnormal clothes is investigating something diligently. Talk to him what's going on.
QUEST_LV_0200_20150317_001986	Scott said he came here to investigate the dangerous incident that occured here and suggested you to move with him. To aid his investigation, please collect the tree barks from Vubbes that are carrying spears.
QUEST_LV_0200_20150317_001987	You have collected enough tree barks. Go back to Scott.
QUEST_LV_0200_20150317_001988	Obtain %s by defeating Red Vubbes
QUEST_LV_0200_20150317_001989	Talk with Yukirt
QUEST_LV_0200_20150317_001990	You thwarted the conspiracy to make the Woodspirits, but you should get rid of the Woodspirits that were already created. Talk with Yukirt.
QUEST_LV_0200_20150317_001991	Defeat Woodspirits
QUEST_LV_0200_20150317_001992	Defeat Woodspirits that are the source of the bad rumor of the Forgotten Dock.
QUEST_LV_0200_20150317_001993	You finally defeated the Woodspirits that were the source of the bad rumor of the Forgotten Dock. Go back to Yukirt.
QUEST_LV_0200_20150317_001994	Talk with the scary Owl Sculpture
QUEST_LV_0200_20150317_001995	The scary owl sculpture is calling you desperately. Talk with the scary owl sculpture.
QUEST_LV_0200_20150317_001996	Give it to the earnest commander owl sculpture
QUEST_LV_0200_20150317_001997	The scary owl asked you to send it's friend's wing piece. Hand over the piece to the earnest commander owl sculpture at Neuoder Fields.
QUEST_LV_0200_20150317_001998	Talk with the earnest commander owl sculpture
QUEST_LV_0200_20150317_001999	The earnest commander owl looks sad after receiving the wing piece. Talk with the earnest commander owl.
QUEST_LV_0200_20150317_002000	Send the wing to the determined owl sculpture
QUEST_LV_0200_20150317_002001	The earnest commander owl wants you to pass his wing that is endowed with the power of the goddess to the owls in this region. Give the wing piece to the determined owl sculpture at Konpiska Hills.
QUEST_LV_0200_20150317_002002	Hand the wing piece to the agonizing owl sculpture
QUEST_LV_0200_20150317_002003	The earnest commander owl wants you to pass his wing that is endowed with the power of the goddess to the owls in this region. Give the wing piece to the determined owl sculpture at Rabbit Grass Hills.
QUEST_LV_0200_20150317_002004	Report to the earnest commander owl sculpture
QUEST_LV_0200_20150317_002005	You've handed over the wing pieces to all owls. Go back to earnest commander owl and report.
QUEST_LV_0200_20150317_002006	Defeat the monsters that are attacking the owl sculpture
QUEST_LV_0200_20150317_002007	Talk with patrolling officers
QUEST_LV_0200_20150317_002008	There is a patrolling officer who is staring at me for some time. Talk to him.
QUEST_LV_0200_20150317_002009	Light up the fireplace
QUEST_LV_0200_20150317_002010	The patrolling officer asked you to light up the extinguished fireplace. Light up the fireplace for him.
QUEST_LV_0200_20150317_002011	You lit up the extinguished fireplace. Talk with the patrolling officer again.
QUEST_LV_0200_20150317_002012	Light up the fireplace.
QUEST_LV_0200_20150317_002013	Talk with the commander, Felix
QUEST_LV_0200_20150317_002014	On behalf of the messenger who can hardly move, tell Felix that the operation has started.
QUEST_LV_0200_20150317_002015	Talk with the commander Basenin
QUEST_LV_0200_20150317_002016	Go back to Basenin and tell him that the messenger is safe
QUEST_LV_0200_20150317_002017	The grave protecting owl seems to want something. Talk with the grave protecting owl.
QUEST_LV_0200_20150317_002018	Collect two spirit stones
QUEST_LV_0200_20150317_002019	The grave protecting owl says there is a spirit with the great resentment and wants to have the spirit. Obtain the two spirit stones to summon the spirit.
QUEST_LV_0200_20150317_002020	It seems that you have collected all spirit stones to summon the spirit. Go back to the grave protecting owl.
QUEST_LV_0200_20150317_002021	Talk with the grave protecting owl
QUEST_LV_0200_20150317_002022	It seems that something is still lacking with only spirit stones. Talk with the grave protecting owl.
QUEST_LV_0200_20150317_002023	Summon the corrupted spirit and defeat it
QUEST_LV_0200_20150317_002024	The grave protection owl wants to have only the pure part of the spirit. Put the spirit stone into the holy box and purify it.
QUEST_LV_0200_20150317_002025	It seems that you purified the spirit as the grave protection owl wanted. Go back to the grave protection owl.
QUEST_LV_0200_20150317_002026	Obtain %s by defeating the collapsed spirit
QUEST_LV_0200_20150317_002027	The desperate owl has something to do. Talk with the owl.
QUEST_LV_0200_20150317_002028	Collect Miduza Larvae
QUEST_LV_0200_20150317_002029	The desperate owl says it wants to save some spirits. Collect Miduza Larvae that absorb the memories of spirits.
QUEST_LV_0200_20150317_002030	It seems that you collected enough memories of spirits. Hand them over to the desperate owl.
QUEST_LV_0200_20150317_002031	Talk with the spirit of the escort soldier that has lots of regrets
QUEST_LV_0200_20150317_002032	The spirit of escort soldier that has lots of regrets is desperately looking for her. Talk with the spirit again.
QUEST_LV_0200_20150317_002033	Defeat Colimenprus near the wagon
QUEST_LV_0200_20150317_002034	The spirit of escort soldier has to protect her, but he is too exhausted to use any remaining energy. Get rid of the Collimenprus near the wagon for the spirit.
QUEST_LV_0200_20150317_002035	As you eliminated Collimenprus near the wagon, the spirit is satisfied.
QUEST_LV_0200_20150317_002036	Defeat Collimenprus
QUEST_LV_0200_20150317_002037	Talk with the spirit of the merchant with many regrets
QUEST_LV_0200_20150317_002038	It seems that there is a spirit that is rejecting the salvation since it has many regrets in this world. Find the spirit of the merchant with many regrets and talk to him.
QUEST_LV_0200_20150317_002039	Find the luggage of the merchant with many regrets
QUEST_LV_0200_20150317_002040	The merchant is not satisfied for losing all of his luggage. Do you think you will be saved if you find all of his luggage?
QUEST_LV_0200_20150317_002041	After you found all the luggage, the spirit of the merchant with many regrets seems to be satisfied now.
QUEST_LV_0200_20150317_002042	Talk with the spirit of the scholar with many regrets
QUEST_LV_0200_20150317_002043	The spirit of the scholar with many regrets were trying to help someone. Talk with the spirit again.
QUEST_LV_0200_20150317_002044	Retrieve the ripped order paper
QUEST_LV_0200_20150317_002045	The spirit told you that he needs the order paper to save her. Retrieve the ripped paper from Lapasape.
QUEST_LV_0200_20150317_002046	After you found the order paper, the spirit seems to be happy.
QUEST_LV_0200_20150317_002047	Talk with the wandering adventurer's spirit
QUEST_LV_0200_20150317_002048	It seems that you found the spirit of the wandering adventurer that doesn't know what to do. Talk with the spirit.
QUEST_LV_0200_20150317_002049	Write down what's in the epitaph
QUEST_LV_0200_20150317_002050	The spirit of the wandering adventurer finally found the the epitaph, but somehow he can't move. For the adventurer, copy down what's on the epitaph.
QUEST_LV_0200_20150317_002051	The spirit of the wandering adventurer seems to be satisfied now. Go back to the desperate owl sculpture.
QUEST_LV_0200_20150317_002052	Talk with the desperate owl sculpture
QUEST_LV_0200_20150317_002053	I can see the shade from the desperate owl. Talk with the desperate owl.
QUEST_LV_0200_20150317_002054	The desperate owl is scared of dying in the flames of Sequoia. Extinguish the flames of Sequoia for the desperate owl.
QUEST_LV_0200_20150317_002055	It seems that the flames of Sequoia are not strong anymore. Go back to the desperate owl.
QUEST_LV_0200_20150317_002056	Talk to the commander, Danews
QUEST_LV_0200_20150317_002057	You can see the commander, Danews who looks exhausted. Talk with the commander.
QUEST_LV_0200_20150317_002058	Defeat the monsters that are going after the squad behind
QUEST_LV_0200_20150317_002059	The commander Danews says that his squad is isolated due to the monsters. Defeat the monsters nearby for the squad of Danews.
QUEST_LV_0200_20150317_002060	I think the squad can be freed from the monsters now. Talk to the commander, Danews.
QUEST_LV_0200_20150317_002061	Talk with the weak owl sculpture
QUEST_LV_0200_20150317_002062	There are many owl sculptures that lead spirits in Katyn Forest. Listen to the story of the weak owl sculpture.
QUEST_LV_0200_20150317_002063	Collect the corpses of the soldiers
QUEST_LV_0200_20150317_002064	They were the soldiers with pitiful stories. After collecting their corpses, take them to the weak owl.
QUEST_LV_0200_20150317_002065	The weak owl that should calm the soldiers seems to be in trouble. Talk with the weak owl.
QUEST_LV_0200_20150317_002066	Collect the belongings of the soldiers
QUEST_LV_0200_20150317_002067	The weak owl tries to calm the dead soldiers with the corpses, but since it is weak it can't calm others. To calm the dead soldiers, collect the belongings of the dead soldiers.
QUEST_LV_0200_20150317_002068	Talk with the weak owl with the belongings of the dead soldiers that you gathered.
QUEST_LV_0200_20150317_002069	Obtain %s by defeating Ellomago
QUEST_LV_0200_20150317_002070	The belongings of the soldiers
QUEST_LV_0200_20150317_002071	The dead soldiers seem to be satisfied with the belongings of theirs. Talk with the weak owl.
QUEST_LV_0200_20150317_002072	Collect the fragrance of butterflies
QUEST_LV_0200_20150317_002073	The weak owl wants to give the fragrance of the hometown to the dead soldiers who followed it well as a gift. Collect the fragrance of butterflies from the bushes with broad leaves.
QUEST_LV_0200_20150317_002074	It seems that you collected enough fragrance of butterflies that you will give to the dead soldiers. Let's go back to the weak owl.
QUEST_LV_0200_20150317_002075	The prayer for the pitiful spirits
QUEST_LV_0200_20150317_002076	The spirits that passed away sadly sleep at the garden of comfort near the statue of the goddess. Pray in front of the statue of the goddess and calm the spirits.
QUEST_LV_0200_20150317_002077	Perform the memorial ceremony
QUEST_LV_0200_20150317_002078	As you prayed in front of the goddess, the spirits with regrets started to gather to the statue of the goddess! Protect these spirits within a specified time frame.
QUEST_LV_0200_20150317_002079	Talk with the sculpture of the sad owl
QUEST_LV_0200_20150317_002080	There are many owl sculptures that guide the spirits in Katyn Forest. Listen to the story of the sad owl sculpture.
QUEST_LV_0200_20150317_002081	Collect the leaves of Ridimedi
QUEST_LV_0200_20150317_002082	The sad owl is saying that Throneweavers keep trying to destroy the owls. Lure the Throneweavers out and obtain the leaves from Ridimedis.
QUEST_LV_0200_20150317_002083	You have collected enough leaves of Ridimedis that the weavers like. Let's go back to the sad owl.
QUEST_LV_0200_20150317_002084	The leaves of Ridimedis
QUEST_LV_0200_20150317_002085	You have collected enough leaves of Ridimedis that weavers like. Let's go back to the sad owl.
QUEST_LV_0200_20150317_002086	Obtain the roots of Sakmolis
QUEST_LV_0200_20150317_002087	The sad owl suggested to you to use the roots of Sakmolis to lure out the Throneweavers. Collect the roots of Sakmolis.
QUEST_LV_0200_20150317_002088	You have obtained the roots of Sakmolis. Talk with the sad owl about what to do next from now on.
QUEST_LV_0200_20150317_002089	The roots of Sakmolis
QUEST_LV_0200_20150317_002090	Talk with the embarassed owl sculpture
QUEST_LV_0200_20150317_002091	There are many owl sculptures that lead the spirits in Katyn Forest. Listen to the stories of the embarassed owl sculptures.
QUEST_LV_0200_20150317_002092	Rescue the spirit of the restrained soldier
QUEST_LV_0200_20150317_002093	The embarassed owl told you that the spirits that were lured towards you are not coming starting from some day in the past. Find out what happened to the spirits and do something to make them move again.
QUEST_LV_0200_20150317_002094	The spirits are tied to the branches. By releasing the spirits from the restraints? would you be able to find out the origin of the vicious energies? Talk to the embarrassed owl again.
QUEST_LV_0200_20150317_002095	Talk with the sorrowful owl sculptures
QUEST_LV_0200_20150317_002096	There are not only restrained spirits among wandering spirits. Listen to the detailed story from the sorrowful owl.
QUEST_LV_0200_20150317_002097	Persuade the spirit that lost its way
QUEST_LV_0200_20150317_002098	The sorrowful owl told you that the spirits that went to the statue of the goddess for comfort are agonizing themselves so something must be wrong. Persuade the spirits that try to go to the statue of the goddess and take them to the sorrowful owl.
QUEST_LV_0200_20150317_002099	The sorrowful owl heard enough stories about what's happening to the spirits. Go back to the sorrowful owl and ask what happened.
QUEST_LV_0200_20150317_002100	The sorrowful owl talked enough with the spirits. Talk to the sorrowful owl again.
QUEST_LV_0200_20150317_002101	Find out what happened at Amolallul Hills.
QUEST_LV_0200_20150317_002102	The spirits are claming that the statue of the goddess at Amolallul Hills were calling them but, the sorrowful owl told you that the statue wasn't there. Go to Amollaul Hills to find out exactly what happened.
QUEST_LV_0200_20150317_002103	Corrupteds are residing at the statue of the goddess. Demons calling themselves as the goddesses can never happen. Go back to the sorrowful owl and tell this fact.
QUEST_LV_0200_20150317_002104	Defeat the gray Golem that suddenly appeared
QUEST_LV_0200_20150317_002105	Advance to defeat the gray Golem that suddenly appeared
QUEST_LV_0200_20150317_002106	After you touched an unknown monster, the gray Golem suddenly appeared!
QUEST_LV_0200_20150317_002107	Defeat the gray Golem that suddenly appeared
QUEST_LV_0200_20150317_002108	Talk to the spirit of the commander
QUEST_LV_0200_20150317_002109	The spirits of the soldiers who weren't chosen for the salvation and the spirits that look like the commander don't know what to do. Talk to them.
QUEST_LV_0200_20150317_002110	Collect the hard tree legs of Bushspider
QUEST_LV_0200_20150317_002111	The spirit of the commander is saying that he will get revenge on the monster who killed him and asked you to bring hard tree legs from Bushspiders.
QUEST_LV_0200_20150317_002112	It seems that you collected all the hard tree legs that the spirit of the commander asked you to collect. Go back to the commander.
QUEST_LV_0200_20150317_002113	Collect %s from Bushspiders
QUEST_LV_0200_20150317_002114	Something seems to be lacking with only tree legs. Let's talk with the spirit of the commander.
QUEST_LV_0200_20150317_002115	Collect the shells that are making rustling sounds
QUEST_LV_0200_20150317_002116	The spirit of the commander is trying to make it look like a human by tieing the tree poles. Let's collect the shells that are making rustling sounds from old Kepas.
QUEST_LV_0200_20150317_002117	You have collected enough shells. Go back to the spirit of the commander.
QUEST_LV_0200_20150317_002118	Collect %s from Old Kepas
QUEST_LV_0200_20150317_002119	Obtain rustling shells
QUEST_LV_0200_20150317_002120	It seems that you have collected enough ingredients to make a bait. Talk to the spirit of the commander.
QUEST_LV_0200_20150317_002121	The experiment on the bait of the demons
QUEST_LV_0200_20150317_002122	You have completed making the bait for the demons, but the spirit of the commander doesn't seem convinced that it works. Let's use the bait on other monsters to see if it's working properly.
QUEST_LV_0200_20150317_002123	Fortunately, the monsters are reacting to the bait well. Go back to the spirit of the commander.
QUEST_LV_0200_20150317_002124	The bait was completed well. Talk with the commander on what to do next.
QUEST_LV_0200_20150317_002125	Collect the leaves of Elloms
QUEST_LV_0200_20150317_002126	To make a better bait, the spirit suggested you to tie the leaves together and make it like hairs. Let's collect the leaves of Elloms as suggested by the spirit.
QUEST_LV_0200_20150317_002127	You have collected enough leaves of Elloms that will be used as hairs for the bait. Let's go back to the spirit of the commander.
QUEST_LV_0200_20150317_002128	Obtain %s by defeating Elloms
QUEST_LV_0200_20150317_002129	The leaves of Elloms
QUEST_LV_0200_20150317_002130	The spirit told you that he will go to the intersections that appear before Grobis empty lot. Go there and talk to the spirit.
QUEST_LV_0200_20150317_002131	Complete the last mission using the bait at Grobis Intersections
QUEST_LV_0200_20150317_002132	This will be the last mission. Defeat the demons that killed the commander and the soldiers using the bait.
QUEST_LV_0200_20150317_002133	You've defeated the monster using the bait. Go talk to the spirit again.
QUEST_LV_0200_20150317_002134	Defeat 10 monsters within 1 minute and 30 seconds
QUEST_LV_0200_20150317_002135	Talk with the Scouts
QUEST_LV_0200_20150317_002136	It seems that the Scouts have a different opinion on Deadbones. Go talk to the Scouts again.
QUEST_LV_0200_20150317_002137	Defeat Deadbones
QUEST_LV_0200_20150317_002138	Deadbones suddenly started to attack. Defeat Deadbones.
QUEST_LV_0200_20150317_002139	The commander, Danews doesn't know what to do. Go talk to Danews.
QUEST_LV_0200_20150317_002140	Look for the scouts of Danews
QUEST_LV_0200_20150317_002141	The commander, Danews told you that the scouts who were sent to find out what's going on around here are all lost. Look for the scouts who went to the crossroad.
QUEST_LV_0200_20150317_002142	Talk with the scouts of Danews
QUEST_LV_0200_20150317_002143	It seems that you found one of the scouts that were lost. Go talk to the scout.
QUEST_LV_0200_20150317_002144	Defeat the monsters that are rushing in.
QUEST_LV_0200_20150317_002145	The scouts said that the monsters would soon attack. Defeat the monsters that are rushing in.
QUEST_LV_0200_20150317_002146	You've defeated all the monsters that are rushing in. Talk to the scouts again.
QUEST_LV_0200_20150317_002147	Defeat Bites
QUEST_LV_0200_20150317_002148	The commander Danews seems to be waiting for someone. Talk to the commander, Danews again.
QUEST_LV_0200_20150317_002149	Look for the supply officer
QUEST_LV_0200_20150317_002150	The commander, Danews, is desperately looking for the supply army. At the lower side of the basecamp of the rear squad look for the supply officer and talk to him.
QUEST_LV_0200_20150317_002151	Talk to the supply officer
QUEST_LV_0200_20150317_002152	You've found the supply squad. Talk to the supply officer again.
QUEST_LV_0200_20150317_002153	Retrieve the supplies
QUEST_LV_0200_20150317_002154	The supply officer told you that the soliders are exhausted, so he asked you to retrieve the supplies on behalf of them. Retrieve the supplies that are scattered nearby.
QUEST_LV_0200_20150317_002155	Hand it over to the supply officer
QUEST_LV_0200_20150317_002156	You've retrieved all the supplies that were scattered. Give them to the supply officer.
QUEST_LV_0200_20150317_002157	Since you've retrieved all the supplies, talk to the supply officer so that the supply squad can unite with the rear squad.
QUEST_LV_0200_20150317_002158	Hand over the supplies to the commander, Danews
QUEST_LV_0200_20150317_002159	The supply officer told you that since the soldiers are exhausted, it will be hard for the supply squad to move right away. So when you hand over the supplies, the complaints from the rear squad will be reduced. Hand over the supplies to commander Danews on behalf of the supply squad.
QUEST_LV_0200_20150317_002160	Talk to the soldier, Roy
QUEST_LV_0200_20150317_002161	It seems that you found the soldier, Roy. Talk to the soldier, Roy.
QUEST_LV_0200_20150317_002162	Collect the hooks of puragis
QUEST_LV_0200_20150317_002163	The soldier, Roy told you that he can't go back before he completes the mission. Collect the hooks of puragis by helping the soldier, Roy.
QUEST_LV_0200_20150317_002164	Hand them over to the solider, Roy
QUEST_LV_0200_20150317_002165	You've collected the hooks of puragis. Hand them over to the soldier, Roy.
QUEST_LV_0200_20150317_002166	Talk to the senior commander Philipas
QUEST_LV_0200_20150317_002167	The senior commander Philipas is waiting for the soldier, Roy at the central headquarter. Talk with Philipas.
QUEST_LV_0200_20150317_002168	Defeat blug Big Grieva at the hills
QUEST_LV_0200_20150317_002169	The senior commander, Philipas is blaming you for soldier Roy being at the rear squad. First defeat Big Grieva at the hills.
QUEST_LV_0200_20150317_002170	Report to Philipas
