QUEST_UNUSED_20151102_002505	Looks like you have no problems in defeating demons.{nl}But you still need some practice for the more vicious ones.{nl}I can show you the way of a true Peltasta.	그 정도면 왠만한 마족들은 손쉽게 해치울 수 있겠네요.{nl}하지만 진짜 흉악한 녀석들을 없애기 위해서는 좀 더 정진하실 필요가 있습니다.{nl}제가 당신께 진정한 펠타스타의 길을 열어드리죠.	QUEST_UNUSED_20151022_001152	You would easily defeat any kinds of demons.{nl}But, in order to defeat the real bad demons, you will have to try hard.{nl}I will open the true way of Peltasta for you.	그 정도면 왠만한 마족들은 손쉽게 해치울 수 있겠네요.{nl}하지만 진짜 나쁜 녀석들을 없애기 위해서는 좀 더 정진하실 필요가 있습니다.{nl}제가 당신께 진정한 펠타스타의 길을 열어드리죠.	펠타스타 서브 마스터
QUEST_UNUSED_20151102_002506	If you meet the requirements, that is.	하지만 최소한의 조건은 통과하셔야 합니다.	QUEST_UNUSED_20151022_001153	But, you should at least pass the minimum requirement.{nl}Come back after defeating Chapparitions from Karolis Springs.	하지만 최소한의 조건은 통과하셔야 합니다.{nl}카롤리스 샘터에서 채퍼리션을 해치우고 오세요.	펠타스타 서브 마스터
QUEST_UNUSED_20151102_002507	I once was asked to get rid of the Chapparition in Karolis Springs.{nl}I couldn't finish the job at the time but now I think it could be a good test for you.{nl}Go to Karolis Springs and defeat the Chapparition there.	과거 카롤리스 샘터에 나타난 채퍼리션을 없애달라는 부탁을 받았었습니다.{nl}당시에는 미처 처리하지 못했는데 지금보니 당신의 시험상대로 적당한 듯 싶네요.{nl}카롤리스 샘터에서 채퍼리션을 해치우고 오세요.				펠타스타 서브 마스터
QUEST_UNUSED_20151102_002508	I'm surprised by how much you improved.{nl}I can tell you're different from other Hoplites. {nl}You'll have no problems in becoming even stronger. So, are you ready for the next stage?	당신의 성장은 놀라울 정도로군요.{nl}다른 하플라이트들과는 무언가 다른 것이 느껴집니다.{nl}당신이라면 좀 더 강해질 수 있을 겁니다. 다음단계로 나아갈 준비는 되셨습니까?	QUEST_UNUSED_20151022_001156	Your growth is really surprising. I can feel something different in you.{nl}I am sure you will become stronger. Are you ready to proceed to the next level?	당신의 성장은 놀라울 정도로군요. 여타의 수련생들과는 무언가 다른 것이 느껴집니다.{nl}당신이라면 좀 더 강해질 수 있을 겁니다. 다음단계로 나아갈 준비는 되셨습니까?	하플라이트 마스터
QUEST_UNUSED_20151102_002509	Yes, that's the end of the spear I used to attack it back then.{nl}Now we can finally say it was us the Hoplites who defeated the beast.	확실히 그것은 제가 과거 녀석의 몸에 박아넣었던 창의 끝부분이 맞군요.{nl}녀석은 우리 유능한 하플라이트가 쓰러뜨렸노라고 여기저기 자랑할 수 있겠습니다.	QUEST_UNUSED_20151022_001160	That is definitely the tip of my spear wihich was on the body of the monster.{nl}I can proudly say that our competent Hopelite defeated it.	확실히 그것은 제가 과거 녀석의 몸에 박아넣었던 창의 끝부분이 맞군요.{nl}녀석은 우리의 유능한 하플라이트가 쓰러뜨렸노라고 여기저기 자랑할 수 있겠습니다.	하플라이트 마스터
QUEST_UNUSED_20151102_002510	And of course, don't ask your friends to help you with this.	물론 동료의 도움따위를 받아서야 의미 없지.				바바리안 서브 마스터
QUEST_UNUSED_20151102_002511	I like your guts.{nl}Do me a favor and defeat the demons in Feretory Hills.	패기는 마음에 드는군.{nl}그렇다면 페레토리 구릉의 마족들을 처치해보게.	QUEST_UNUSED_20151022_001167	I like your spirit.{nl}Try defeating Beast-type monsters at Feretory Hills.	패기는 마음에 드는군.{nl}그렇다면 페레토리 구릉의 야수몬스터들을 처치해보게.	캐터프랙트 마스터
QUEST_UNUSED_20151102_002512	After Medzio Diena, Feretory Hills has been crawling with demons.{nl}Go and defeat the demons there.	신수의 날 이후 페레토리 구릉은 어느샌가 마족들이 들끓는 곳이 되어 버렸지.{nl}그 곳의 마족들을 처치하게.	QUEST_UNUSED_20151022_001168	Since Medzio Diena, the monsters that inflict the most harm are the Beast-type.{nl}Defeat the Beast-type monsters at Feretory Hills.	신수의 날 이후 늘어난 몬스터 중에 사람들에게 가장 피해를 주는게 야수형들이야.{nl}페레토리 구릉의 야수 몬스터를 처치하게.	캐터프랙트 마스터
QUEST_UNUSED_20151102_002513	Take this gem and go to Feretory Hills.{nl}After you injure the monsters, use the power of the gem to purify them.{nl}Then, bring back their ashes.	이 보석을 가지고 페레토리 구릉으로 가세요.{nl}몬스터들에게 상처를 입힌 다음 보석의 힘으로 몬스터를 정화하시기 바랍니다.{nl}그러면 재가 남을텐데 그것을 가져오세요.	QUEST_UNUSED_20151022_001170	With this jewel, please go to Feretory Hills.{nl}Make scars on the monsters and use the power of the jewel to purify the monsters.{nl}When you do that, ashes will remain. Please gather them.	이 보석을 가지고 페레토리 구릉으로 가세요.{nl}몬스터들에게 상처를 입힌 다음 보석의 힘으로 몬스터를 정화하시기 바랍니다.{nl}그러면 재가 남을텐데 그것을 모아오세요.	크리비 서브 마스터
QUEST_UNUSED_20151102_002514	This effectively proves your skills. {nl}Congratulations on reaching the last level of Krivis.{nl}I hope you will keep using your power to help those in need.	이것으로 당신의 실력이 입증되었군요.{nl}크리비로서 마지막 단계에 들어서신 것을 축하드립니다.{nl}앞으로도 그 힘으로 어려운 이들에게 도움을 주시기 바랍니다.	QUEST_UNUSED_20151022_001172	Your competence has been proven as a result.{nl}Congratulations on your entrance to the last stage of Krivis.{nl}I want you to help the ones who are stuggling with the power you have.	이것으로 당신의 실력이 입증되었군요.{nl}크리비로서 마지막 단계에 들어서신 것을 축하드립니다.{nl}앞으로도 그 힘으로 힘겨운 이들에게 도움을 주시기 바랍니다.	크리비 서브 마스터
QUEST_UNUSED_20151102_002515	Go to Braken Monastery 64_2 and you will see Sparnasman monsters.{nl}Defeat them in the XXX region and bring me their horns.	고사리 수도원64_2에서 스파나스맨이란 몬스터를 마주치실 수 있을 거에요.{nl}XX지역에서 녀석을 쓰러뜨리고 녀석의 머리에 난 그 뿔을 가져다 주세요.	QUEST_UNUSED_20151022_001183	You will be able to encounter a monster called Sparnasman at 64_2 of Bracken Forest.{nl}Please bring me the horn on your head.	고사리 수도원64_2에서 스파나스맨이란 몬스터를 마주치실 수 있을 거에요.{nl}녀석의 머리에 난 그 뿔을 가져다 주세요.	딥디르비 서브 마스터
QUEST_UNUSED_20151102_002516	I'm going to give you my energy.{nl}Use the energy at Feretory Hills and it will blend in with part of the monsters' spirits.	저의 기운을 당신에게 전달해 드릴 것입니다.{nl}페레토리 구릉에서 그 기운을 사용하시면 몬스터의 영혼 일부가 섞이게 됩니다.	QUEST_UNUSED_20151022_001187	I will pass you my energies to you.{nl}When you use that energy at Feretory Hills, a part of monsters' spirits will be mixed.{nl}Defeat that monster and come back after absorbing the spirit.	저의 기운을 당신에게 전달해 드릴 것입니다.{nl}페레토리 구릉에서 그 기운을 사용하시면 몬스터의 영혼 일부가 섞이게 됩니다.{nl}그 몬스터를 처치하시고 영혼을 흡수한 다음 돌아오세요.	사두 마스터
QUEST_UNUSED_20151102_002517	Defeat the monsters with my energy imparted to collect their spirits, then bring them to me. {nl}Do this without the help of anyone.	영혼이 섞인 몬스터를 처치하시고 영혼을 흡수한 다음 돌아오세요.{nl}단, 이 시험은 동료의 도움은 받으실 수 없습니다.				사두 마스터
QUEST_UNUSED_20151102_002518	You seem ready.{nl}If so, go to the Apsimesti Crossroads without your shield and defeat the monsters there.	준비는 된 것 같군.{nl}그렇다면 방패를 착용하지 않은 상태에서 압시메스티 교차로의 몬스터를 해치우고 와.	QUEST_UNUSED_20151022_001199	I think you are ready.{nl}If that's so, defeat the monsters at Apsimesti Crossroads without using a shield.{nl}In fact, face the monsters without equipping the monsters.	준비는 된 것 같군.{nl}그렇다면 방패를 사용하지 않고 압시메스티 교차로의 몬스터를 해치우고 와.{nl}아니, 애초에 착용하지 않은 상태에서 몬스터를 해치우고 오는 게 좋겠군.	로델레로 마스터
QUEST_UNUSED_20151102_002519	You know you need to do this on your own, right?	물론 혼자서 해내야 한다는 정도는 알겠지?				로델레로 마스터
QUEST_UNUSED_20151102_002520	Are you any good with the spear now?{nl}If so, ger ready to become a true Cataphract.{nl}How's you companion's condition?	어때, 이제 찌른다는 게 뭔지 알겠나?{nl}그럼 진정한 캐터프랙트로 거듭나기 위한 준비를 해보세.{nl}자네 컴패니언의 상태는 양호한가?	QUEST_UNUSED_20151022_001202	How about it, do you understand now what the piercing is?{nl}Okay, then let's get ready to proceed to the next level.	어때, 이제 찌른다는 게 뭔지 알겠나?{nl}그럼 다음 단계로 나아가기 위한 준비를 해보자.	캐터프랙트 마스터
QUEST_UNUSED_20151102_002521	Good. Imagine your arms are the spear that'll strike your opponents.{nl}And your legs are the companion that moves you around.{nl}Go to the Apsimesti Crossroads and defeat your enemies while mounted on your companion.	좋아. 어떤 적도 꿰뚫을 수 있는 창이 자네의 팔이라고 치지.{nl}그렇다면 다리는 단연 기동력을 제공해주는 자네의 컴패니언이라고 할 수 있을걸세.{nl}컴패니언에 올라탄 채로 압시메스티 교차로의 적들을 토벌하고 오게.	QUEST_UNUSED_20151022_001203	Let's assume that the spear which can pierce any enemy is your arm.{nl}We can say the legs are your companion which give you the mobility.{nl}Defeat the enemies in Apsimesti Crossroads while mounted on a companion.	어떤 적도 꿰뚫을 수 있는 창이 자네의 팔이라고 치지.{nl}그렇다면 다리는 단연 기동력을 제공해주는 자네의 컴패니언이라고 할 수 있을걸세.{nl}컴패니언에 올라탄 채로 압시메스티 교차로의 적들을 토벌하고 오게.	캐터프랙트 마스터
QUEST_UNUSED_20151102_002522	I received a letter from Tesla!{nl}From what he wrote he seems to expect great things from you.{nl}Let's see if you've improved enough to live up to his expectations.	간신히 테슬라님과 연락이 닿았어요!{nl}당신에 대해서 편지에 적었더니 기대되는 인재라고 하시더군요.{nl}지금 당신의 실력은 그 기대에 걸맞게 성장했을지 시험해보죠.	QUEST_UNUSED_20151022_001210	I barely got in contact with Tesla!{nl}I've wrote you in the letter and he surely has high expectations in you.{nl}So, how about you try out for the last level of Dievdirbys?	간신히 테슬라님과 연락이 닿았어요!{nl}당신에 대해서 편지에 적었더니 기대되는 인재라고 하시더군요.{nl}그런 의미에서 딥디르비의 마지막 단계에 도전해보시는 건 어떨까요?	딥디르비 서브 마스터
QUEST_UNUSED_20151102_002523	The cities may be far from each other but there's always a fast way.{nl}Good luck.	두 도시 간 거리가 멀긴 하지만 언제나 빠른 방법은 있는 법이랍니다.{nl}수고해 주세요.	QUEST_UNUSED_20151022_001215	I heard that one can easily move to Fedimian by using the power of the Goddess Statue.{nl}We would be able to reduce some time.	여신상의 힘을 사용하면 페디미안까지 쉽게 이동할 수 있다고들 하네요.{nl}조금이라도 시간을 줄일 수 있겠네요.	딥디르비 서브 마스터
QUEST_UNUSED_20151102_002524	Thake this relic and go to Starving Demon's Way.{nl}Activate it at the Abandoned Altar in Hyth Cliff and the monsters will appear.{nl}I assume you know what to do next?	이 오래된 성물을 가지고 큰아귀 길로 가세요.{nl}히스 절벽에 있는 버려진 제단에 성물을 반응시키면 몬스터들이 나올 겁니다.{nl}그 다음은 말씀드리지 않아도 아시겠지요?	QUEST_UNUSED_20151022_001220	Please take these relics to The Starving Demon's Way.{nl}When you react the relics to the abandoned altar up there, the monsters would appear.{nl}You know what's next even if I don't tell you anything right?	이 오래된 성물을 가지고 큰아귀 길로 가세요.{nl}위쪽 막다른 곳에 버려진 제단에 성물을 반응시키면 몬스터들이 나올 겁니다.{nl}그 다음은 말씀드리지 않아도 아시겠지요?	팔라딘 서브 마스터
QUEST_UNUSED_20151102_002525	The Abandoned Altar is by Hith Cliff in Starving Demon's Way.	버려진 제단은 큰아귀 길의 히스 절벽에 있습니다.	QUEST_UNUSED_20151022_001221	The abandoned altar is at the dead end of Starving Demon's Way up there.	버려진 제단은 큰아귀 길 위쪽 막다른 지점에 있습니다.	팔라딘 서브 마스터
QUEST_UNUSED_20151102_002526	Good job. You're one step closer to the next level.{nl}I would be glad to introduce your talent to my uncle; he's busy working as a Master.	수고하셨어요. 보다 높은 경지로 또 한 발을 내딛으셨군요.{nl}마스터로써 중요한 일로 바쁘신 저희 삼촌께도 보여드렸으면 싶은 실력이시네요.	QUEST_UNUSED_20151022_001222	Well done. You've stepped into a higher level.{nl}You possess the skills which I want to show to my ungle who is a master.	수고하셨어요. 보다 높은 경지로 또 한 발을 내딛으셨군요.{nl}마스터로써 중요 임무 중인 저희 삼촌께도 보여드렸으면 싶은 실력이시네요.	팔라딘 서브 마스터
QUEST_UNUSED_20151102_002527	At last, you're a true Rodelero now.{nl}But do you have what it takes to be a leader?{nl}Why don't you give it a try on the Colimencias at the Greene Manor?	드디어 자네도 한 명의 어엿한 로델레로군.{nl}하지만 자네가 과연 남들을 이끌만한 능력이 있는가?{nl}그린가의 장원에 있는 콜리멘시아로 시험해보지.	QUEST_LV_0200_20150918_009098	So you are now one competent Rodelero.{nl}But, how about fighting a Colimencia... The one at the manor of Greene family.	드디어 자네도 한 명의 어엿한 로델레로군.{nl}하지만 콜리멘시아라면 어떨까.. 그린가의 장원에 있는 위험한 녀석 말이야.	로델레로 마스터
QUEST_UNUSED_20151102_002528	You're going to feel overwhelmed.{nl}But you need to know your weaknesses before you can reach the next Rodelero level.	분명 버거움을 느낄 거야.{nl}하지만 자신의 부족함을 알아야 더 높은 경지의 로델레로가 될 수 있는 것이지.	QUEST_LV_0200_20150918_009100	You would feel some weight of it.{nl}But, you should realize your deficiencies in order to become better Rodelero.{nl}	분명 버거움을 느낄 거야.{nl}하지만 자신의 부족함을 알아야 더 높은 경지의 로델레로가 될 수 있는 것이지.{nl}	로델레로 마스터
QUEST_UNUSED_20151102_002529	What was it like fighting such a strong opponent? Do you feel fit for a Rodelero?{nl}You're already a true Rodelero if you ask me.{nl}Keep up the good work.{nl}	강적과 싸워보니 어떻던가? 스스로 로델레로에 걸맞다고 생각하는가?{nl}자네가 어떻게 생각하든 내가 보기에 자네는 이미 어엿한 로델레로일세.{nl}앞으로 함께 정진해 나가세.{nl}	QUEST_LV_0200_20150918_009099	When there are some things lacking, it means there is some room to improve.{nl}Don't worry. I can fill that in.	부족한 것이 있다는 건 더 나아갈 여지가 있다는 말이야.{nl}걱정 마. 내가 채워줄 수 있거든.	로델레로 마스터
QUEST_UNUSED_20151102_002530	To become the best Cataphract you need a worthy opponent.{nl}The Gaigalas in Tenants' Farm and known for being the fiercest and most savage.{nl}Go there and defeat some.	최강의 캐터프랙트를 꿈꾼다면 그에 걸맞는 상대를 꺾어봐야지.{nl}테넌츠 농장의 가이갈라스의 흉폭함은 널리 알려져 있다네. 피해자도 헤아릴 수 없다던가?{nl}냉큼 가서 녀석을 해치우고 오게.	QUEST_JOBSTEP_20150714_002786	If you dream to become the greatest Cataphract, you should be able to defeat Gaigalas in Tenants' Farm easily.{nl}If you understand, come back quickly.	최강의 캐터프랙트를 꿈꾼다면 테넌츠 농장의 가이갈라스 정도는 가볍게 없앨 수 있어야지.{nl}알겠다면 어서 빨리 냉큼 다녀오게.	캐터프랙트 마스터
QUEST_UNUSED_20151102_002531	What you did was very impressive.{nl}As a Sadhu Master I look forward to your progress.	정말 훌륭한 일을 해 주셨습니다.{nl}사두 마스터로서 당신의 성장을 기대하겠습니다.	QUEST_LV_0200_20150918_009101	What you've done is really amazing.{nl}I am looking forward to see your growth as a Sadhu Master.	정말 훌륭한 일을 해 주셨습니다.{nl}사두 마스터로서 앞으로의 성장을 기대하겠습니다.	사두 마스터
QUEST_UNUSED_20151102_002532	You've improved quite a bit.{nl}It's time for you to be tested for the final stage.{nl}We need a way to prove your skills.	그 사이 실력이 또 일취월장하셨군요.{nl}아무래도 마지막 단계로 나아가기 위한 시험을 치르셔야겠어요.{nl}그 실력을 증명할 방법이 필요하겠군요.	QUEST_UNUSED_20151022_001223	You've improved again. My uncle will be surprised.{nl}You should take the test to go to the last stage.{nl}We need the way to prove your skill.	그 사이 실력이 또 일취월장하셨군요. 이 정도라면 저희 삼촌도 놀라겠는걸요.{nl}아무래도 마지막 단계로 나아가기 위한 시험을 치르셔야겠어요.{nl}그 실력을 증명할 방법이 필요하겠군요.	팔라딘 서브 마스터
QUEST_UNUSED_20151102_002533	And I think I know just the one.{nl}They say the Gaigalas in Tenants' Farm are some of the most unruly.{nl}Go there and defeat some to make sure they don't harm anyone else.	마침 적당한 상대를 알고 있지요.{nl}테넌츠 농장에서 가이갈라스라는 몬스터가 날뛰는 모양이에요.{nl}녀석이 더 이상 사람들을 해치지 못하도록 처리해 주세요.	QUEST_UNUSED_20151022_001224	I know a suitable opponent who you can fight against.{nl}Monsters called Gaigalas are going crazy at Tenants' Farm.	마침 적당한 상대를 알고 있지요.{nl}테넌츠 농장에서 가이갈라스라는 몬스터가 날뛰는 모양이에요.	팔라딘 서브 마스터
QUEST_UNUSED_20151102_002534	I wondered if it wasn't too dangerous, but it seems I underestimated you.{nl}You're very impressive.{nl}I don't think anyone would doubt you're fit to become a high-level Paladin.	솔직히 좀 위험하지 않을까 싶었는데 제가 당신의 실력을 오판한 모양이군요.{nl}대단하세요.{nl}누구든지 당신이라면 높은 경지의 팔라딘이 될 수 있는 자격이 있음을 인정할 겁니다.	QUEST_UNUSED_20151022_001226	In fact, I thought it's going to be dangerous, but I guess I misunderstood your skills.{nl}Well done. Anyone would acknowledge you as a high level Paladin.	솔직히 좀 위험하지 않을까 싶었는데 제가 당신의 실력을 오판한 모양이군요.{nl}대단하군요. 당신이라면 누구라도 가장 높은 경지의 팔라딘으로 인정할 겁니다.	팔라딘 서브 마스터
QUEST_UNUSED_20151102_002535	Stop.	끝				
QUEST_UNUSED_20151102_002536	Start!	진행!				계시자 미하일
QUEST_UNUSED_20151102_002537	Start?	진행?				마법사 멜히오라스
QUEST_UNUSED_20151102_002538	Stop?	끝?				계시자 미하일
QUEST_UNUSED_20151102_002539	I thought we might find Goddess Zemyna here but all I see are the dead...{nl}I've never seen anything like this. We need to find Zemyna.	여기라면 제미나 여신의 행방을 찾을 수 있을까 했는데 망자들만 가득하다니..{nl}이런 건 처음 봐요. 어서 제미나님을 찾아야 할 텐데요.	QUEST_UNUSED_20151001_000537	I thought I would be able to find the whereabouts of Goddess Zemyna here, but this place is full of the dead..{nl}I've never seen this. We should look for Zemyna fast.	여기라면 제미나 여신의 행방을 찾을 수 있을까 했는데 망자들만 가득하다니..{nl}이런 건 처음 봐요. 어서 제미나님을 찾아야 할텐데요.	보코르 유타
QUEST_UNUSED_20151102_002540	So we can't get near the relic...{nl}I understand keeping monsters and demons away, but why it's protected against people I don't know.	가까이 가지도 못하게 막아 놓은 성물이라..{nl}몬스터나 마족은 이해한다 쳐도, 사람까지 막아놓는 건 이해가 안되네요.	QUEST_LV_0100_20151001_008743	A holy relic that you can't even approach... {nl}I understand if they block the monsters or demons from getting close to it but even humans, that I don't understand.	가까히 가지도 못하게 막아 놓은 성물이라..{nl}몬스터나 마족은 이해한다 쳐도, 사람까지 막아놓는 건 이해가 안되네요.	보코르 유타
QUEST_UNUSED_20151102_002541	What was that?{nl}It's so good to be safe again. I nearly returned to the goddess.{nl}	그건 도대체 뭐였죠? {nl}무사해서 정말 다행이에요. 하마터면 여신의 품으로 갈 뻔 했네요.{nl}	QUEST_LV_0100_20151001_008771	Thank you for saving me. I almost went to the goddess. {nl}I guess it is a lie that it was a holy relic of the goddess. {nl}	구해주셔서 감사해요. 하마터면 여신의 품으로 갈 뻔 했네요.{nl}역시 그게 여신의 성물이라는 건 거짓말이었나봐요.{nl}	보코르 유타
QUEST_UNUSED_20151102_002542	I should've known... it wasn't a relic of the goddess at all.{nl}	역시.. 그게 여신의 성물이라는 건 거짓말이었나봐요.{nl}	QUEST_LV_0100_20151001_008772	The relic of the goddess would not summon such a monster. {nl}I smell something fishy with that Order of the Tree of Truth. 	여신의 성물이 저런 몬스터를 불러낼 리는 없으니까요.{nl}그 진리의 나무교단이라는 사람들도 의심스럽네요.	보코르 유타
QUEST_UNUSED_20151102_002543	I'm going to give you my records.{nl}Take them and destroy them; only then can I finally be at peace.	내 이 기록을 자네에게 주겠네.{nl}자네가 책임지고 이 기록을 없애준다면 다시 편히 잠들 수 있을 것 같아.	QUEST_LV_0100_20151001_008851	I will give this record to you. If you make sure destroy it, I will be able to lay in peace again. {nl}Please.	내 이 기록을 자네에게 주겠네.{nl}자네가 책임지고 이 기록을 없애준다면 다시 편히 잠들 수 있을 것 같네. {nl}부탁하네.	칼라일의 영혼
QUEST_UNUSED_20151102_002544	I don't think... I've seen you before.{nl}	처음 보는 분.. 이네요.{nl}	QUEST_UNUSED_20151022_001229	What?{nl}What have you brought here?{nl}Ah... it doesn't matter. If you are okay, can you help me out?{nl}	응?{nl}이렇게 인적 드문 숲에는 어쩐 일로 오신거죠?{nl}아.. 그건 아무래도 좋아요. 괜찮으시면 절 좀 도와주시겠어요?{nl}	드루이드 레야
QUEST_UNUSED_20151102_002545	Hm... That's good.{nl}If you can, will you please help me?{nl}	윽.. 그건 아무래도 좋아요. {nl}괜찮다면 절 도와주시겠어요?{nl}	QUEST_UNUSED_20151016_000799	My name is Druid Leja and I live in this forest.{nl}I've reached here by chasing after the ferrets that ran away with the food from the village.{nl}I wasn't able to find the food, but instead was attacked by ferrets.{nl}	저는 이 숲에 사는 드루이드 레야라고 해요.{nl}페릿이 마을을 습격해서 식량을 훔쳐달아나는 걸 쫓다가 여기까지 왔죠.{nl}그런데 식량도 못찾고 오히려 페릿들에게 공격당해버렸네요.{nl}	드루이드 레야
QUEST_UNUSED_20151102_002546	I came running after the ferrets who stole our food and ended up here.{nl}But the ferrets attacked me and I couldn't get the food.{nl}	페릿이 마을의 식량을 훔쳐 달아나는 걸 쫓다가 여기까지 와버렸어요.{nl}그런데 식량을 되찾긴 커녕 오히려 페릿들에게 공격당해버렸네요.{nl}	QUEST_UNUSED_20151016_000800	I want to cure my wound before I go back to the village..{nl}When we go up there, there is a herb that works well on wounds. Please bring us those herbs.	마을로 돌아가기 전에 상처를 좀 추스려야할 것 같은데..{nl}저 위에 올라가면 상처에 잘 듣는 약초가 있어요. 그 약초를 좀 가져다주세요.	드루이드 레야
QUEST_UNUSED_20151102_002547	I need some first aid for my wounds...{nl}There's a herb at the Luvda Cliff that helps stop bleeding. Will you get some for me?	어떻게든 응급처치라도 하고 싶은데..{nl}르브다 절벽 쪽에 지혈에 잘 듣는 약초가 있어요. 그걸 부탁드려도 될까요?				드루이드 레야
