QUEST_UNUSED_20151022_000994	That's it!{nl}Wow, you've collected all of them!{nl}	그거예요!{nl}와, 다 모아 주셨군요!{nl}	QUEST_UNUSED_20151016_000786	That's it!{nl}Wow, you found them all!{nl}Thank you!{nl}How can I ever repay you...	그거예요! 와 다 모으셨군요!{nl}감사합니다!{nl}이 은혜를 어찌 해야 할 지..	케스타스
QUEST_UNUSED_20151022_000995	How can I pay for this?{nl}	이 은혜를 어떻게 갚죠?{nl}	QUEST_LV_0100_20151001_008378	{nl}That's it! Wow, you got them all! {nl}Thank you!{nl}How can I thank you enough...	{nl}그거예요! 와 다 모으셨군요!{nl}감사합니다!{nl}이 은혜를 어찌 해야 할 지..	케스타스
QUEST_UNUSED_20151022_000996	I was talking gibberish right?{nl}I am so sorry. I was too desperate so I wanted to give up on everything.{nl}	아깐 제가 너무 횡설수설했었죠.{nl}정말 미안해요. 진짜 다 그만두고 싶을 만큼 절망적이였거든요.{nl}	QUEST_LV_0100_20151016_009620	Everything is in order now! Now I'll go to Fasika Plateau!{nl}Hahahahahahahahaha!!	아아 이제 됐어! 이제 파사카 협곡으로 가야지!{nl}하하하!!	케스타스
QUEST_UNUSED_20151022_000997	This sign is like a sacred object to us.{nl}This is the symbol that we gained lots of diverse knowledge and passed many ordeals.{nl}	이 표식은 저희에겐 성물과도 같은 거에요.{nl}수 많은 지식을 쌓고 시련을 통과했다는 인정을 받았다는 증표거든요.{nl}				케스타스
QUEST_UNUSED_20151022_000998	We should go back.{nl}We won't lose it again right?{nl}	이젠 가봐야겠어요.{nl}설마 또 잃어버리진 않겠죠.{nl}				케스타스
QUEST_UNUSED_20151022_000999	Ah...{nl}Antanas and Gierda keeps them well, but I don't undertand why I am losing them so often.{nl}I think I possess some secret power that pulls monsters..{nl}	아, 정말이지..{nl}안타나스 아저씨나 기에드라는 잘 간수하고 있던데, 왜 저는 이렇게 잘 잃어버릴까요.{nl}뭔가 몬스터를 끌어당기는 힘이라도 있는 걸까..{nl}	QUEST_LV_0100_20151016_009621	Oh come on...{nl}The Nestos sign was created after the falling out with the Anastos.{nl}	아 정말이지..{nl}사실 네스토스파의 표식은 아나스토스파와 갈리기 시작하면서 만들어진 거예요.{nl}	케스타스
QUEST_UNUSED_20151022_001000	Anyways, I will go to Pasaka Canyon now where the masters are present!{nl}Thank you so much!	어쨌든 이젠 선생님들이 계신 파사카 협곡으로 갈래요!{nl}정말 감사했습니다!	QUEST_LV_0100_20151016_009622	{nl}Antanas and Giedra here seem to be holding it, but why do I keep losing it so often...{nl}Anyways, I want to go on a pilgrimage to Fasika Plateau where there are more Nestos now!{nl}Thank you!	{nl}이 곳의 안타나스나 기에드라는 멀쩡하게 잘 들고 있던데, 왜 저는 이렇게 잘 잃어버릴까요..{nl}어쨌든 이제 네스토스파가 더 많이 모여있는 파사카 협곡으로 순례 갈래요!{nl}감사했습니다!	케스타스
QUEST_UNUSED_20151022_001001	In order to collect the sacred power, we should possess some necessary tools.{nl}As you can see, I am not a priest who has been training for a long time.{nl}	성스러운 힘을 모으려면 그 만한 장비가 따라줘야 한다오.{nl}보다시피 난 오랜 수행을 쌓은 성직자는 아니니 말이오.{nl}	QUEST_LV_0200_20151016_009683	However...{nl}We can't set up a tombstone with only these ingredients.{nl}I've ordered some necessary tools from the Blacksmith and the Equipment Merchant in Orsha.	그런데..{nl}이 재료들만 가지고는 당연히 비석을 세울 수 없소.{nl}내가 오르샤의 대장장이와 장비상인에게 도구들을 주문해 두었소.	안타나스
QUEST_UNUSED_20151022_001002	I've ordered some special hammer and chisel. {nl}Since the due date has reached, can you get me those?	내가 오르샤의 대장장이에게 특별한 망치와 정을 주문해 두었소.{nl}약속 날짜가 다 되었으니 그걸 좀 찾아와 줄 수 있겠소?	QUEST_LV_0200_20151016_009684	{nl}Please get it for me.	{nl}그걸 좀 찾아오시오.	안타나스
QUEST_UNUSED_20151022_001003	Normal tools won't work.{nl}If they work, I wouldn't have asked for your help.	보통 도구론 절대 안 되오.{nl}그게 되었으면 자네 도움을 빌릴 필요는 없었겠지.	QUEST_LV_0200_20151001_009189	Be careful on your journey.	먼 길 조심하시오.	안타나스
QUEST_UNUSED_20151022_001004	Did Antanas send you?{nl}His orders are too difficult..{nl}	안타나스씨가 보내서 온 건가?{nl}어휴, 그 아저씨 어찌나 주문이 까다로운지..{nl}	QUEST_LV_0200_20151016_009685	So Antanas sent you.{nl}Here's the hammer.	안타나스가 보내서 오신 분이군요.{nl}여기 주문해 두신 망치가 있습니다.	대장장이
QUEST_UNUSED_20151022_001005	Other blacksmiths would have problem fulfilling his orders.{nl}Here is the hammer. Are you going to engrave the sacred spell into it?	나니까 그 주문을 받은 거야.{nl}자. 여기 망치. 신성한 주문을 새길 건가 보지?	QUEST_LV_0200_20151001_009191	{nl}Hmm...	{nl}흠..	대장장이
QUEST_UNUSED_20151022_001006	Chisel?{nl}I don't sell chisels so I've asked someone else to prepare for him.{nl}	정?{nl}아아. 그건 그 아저씨 주문에 도저히 맞출 수가 없는 부분이 있어서 따로 맡겼어.{nl}	QUEST_LV_0100_20151016_009623	Pill?{nl}You should be able to get that from the equipment merchant.	정?{nl}그건 장비상인에게 있을 겁니다.	대장장이
QUEST_UNUSED_20151022_001007	Go meet Jura.{nl}She works at the equipment shop.	율라를 찾아가 봐.{nl}그 아이는 장비 상점에서 일하고 있어.				대장장이
QUEST_UNUSED_20151022_001008	See you again later.{nl}You are going to repair your equipment here from now on right?	나중에 또 봐.{nl}앞으로 수리는 꼭 여기서 하실거죠, 손님?	QUEST_LV_0100_20151016_009624	Take care on the long road ahead.	먼 길 조심하세요.	대장장이
QUEST_UNUSED_20151022_001009	Welcome!{nl}The best equipment shop in Orsha!{nl}	어서 오세요! {nl}오르샤 제일의 장비 상점입니다!{nl}	QUEST_LV_0100_20151016_009625	Yes. I've prepared the pill you've requested.{nl}Farewell.	네. 주문해 두셨던 정은 준비해 두었습니다.{nl}그럼 안녕히 가세요.	장비 상인 율라
QUEST_UNUSED_20151022_001010	Chisel?{nl}Are you talking about the chisel which Ilanai has given to you?{nl}	정이요?{nl}아, 일라나이 언니가 맡긴 것 말씀이신가요?{nl}	QUEST_LV_0100_20151001_008386	{nl}Well, I just bought some old chisels from other Revelators... {nl}If you need, you can take one of it. 	{nl}마침 내구도가 다 떨어져서 다른 계시자들이 팔고 간 낡은 정들이 있으니..{nl}이거라도 한 개 가져가면 될 거예요.	장비상인
QUEST_UNUSED_20151022_001011	Good. Receive it.{nl}I guess your religious belief in the goddesses is strong.	자, 받으세요.{nl}이런 걸 주문하신 걸 보면 여신의 신앙이 돈독하신 모양이시네요.				장비 상인 율라
QUEST_UNUSED_20151022_001012	Jura has the chisel.{nl}She works at the equipment shop.	정은 내가 아니라 율라에게 맡겨 두었다구.{nl}장비 상점에서 점원으로 일하고 있어.	QUEST_LV_0100_20151016_009626	Have you retrieved the pill?	정은 구하셨어요?	대장장이
QUEST_UNUSED_20151022_001013	Oh, you've made it well according to the order.{nl}Now, I guess I can get to work.	오, 주문대로 정말 잘 만들어 왔구먼.{nl}이제 일을 시작할 수 있겠어.	QUEST_LV_0100_20151001_008388	Oh, you got them all. 	오, 모두 구해왔구먼.	안타나스
QUEST_UNUSED_20151022_001014	Do you still have things to order?{nl}You can just take a look around so please visit here often.	앗, 또 주문하실 것이 있으신가요?{nl}구경만 하셔도 좋으니까 자주 찾아 주세요.				장비 상인 율라
QUEST_UNUSED_20151022_001015	Have you found the chisel?{nl}I welcome orders like this so please keep visit our shop.	정은 찾은 거야?{nl}앞으로도 이런 주문은 환영하니까 잘 부탁해.	QUEST_LV_0100_20151016_009627	Now go.	어서 가 보시오.	대장장이
QUEST_UNUSED_20151022_001016	What do you think?{nl}Why don't you help us if you think eliminating demons is important even if our objectives are different from each other.	당신은 어떻게 생각하세요?{nl}뜻은 달라도 마족을 뿌리뽑는 게 중요하다 생각하시면 저희를 도와주시는 건 어떠신지요.				알비나스
QUEST_UNUSED_20151022_001017	First of all, there are many polluted tombstones.{nl}I will break these so I want you to break the polluted tombstone at Usas Hill.{nl}	우선 오염된 비석은 한 두개가 아니에요.{nl}저는 이걸 부숴버릴 테니, 당신은 우사스 언덕에 있는 오염된 비석을 파괴해 주세요.{nl}	QUEST_LV_0100_20151016_009637	There are more than a few defiled tombstones.{nl}I shall destroy this one, so you go and destroy the tombstones over there.{nl}	우선 오염된 비석은 한 두개가 아니에요.{nl}저는 이걸 부숴버릴 테니, 당신은 저쪽의 오염된 비석을 파괴해 주세요.{nl}	알비나스
QUEST_UNUSED_20151022_001018	I think that tombstone is also spurting out the red energies.{nl}Like the tombstone beside. That's the proof of the pollution.	아마 그 비석도 붉은 기운을 뿜어 내고 있을 겁니다.{nl}옆에 있는 비석처럼요. 오염의 증거이지요.	QUEST_LV_0100_20151016_009638	That tombstone over there should also be glowing red.{nl}Just like the tombstone next to you. It's evidence that it has been defiled.	아마 저 쪽의 비석도 붉은 기운을 뿜어 내고 있을 겁니다.{nl}옆의 비석처럼요. 오염의 증거이지요.	알비나스
QUEST_UNUSED_20151022_001019	I can't understand.{nl}Albinas? Are you the member of the Anastos?{nl}That doesn't make sense?{nl}	기도 안 차는구먼.{nl}알비나스? 아나스토스 파의 일원이라고? {nl}그럴리가 없는데?{nl}	QUEST_LV_0100_20151016_009644	I am at a loss for words.{nl}Albinas? A member of the Anastos? It can't be!{nl}	기도 안 차는구먼.{nl}알비나스? 아나스토스 파의 일원이라고? 그럴리가 없는데?{nl}	다미요나스
QUEST_UNUSED_20151022_001020	I'm not saying I know everyone from the Anastospa...{nl}But we used to be part of the same Order so I know them well.{nl}	내가 아나스토스파의 모든 사람을 아는 건 아니지만..{nl}같은 교단 사람인지라 그들과는 원래 잘 아는 사이란 말이오.{nl}	QUEST_LV_0100_20151016_009645	Bring him to me! {nl}I must see for myself!	그 사람을 데려오시오! {nl}당장 확인 해 봐야겠소!	다미요나스
QUEST_UNUSED_20151022_001021	No way, bring him here at once! {nl}I'll have to hear from him myself!	안되겠어, 당장 그 사람을 데려오시오! {nl}내 직접 확인해야겠어!				다미요나스
QUEST_UNUSED_20151022_001022	When you have enough stones, go see Eduinas at the Nestospa camp.{nl}He'll use them to make stones for construction.{nl}	적당한 석재를 구해서 네스토스파의 캠프에 있는 에뒤나스에게 찾아가시오.{nl}그가 복구용 석재로 다듬어 줄 거요.{nl}	QUEST_LV_0100_20151016_009648	Obtain some suitable stone blocks and go find Eduinas at the Nestos Camp over there.{nl}	적당한 석재를 구해서 저 쪽 네스토스 캠프에 있는 에뒤나스에게 찾아가시오.{nl}	다미요나스
QUEST_UNUSED_20151022_001023	Eduinas won't be happy if he finds out you made this tombstone, though.{nl}Just keep that in mind if you want to take responsibility.	하지만 당신이 비석을 이렇게 만들었다는 걸 알면 에뒤나스가 길길이 날뛰겠지.{nl}책임을 지려면 그 정도는 감수해야 할 게요.	QUEST_LV_0100_20151016_009649	Eduinas will not be happy if he knows that you've done this to the tombstone.{nl}Get ready to take responsibility for that at the very least.	당신이 비석을 이렇게 만들었다는 걸 알면 에뒤나스가 길길이 날뛰겠지.{nl}책임을 지려면 그 정도는 감수하시오.	다미요나스
QUEST_UNUSED_20151022_001024	While I am polishing up the materials, I don't want to see your face.{nl}How about defeating the monsters that make the place around here messy.	자재를 다듬을 동안만이라도 당신 얼굴은 보고싶지 않네요.{nl}이 주변을 어지럽히는 몬스터나 정리해 주시던가요.	QUEST_LV_0100_20151016_009654	I don't want to see you while I get the materials ready.{nl}Go and clear the area of monsters or something.	자재를 다듬을 동안 당신 얼굴은 보고싶지 않네요.{nl}이 주변을 어지럽히는 몬스터나 정리해 주시던가요.	에뒤나스
QUEST_UNUSED_20151022_001025	Since everything is done, go back to Damijonas with this.{nl}Do not ever do it again.	다 됐으니 이걸 가지고 다미요나스에게 돌아가 보세요.{nl}이젠 다시는, 절대로 그러지 마세요.	QUEST_LV_0100_20151016_009656	All done. {nl}Now, don't do that ever again.	다 됐네요. {nl}이젠 다시는, 절대로 그러지 마세요.	에뒤나스
QUEST_UNUSED_20151022_001026	You've got it. Now, I will start the recovery.{nl}It is fortunate that the damage wasn't severe.	구해 왔군. 이제 복구를 시작하겠소.{nl}파손 정도가 심하지 않아서 이 정도로 끝난 게 다행이군.	QUEST_LV_0100_20151016_009657	You've gathered the neccessary items. Let's see if we can repair it.{nl}It's lucky that it wasn't damaged too badly.	구해 왔군. 이제 수리해 보세나.{nl}파손 정도가 심하지 않아서 이 정도로 끝난 게 다행이군.	다미요나스
QUEST_UNUSED_20151022_001027	We and the Anastospa have different opinions, but we are not hostile to each other.{nl}Ever since the unknown name came out, it's apparent that we suspect it.{nl}	우리와 아나스토스파와는 그저 의견이 좀 다를 뿐이지 서로를 적대시하던가 하는 일은 없소.{nl}그런데 알지도 못하는 이름이 튀어나오니 의심하는 것이 당연하지 않겠소?{nl}	QUEST_LV_0100_20151016_009658	We've never had any trouble with Anastos, just some different opinions.{nl}We have to be suspicious since we've heard a name that we know nothing about.{nl}	우리와 아나스토스파와는 그저 의견이 좀 다를 뿐이지 서로를 적대시하던가 하는 일은 없네.{nl}그런데 알지도 못하는 이름이 튀어나오니 의심하는 것이 당연하지 않겠나.{nl}	다미요나스
QUEST_UNUSED_20151022_001028	And you even broke the tombstone.{nl}Anyways, since you've done your responsibility, I will forgive you.{nl}	게다가 힘들게 세운 비석을 부숴버렸으니 말이오.{nl}어쨌든 책임을 졌으니 일단 이 정도로 용서하겠소.{nl}	QUEST_LV_0100_20151016_009659	Especially since they've destroyed the tombstone that we've barely managed to craft.{nl}We'll forgive them since they've taken responsibility.{nl}	게다가 힘들게 세운 비석을 부숴버렸으니 말일세.{nl}어쨌든 책임을 졌으니 일단 이 정도로 용서하지.{nl}	다미요나스
QUEST_UNUSED_20151022_001029	Don't you feel it's unfair to just let it go?{nl}Since there's a camp of Anastospa up there, go there and ask.{nl}It's really strange.	자네도 이대로 넘어가기엔 억울하지 않소?{nl}저 위에 아나스토스파의 캠프가 있었으니 한 번 가서 물어나 보시오.{nl}정말 이상해..	QUEST_LV_0100_20151016_009661	Aren't you dejected to go like this?{nl}Anastos has their camp up there so why don't you go ask them.This is strange...	자네도 이대로 넘어가기엔 억울하지 않겠나.{nl}저 위에 아나스토스파의 캠프가 있었으니 한 번 가서 물어나 보게.{nl}정말 이상해..	다미요나스
QUEST_UNUSED_20151022_001030	Yes, I am Anastos'... yes that's right.{nl}What brought you here?{nl}	예, 제가 아나스토스의.. 맞습니다.{nl}뭘 물어보러 오셨다고요?{nl}	QUEST_LV_0100_20151016_009662	Yes, of Anastos... that is correct.{nl}You've come here to ask about something?{nl}Oh dear, I am quite flustered at the moment so it's a bit difficult to answer anything..{nl}	예, 제가 아나스토스의.. 맞습니다.{nl}뭘 물어보러 오셨다고요?{nl}아이고, 지금 제가 정신이 없어서 뭐든 물어보셔도 답해 드리기가 좀..{nl}	게다스
QUEST_UNUSED_20151022_001031	Sorry, I can't answer your questions at the moment since I am too busy at the moment..{nl}If you can find my research documents, I may get some spare time...	아이고, 지금 제가 정신이 없어서 뭐든 물어보셔도 답해 드리기가 좀..{nl}제 연구 자료를 되찾아 주시면 여유가 생길지도..	QUEST_LV_0100_20151016_009663	We might get a break if you can manage to retrieve the research materials that I'm looking for.	제가 찾고 있는 연구 자료를 되찾아 주시면 여유가 생길지도 모르겠습니다.	게다스
QUEST_UNUSED_20151022_001032	Instead of blind devotion, a life of eliminating demons and preparing for chaos..{nl}I mean those kind of things.{nl}	여신만을 향한 맹목적인 신앙 보다는 마족 퇴치, 재앙에 대비하는 삶.. {nl}그런 것들 위주로 말이에요.{nl}	QUEST_LV_0100_20151016_009674	Focusing on defeating demons and preparing for calamities.. {nl}More than simply devout faith in the goddesses.{nl}	여신만을 향한 맹목적인 신앙 보다는 마족 퇴치, 재앙에 대비하는 삶.. {nl}그런 것들 위주로 나야가야 한다고 말입니다.{nl}	게다스
QUEST_UNUSED_20151022_001033	This is truly strange.{nl}I should send one of my colleagues to find it out.	이건 확실히 이상해요. {nl}동료를 보내서 알아 볼 필요가 있겠어요.	QUEST_LV_0100_20151016_009675	This is definitely strange. {nl}We'll need to send someone to investigate.{nl}	확실히 이상해요. {nl}이건 사람을 보내서 알아 볼 필요가 있겠어요.{nl}	게다스
QUEST_UNUSED_20151022_001034	Ah, by the way, I am thinking about giving him a flare to prepare for any danger, but{nl}There aren't any adequate flares.{nl}	아 그런데, 혹시 모를 위험에 대비해서 신호탄을 들려 보낼 건데요.{nl}적당한 게 없네요.{nl}	QUEST_LV_0100_20151016_009677	Get me some flamable powder.{nl}It won't be too difficult to find since there are always more than enough monsters.	불에 잘 타는 가루를 구해 주세요.{nl}몬스터들은 언제나 들끓으니까, 재료를 구하는 것은 어렵지 않을 거예요.	게다스
QUEST_UNUSED_20151022_001035	Can you get us the powders that burn well in the fire?{nl}There are so many monsters around so it won't be hard to obtain the materials.	불에 잘 타는 가루를 구해 주실 수 있을까요?{nl}몬스터들은 언제나 들끓으니까, 재료를 구하는 것은 어렵지 않을 거예요.				게다스
QUEST_UNUSED_20151022_001036	Let's wait for the investigation results.{nl}He is a competant lad so he will find it out soon.	이제 조사 결과를 기다려보죠.{nl}유능한 친구이니 금방 알아올 거예요.	QUEST_LV_0100_20151016_009679	Now we'll have to wait for the results.{nl}He's a capable person, so it won't take too long.	이제 조사 결과를 기다려야겠습니다.{nl}유능한 친구이니 금방 알아올 거예요.	게다스
QUEST_UNUSED_20151022_001037	Since we can't just stand still, how about we find it out ourselves as well?{nl}	그 동안 가만히 있기 뭐하니 우리도 따로 알아보도록 할까요?{nl}	QUEST_LV_0100_20151016_009680	How about doing some investigation ourselves in the meanwhile.{nl}	그 동안 가만히 있기 뭐하니 우리도 따로 알아보지요.{nl}	게다스
QUEST_UNUSED_20151022_001038	Good. Barte may have seen something.{nl}He recently joined our camp.{nl}	그렇지. 바르테라면 뭔가 본 게 있을 지도 몰라요.{nl}우리 캠프에 합류한 지 얼마 안되었거든요.{nl}	QUEST_LV_0100_20151016_009681	Of course. Barte might know something.{nl}He hasn't been here too long and he's quite the knowledgeable chap.{nl}	그렇지. 바르테라면 뭔가 알고 있을지도 몰라요.{nl}우리 캠프에 합류한 지 얼마 안 된데다가 무척 박식한 청년이거든요.{nl}	게다스
QUEST_UNUSED_20151022_001039	How about you ask her about Albinas?{nl}	그녀에게 알비나스라는 사람에 대해 물어보고 오시면 어떨까요?{nl}	QUEST_LV_0100_20151016_009682	How about asking him about the person called Albinas?{nl}	그에게 알비나스라는 사람에 대해 물어보면 어떨까요?{nl}	게다스
QUEST_UNUSED_20151022_001040	Albinas?{nl}I saw someone with the apperances like your explanations near Majiva Grave Field.{nl}	알비나스요?{nl}음.. 당신이 말한 인상착의와 비슷한 사람을 마지바 묘지에서 보긴 했어요.{nl}	QUEST_LV_0100_20151016_009685	Albinas?{nl}Umm.. I did see a person that looks similar to what you've described.{nl}	알비나스요?{nl}음.. 당신이 말한 인상착의와 비슷한 사람을 보긴 했어요.{nl}	바르테
QUEST_UNUSED_20151022_001041	When you go back to Majiva Grave Field, that leather may be still there.{nl}I... even if the goddesses tell me to go, I can't since I am too scared.	마지바 묘지에 다시 가면 그 가죽이 남아 있을지도 몰라요.{nl}전.. 여신께서 가라 하셔도 무서워서 도저히 못가겠네요.				바르테
QUEST_UNUSED_20151022_001042	What's the matter?{nl}I can't think anyone who would use that pattern except for the servant of Baiga.{nl}	도대체 이게 무슨 일이죠?{nl}저런 문양을 쓰는 건 바이가의 하수인 말곤 생각할 수 없어요.{nl}	QUEST_LV_0100_20151016_009696	What on earth could be happening.{nl}No one else uses such insignia unless they work for Baiga.{nl}	도대체 이게 무슨 일일까요.{nl}저런 문양을 쓰는 건 바이가의 하수인 말곤 생각할 수 없어요.{nl}	바르테
QUEST_UNUSED_20151022_001043	We better let other people know this fast.{nl}You let Gedas know!{nl}	이건 빨리 사람들에게 알려야 할 것 같아요.{nl}당신은 게다스에게 알려주세요!{nl}	QUEST_LV_0100_20151016_009697	We have to alert the others about this!{nl}You go tell Gedas!{nl}	이건 사람들에게 알려야 될 것 같아요!{nl}당신은 게다스에게 알려주세요!{nl}	바르테
QUEST_UNUSED_20151022_001044	Please, save Fabijus!{nl}Ah, before that, we better go back to Nestospa!{nl}	제발, 파비유스를 구해 주세요!{nl}아, 그 전에 네스토스파에게 들르는 게 좋겠어요!{nl}	QUEST_LV_0100_20151016_009701	We must let everyone know!{nl}Please, notify Gedas!{nl}	서둘러서 파비유스에게 가 주세요!{nl}아, 그 전에 네스토스파에게 들르는 게 좋겠어요!{nl}	게다스
QUEST_UNUSED_20151022_001045	This holy water, please take it.{nl}You will get at least one chance of using it on the demons.{nl}	여기 성수, 이걸 가져가세요.{nl}한 번 정도는 마족에게 크게 본때를 보일 수 있을 겁니다.	QUEST_LV_0100_20151016_009704	It's dangerous to go alone, take this Holy Water.{nl}It can do one hell of damage.	여기 성수, 이걸 가져가세요.{nl}한 번 정도는 크게 한 방을 먹일 수 있을 겁니다.	에뒤나스
QUEST_UNUSED_20151022_001046	So you were safe.{nl}I've heard about Albinas from Fabijus.{nl}	무사하셨군요.{nl}알비나스라는 사람, 아니 그 마족의 정체는 파비유스에게 들었습니다.{nl}	QUEST_LV_0100_20151016_009705	Thank goodness, you are safe.{nl}Fabijus told me about who Albinas really was.{nl}	무사하셨군요.{nl}알비나스라는 사람, 아니 마족의 정체는 파비유스에게 다 들었습니다.{nl}	게다스
QUEST_UNUSED_20151022_001047	Do you think that makes sense?{nl}You broke the well working tombstone and you are saying there is no tombstone?{nl}	그걸 지금 말이라고 하는 게요?{nl}멀쩡한 비석을 맘대로 부수고 이제와서 뭐? 없다고?{nl}	QUEST_LV_0100_20151016_009707	Are you hearing yourself right now?{nl}You have a lot of nerve coming back after breaking the stele.{nl}	그걸 지금 말이라고 하는 게요?{nl}멀쩡한 비석을 맘대로 부수고 이제와서 뭐?{nl}	다미요나스
QUEST_UNUSED_20151022_001048	What do you want me to say?{nl}I have a headache due to the tombstone so don't talk to me.	뭘 더 말하라는 게요?{nl}비석 때문에 머리가 아프니 더 이상 말 걸지 마시오.	QUEST_LV_0100_20151016_009711	What do you want now?{nl}I am too busy figuring out how to restore the stele. Leave me alone.	뭘 더 말하라는 게요?{nl}비석 복구할 궁리 중이니 더 말 걸지 마시오.	다미요나스
QUEST_UNUSED_20151022_001049	It is so fortunate that the divine water I gave to you was helpful.{nl}It gives me goose bumps to think that the demons are within humans and alienate.{nl}	아, 제가 드린 성수가 도움이 되었다니 정말 다행이에요.{nl}이젠 하다하다 마족이 사람 틈에 섞여서 이간질까지 하다니 정말 소름돋아요.{nl}	QUEST_LV_0100_20151016_009715	I'm glad to hear that Holy Water that I gave you was of some use.{nl}It's terrifying to think that demons walking among us and dividing us. They must be really desperate.{nl}	아, 제가 드린 성수가 도움이 되었다니 정말 다행이에요.{nl}이젠 하다하다 마족이 사람 속에 섞여서 이간질까지 하다니 정말 소름돋네요.{nl}	에뒤나스
