QUEST_LV_0400_20161005_001076	Kedoran Alliance Merchant Alta is looking for your help.	알렘빅 동굴의 케도라 상단원 알타가 당신의 도움을 기다리고 있습니다				
QUEST_LV_0400_20161005_001077	Find the Alembique Cave Scriptures	알렘빅 동굴 기록 찾기				
QUEST_LV_0400_20161005_001078	Kedoran Alliance Merchant Alta wants to prevent any further casualties and investigate what happened in Alembique Cave thoroughly. Go to Alembique Cave and find something like records	케도라 상단원 알타는 또 다른 희생자가 발생하는 걸 막기 위해 알렘빅 동굴에서 벌어진 비극을 상세히 조사하자고 합니다. 알렘빅 동굴을 조사하여 기록으로 보이는 물건들을 찾아봅시다				
QUEST_LV_0400_20161005_001079	You've found enough info about Alembique Cave. Report the findings to Kedoran Alliance Merchant Alta	알렘빅 동굴에 대한 중요한 정보를 많이 찾았습니다. 케도라 상단원 알타에게 알려줍시다				
QUEST_LV_0400_20161005_001080	Collect Stalactite Chunks	종유석 덩어리 수집				
QUEST_LV_0400_20161005_001081	Alembique CaveKedoran Alliance Merchant Alta says the Stalactite chunks obtained from Alembique Cave can reveal the mystery behind this area. Collect Stalactite chunks from Alembique Cave by defeating the monsters there.	케도라 상단원 알타는 알렘빅 동굴의 몬스터에서 얻은 종유석 덩어리가 이 지역의 비밀을 밝혀줄 중요한 자료가 될 것이라고 합니다. 알렘빅 동굴의 몬스터들을 처치하고 종유석 덩어리를 수집하세요				
QUEST_LV_0400_20161005_001082	You've obtained enough stalactite chucks by defeating monsters. Return to Kedoran Alliance Merchant Alta.	몬스터들을 처치하고 종유석 덩어리를 충분히 모았습니다. 케도라 상단원 알타에게 돌아가세요				
QUEST_LV_0400_20161005_001083	Obtain %s by defeating monsters in Alembique Cave	알렘빅 동굴의 몬스터를 처치하여 %s 획득				
QUEST_LV_0400_20161005_001084	Remove the mysterious demon device	수수깨끼의 마족장치 제거				
QUEST_LV_0400_20161005_001085	Kedoran Alliance Merchant Alta wants you to remove the mysterious Demon Device that is thought to be the magic medium in Alembique Cave.	케도라 상단원 알타는 알렘빅 동굴에 퍼져있는 마법의 매개체로 추정되는 수수깨끼의 마족장치를 제거해달라고 부탁했습니다				
QUEST_LV_0400_20161005_001086	You've destroyed the mysterious Demon Device enough. Return to Alta	케도라 상단원 알타의 요청대로 수수깨끼의 마족 장치를 충분히 파괴했습니다. 알타에게 돌아가세요				
QUEST_LV_0400_20161005_001087	Talk to Refugee Brandon	피난민 브랜든과 대화				
QUEST_LV_0400_20161005_001088	Brandon is injured and cannot move. Ask how you can help him.	브랜든은 부상을 입고 꼼짝할 수 없는 상황이라고 합니다. 그를 어떻게 도우면 될지 물어보세요.				
QUEST_LV_0400_20161005_001089	Collect Whitetailed Grass from Turas Lot	튜라스 공터에서 흰꼬리풀을 수집				
QUEST_LV_0400_20161005_001090	Brandon seems to have injured his leg by getting it stuck on a trap. Collect Whitetailed Grass from Turas Lot which will help relieve his pain.	브랜든은 함정에 걸려 다리를 다친 듯 보입니다. 그의 통증을 완화시켜주기 위해 옆 튜라스 공터에서 진통효과가 있다는 흰꼬리풀을 모아다 주세요.				
QUEST_LV_0400_20161005_001091	You have collected enough Whitetailed Grass. Go and give it to Brandon.	충분한 양의 흰꼬리풀이 모였습니다. 브랜든에게 전해 주세요.				
QUEST_LV_0400_20161005_001092	Collect %s from the surrounding area	주변에서 %s을 수집				
QUEST_LV_0400_20161005_001093	Traps and more traps	연이은 함정				
QUEST_LV_0400_20161005_001094	Deal with the trapped monsters	함정에 같이 갇힌 몬스터 처치				
QUEST_LV_0400_20161005_001095	You have been caught in a trap. You must deal with the monsters that are in the trap with you as they have become violent.	함정에 갇혀 버렸습니다. 같이 갇히게 된 몬스터들이 난폭해져서 공격해 오고 있으니 그들을 모두 처치하세요.				
QUEST_LV_0400_20161005_001096	Deal with the violent monsters	난폭해진 몬스터 처치				
QUEST_LV_0400_20161005_001097	Getting out of the trap	함정에서 빠져나오기				
QUEST_LV_0400_20161005_001098	You have dealed with all of the monsters but are still trapped. Wait until the mysterious hunter disarms the trap.	몬스터들을 전멸시켰지만 함정에 그대로 갇힌 채입니다. 수수께끼의 사냥꾼이 함정을 해체할 동안 기다리세요.				
QUEST_LV_0400_20161005_001099	Track the mysterious hunter	수수께끼의 사냥꾼을 추적하기				
QUEST_LV_0400_20161005_001100	According to Refugee Brandon, the mysterious hunter is planning something in the forest. Track him in order to find out the truth.	피난민 브랜든의 말에 따르면 수수께끼의 사냥꾼이 이 곳에서 어떤 음모를 꾸미고 있는지 모릅니다. 그를 찾아 그의 진의를 확인하세요.				
QUEST_LV_0400_20161005_001101	Track the mysterious hunter	수수께끼의 사냥꾼의 뒤를 쫓기				
QUEST_LV_0400_20161005_001102	You have received treatment from the mysterious hunter. He told you to follow him if you wish to learn the truth behind the rumors. Follow him to his hideout.	수수께끼의 사냥꾼으로부터 치료를 받았습니다. 그는 자신에 대한 소문을 부정하며 확인하고 싶다면 자신을 따라오라고 합니다. 그를 따라 그의 은신처로 향하세요.				
QUEST_LV_0400_20161005_001103	Talk with the mysterious hunter	수수께끼의 사냥꾼과 대화				
QUEST_LV_0400_20161005_001104	You have succeeded in following the mysterious hunter to his hideout. Listen to his side of the story.	수수께끼의 사냥꾼을 따라 그의 은신처까지 오는 데 성공했습니다. 이제 그로부터 자초지종을 들어보세요.				
QUEST_LV_0400_20161005_001105	Talk to Vilhelmas	빌헬마스와 대화				
QUEST_LV_0400_20161005_001106	Vilhelmas seems to require help in defeating the beast. Talk to him.	빌헬마스는 괴수를 상대하는 데에 도움이 필요한 듯 보입니다. 그와 대화해보세요.				
QUEST_LV_0400_20161005_001107	Defeat the monsters indicated by Vilhelmas	빌헬마스가 지정한 몬스터 처치				
QUEST_LV_0400_20161005_001108	Vilhelmas wishes to test your skills in order to prevent any unnecessary casualties. Show your skills by defeating the Kugheri in the surrounding area.	빌헬마스는 불필요한 희생을 막기 위해 실력을 시험해보겠다고 합니다. 그가 지시한대로 주변의 쿠게리들을 해치우고 능력을 보여주세요.				
QUEST_LV_0400_20161005_001109	You have completed all the tasks Vilhelmas set you. Return and report back to him.	빌헬마스가 제시한 시험과제를 모두 완료하였습니다. 그에게 돌아가 보고하세요.				
QUEST_LV_0400_20161005_001110	Defeat the Kugheri in the surrounding area	주변의 쿠게리 처치				
QUEST_LV_0400_20161005_001111	Complicated Preparations	까다로운 준비 과정				
QUEST_LV_0400_20161005_001112	It seems like Vilhelmas is looking for a good way to deal with the beast. Ask if you can help him with preparations.	빌헬마스는 괴수를 상대할 좋은 방법을 모색하고 있는 것 같습니다. 그를 도울 방법을 물어보세요.				
QUEST_LV_0400_20161005_001113	Collect stimulated poison sacks from Kugheri Tots	쿠게리 토트에게서 자극받은 독주머니 수집				
QUEST_LV_0400_20161005_001114	Vilhelmas is trying to prepare poison arrows to deal a devastating blow to the beast. Collect the stimulated poison sacks he has requested.{nl}You will be able to collect them from Vilhelmas Tots after spraying them with stimulant.	빌헬마스는 먼저 괴수에게 치명상을 입힐 독화살을 준비 하려고 합니다. 그가 요구하는 자극받은 독주머니를 모아 주세요. {nl}자극받은 독주머니는 쿠게리 토트에게 자극제를 뿌린 후 처치하면 얻을 수 있습니다.				
QUEST_LV_0400_20161005_001115	You have collected enough poison sacks. Hand them over to Vilhelmas.	필요한 만큼의 독주머니를 모두 모았습니다. 빌헬마스에게 전해주세요.				
QUEST_LV_0400_20161005_001116	Vilhelmas seems to need some more ingredients to craft the poison. Ask him what else he requires.	빌헬마스가 사용하려는 독에는 또 다른 재료가 필요한 모양입니다. 그에게 어떤 재료를 모으면 되는지 물어보세요.				
QUEST_LV_0400_20161005_001117	Lead Vilhelmas to the Yellow Wolfsbane	빌헬마스를 노란 투구꽃으로 인도				
QUEST_LV_0400_20161005_001118	Vilhelmas says that he has to collect the Yellow Wolfsbane himself. Lead him to where the Yellow Wolfsbane has bloomed near Saalmas Falls.	빌헬마스는 노란 투구꽃이 필요한데 자신이 직접 수집해야 한다고 합니다. 그를 살마스 폭포 주변의 노란 투구꽃이 있는 장소로 인도하세요.				
QUEST_LV_0400_20161005_001119	You have collected all the required ingredients. Go and talk to Vilhelmas at his hideout.	독의 재료가 모두 모인 것 같습니다. 빌헬마스의 은신처로 되돌아가 그와 대화하세요.				
QUEST_LV_0400_20161005_001120	You don't have enough materials to craft the traps. Ask Vilhelmas what he needs.	독의 재료쪽은 모두 모였지만 함정을 만들기에는 부족한 것이 있는 것 같습니다. 빌헬마스에게 무엇이 필요한지 물어보세요.				
QUEST_LV_0400_20161005_001121	Collect paralysis poison from Kugheri Somys	쿠게리 소미에게서 마비약 모으기				
QUEST_LV_0400_20161005_001122	He requires paralysis poison for the trap. Defeat Kugheri Somy in order to take their paralysis poison.	마비 함정에 들어갈 마비약이 필요하다고 합니다. 쿠게리 소미들을 해치우고 그들이 가지고 다니는 마비약을 모아다 주세요.				
QUEST_LV_0400_20161005_001123	You have collected enough paralysis poison. Give it to Vilhelmas in order to craft a trap.	충분한 양의 마비약을 모았습니다. 빌헬마스에게 건네주고 함정을 만들게 하세요.				
QUEST_LV_0400_20161005_001124	Collect %s from Kugheri Somy	쿠게리 소미에게서 %s을 획득				
QUEST_LV_0400_20161005_001125	To trap a beast	괴수를 함정으로 몰아넣기				
QUEST_LV_0400_20161005_001126	Vilhelmas seems to have crafted the trap. Ask him how he plans to use it.	빌헬마스가 마비 함정을 완성한 것 같습니다. 이제 그 함정을 사용할 방법을 물어보세요.				
QUEST_LV_0400_20161005_001127	Setting the trap	길목에 함정 설치				
QUEST_LV_0400_20161005_001128	Vilhelmas has asked you to set the trap on the way to Saalmas Falls from Tredhalai Stream. Hide after setting all three traps.	빌헬마스는 트레달라이 냇가에서 살마스 폭포로 올라가는 길목에 마비 함정을 설치하라고 합니다. 세 함정을 모두 설치 후 괴수의 눈에 띄지 않게 숨으세요.				
QUEST_LV_0400_20161005_001129	Waiting for the beast	괴수를 기다리기				
QUEST_LV_0400_20161005_001130	You have set all of the traps. Wait for the beast to come.	마비 함정을 모두 설치했습니다. 괴수가 걸려들기를 기다리며 숨어 있으세요.				
QUEST_LV_0400_20161005_001131	Pursuing the beast	괴수의 뒤를 쫓기				
QUEST_LV_0400_20161005_001132	The beast has run away from Vilhelmas to Absuptas Plateau. Follow Vilhelmas who is in pursuit of the beast.	괴수는 빌헬마스를 피해 압수프타스 고원 방면으로 달아났습니다. 뒤를 쫓아간 빌헬마스를 따라 괴수를 추적하세요.				
QUEST_LV_0400_20161005_001133	The Beast's Final Stand	괴수와의 마지막 결전				
QUEST_LV_0400_20161005_001134	Critically Wounding the Beast	괴수에게 치명상입히기				
QUEST_LV_0400_20161005_001135	The cornered beast has begun to attack. Critically wound the beast with Vilhelmas.	궁지에 몰린 괴수는 공격해오기 시작했습니다. 빌헬마스와 함께 괴수에게 치명상을 입히세요.				
QUEST_LV_0400_20161005_001136	Vilhelmas seems to have been wounded. Ask him about his wounds.	빌헬마스는 부상을 입은 듯 합니다. 우선 그의 상태가 어떤지 물어보세요.				
QUEST_LV_0400_20161005_001137	Vilhelmas is unable to pursue the beast any further. Try talking to him.	빌헬마스는 더 이상 괴수를 쫓을 수 없는 상태 같습니다. 우선 그와 대화해 보세요.				
QUEST_LV_0400_20161005_001138	Defeat the beast	괴수를 처치				
QUEST_LV_0400_20161005_001139	The beast seems to have run towards Vaighe Hill after being critically wounded. Go and finish the fight.	치명상을 입은 괴수는 바이게 언덕으로 도망친 것 같습니다. 바이게 언덕으로 가 싸움의 마무리를 지으세요.				
QUEST_LV_0400_20161005_001140	You have defeated the beast. Go and tell this to Vilhelmas.	괴수를 처치하는 데 성공하였습니다. 빌헬마스에게 돌아가 그 사실을 전달해 주세요.				
QUEST_LV_0400_20161005_001141	Defeat the beast of Emmet Forest.	에메트숲의 괴수 처치				
QUEST_LV_0400_20161005_001142	Talk to Refugee Mylija	피난민 밀리아와 대화				
QUEST_LV_0400_20161005_001143	Refugee Mylija is worrying about where to go for help. Ask her what the problem may be.	피난민 밀리아는 도움을 청할 곳이 마땅치 않아 곤란해 하고 있습니다. 그녀에게 무엇이 문제인지 물어보세요.				
QUEST_LV_0400_20161005_001144	Obtain Leafnut Tailfruits	리프넛의 꼬리열매 획득				
QUEST_LV_0400_20161005_001145	Mylija has asked you to gather Leafnut Tailfruits to use as temporary food. Defeat the Yellow Leafnuts and gather their Tailfruits.	밀리아는 부족한 식량의 임시방편으로 리프넛의 꼬리열매를 모아달라고 합니다. 주변의 노란 리프넛들을 사냥하고 그 꼬리열매를 모아다 주세요.				
QUEST_LV_0400_20161005_001146	You have gathered enough to feed the refugees. Give the food to Mylija.	피난민들에게 필요한 만큼의 열매를 모은 것 같습니다. 밀리아에게 전달해 주세요.				
QUEST_LV_0400_20161005_001147	Defeat the Yellow Leafnuts and collect %s	노란 리프넛을 처치하고 %s 모으기				
QUEST_LV_0400_20161005_001148	Talk to Refugee Greg	피난민 그렉과 대화				
QUEST_LV_0400_20161005_001149	Refugee Greg seems to be very concerned about the monsters in the surrounding area. Talk to him.	피난민 그렉은 주변의 몬스터가 매우 신경쓰이는 것 같습니다. 그와 대화해 보세요.				
QUEST_LV_0400_20161005_001150	Collect Hard Wooden Sticks	단단한 나무막대 수집				
QUEST_LV_0400_20161005_001151	Greg says that they must find a way to protect themselves as they cannot expect any help from the lords. Collect Hard Wooden Sticks to help him.	그렉은 영주들의 도움을 받기 어려우니 몬스터들로부터 스스로 지킬 방법을 찾겠다고 합니다. 그를 위해 단단한 나무막대를 구해다 주세요.				
QUEST_LV_0400_20161005_001152	This should be good enough to use as a weapon against weak monsters. Give them to Greg.	이 정도면 약한 몬스터들 정도는 상대할 만한 무기가 될 것 같습니다. 그렉에게 나무막대들을 전달해 주세요.				
QUEST_LV_0400_20161005_001153	Refugee Mylija seems that this will not be enough. Ask her how she plans to deal with the problem.	피난민 밀리아는 이대로는 안된다고 생각하는 것 같습니다. 그녀에게 이 숲의 상황을 해결할 방법이 무엇인지 물어보세요.				
QUEST_LV_0400_20161005_001154	Getting the two lords to agree to talk	두 영주의 대화약속 받아내기				
QUEST_LV_0400_20161005_001155	Mylija seems to think that the only way the forest will become safe is for the two lords to stop bickering. Persuade both Lord Ryudhas and Joquvas to agree to have a conversation.	밀리아는 두 영주가 어떻게든 대화해서 싸움을 멈추어야 이 숲의 상황이 안정된다고 생각하는 것 같습니다. 위쪽에 머무르는 리우다스 영주와 아래쪽에 머무르는 요쿠바스 영주를 각각 설득해 대화 약속을 받아내세요.				
QUEST_LV_0400_20161005_001156	You have succeeded in pursuading both lords. Tell Mylija the good news.	두 영주를 설득하는 데에 성공했습니다. 밀리아에게 이 좋은 소식을 알려 주세요.				
QUEST_LV_0400_20161005_001157	Persuading Lord Ryudhas	리우다스 영주 설득하기				
QUEST_LV_0400_20161005_001158	Talk to Lord Ryudhas	영주 리우다스와 대화				
QUEST_LV_0400_20161005_001159	Lord Ryudhas seems to dislike the fact that there is a stranger walking about. Tell him why you have come.	영주 리우다스는 이 곳에 낯선 이가 맴도는 것이 마음에 안 드는 듯 합니다. 먼저 그에게 용건을 확실하게 밝혀주세요.				
QUEST_LV_0400_20161005_001160	Dig up Pystis Grass Roots	피스티스 풀의 뿌리 캐기				
QUEST_LV_0400_20161005_001161	Ryudhas has requested that in return for him agreeing to listen to you, you must gather Pystis Grass Roots to help his poisoned men. Dig up Pystis Grass Roots from the surrounding area.	리우다스는 대화에 응하는 조건으로 자신의 부하들에게 걸린 돌림병 약의 재료를 구해오라고 요구했습니다. 근처에서 자라는 피스티스 풀의 뿌리를 캐세요.				
QUEST_LV_0400_20161005_001162	You have gathered enough Roots for Ryudhas's men. Give him the Roots.	리우다스가 요구한 뿌리를 모두 캐내었습니다. 그에게 뿌리들을 넘겨주세요.				
QUEST_LV_0400_20161005_001163	It seems as if more is needed to stop the plague from spreading. Ask Lord Ryudhas what else you will have to bring.	병사들의 돌림병을 낫게 하기 위해서는 아직 부족한 것이 있는 듯 합니다. 영주 리우다스에게 무엇을 더 가져와야 되는지 물어 보세요.				
QUEST_LV_0400_20161005_001164	Collect Orange Grummer legs	주황 그루머의 다리 수집				
QUEST_LV_0400_20161005_001165	It seems as if you will need to grind and mix the Orange Grummer legs to the roots in order to craft the antidote. Collect Orange Grummer legs from the surrounding area and hand them over to Lord Ryudhas.	먼저 구한 뿌리 즙에 그루머의 다리를 갈아 섞어야 돌림병의 약이 완성되는 듯 합니다. 근처의 주황 그루머를 사냥하고 그 다리를 모아 리우다스에게 전해 주세요.				
QUEST_LV_0400_20161005_001166	You have obtained an ample amount of legs. Give them to Lord Ryudhas.	알맞은 양의 다리를 모을 수 있었습니다. 어서 리우다스에게 전달해 주세요.				
QUEST_LV_0400_20161005_001167	Collect %s by defeating Orange Grummer	주황 그루머를 처치하고 %s 수집				
QUEST_LV_0400_20161005_001168	Lord Ryudhas seems to have one final task to ask of you. Listen to what he has to request and get him to agree to have a conversation.	영주 리우다스는 마지막으로 개인적인 일을 부탁하려는 것 같습니다. 그의 부탁을 마저 들어주고 대화 약속을 받아내세요.				
QUEST_LV_0400_20161005_001169	Dig up the Toy Box from beneath the marked tree	상처있는 나무에서 장난감 상자 파내기				
QUEST_LV_0400_20161005_001170	Ryudhas wishes to retrieve a Toy Box from his youth. He said that it was beneath a marked tree, but you must remove the moss from the trees in order to find the marked tree. Gather Red Colimen fluid from the surrounding area in order to get rid of the moss and find the marked tree.	리우다스는 어린시절 추억의 장난감 상자를 되찾고자 합니다. 그는 흉터가 있는 나무를 찾으라고 하는데, 이곳의 나무들은 모두 이끼가 덮여 먼저 이끼를 녹일 필요가 있습니다. 붉은 콜리멘의 체액을 모아 아트민티스 공터에 있는 나무의 이끼를 녹여 흉터를 확인하고 그 밑에서 장난감 상자를 찾아 리우다스에게 전해 주세요.				
QUEST_LV_0400_20161005_001171	You have found the Toy Box that Lord Ryudhas was looking for. Give it to him and make him agree to having a conversation.	리우다스가 어린 시절 묻어 놓았던 상자를 찾았습니다. 어서 그에게 가져다 주고 대화 약속을 받아내세요.				
QUEST_LV_0400_20161005_001172	Dig up %s from beneath the marked tree	상처있는 나무 밑에서 %s 파내기				
QUEST_LV_0400_20161005_001173	Persuade Lord Joquvas	요쿠바스 영주 설득하기				
QUEST_LV_0400_20161005_001174	Talk to Lord Joquvas	영주 요쿠바스와 대화				
QUEST_LV_0400_20161005_001175	Talk to Lord Joquvas as the refugees have requested.	피난민들의 부탁에 따라 먼저 요쿠바스 영주에게 말을 걸어 보세요.				
QUEST_LV_0400_20161005_001176	Talk to Roberta	로베르타와 대화				
QUEST_LV_0400_20161005_001177	Roberta will listen to what you have to say instead of Lord Joquvas who is raging. Talk to her.	화내는 요쿠바스 영주 대신 측근인 로베르타가 대신 이야기를 듣겠다고 합니다. 그녀와 대화해 보세요.				
QUEST_LV_0400_20161005_001178	It seems as if everything must go through Roberta to get to Lord Joquvas. Listen to what she has to request first.	요쿠바스 영주에게 가는 모든 사안은 로베르타를 통해야 되는 것 같습니다. 먼저 그녀가 요구하는 것이 무엇인지 들어보세요.				
QUEST_LV_0400_20161005_001179	Defeat the Red Colimen	붉은 콜리멘 처치				
QUEST_LV_0400_20161005_001180	Roberta has requested that you defeat the Red Colimen in the surrounding area if you wish to make a request to Lord Joquvas. Defeat the Red Colimen in the surrounding area.	로베르타는 영주에게 용건을 전달하고 싶다면 먼저 근처의 콜리멘들을 처치해 줄 것을 요구해 왔습니다. 주변 지역에서 붉은 콜리멘들을 처치하세요.				
QUEST_LV_0400_20161005_001181	You have succeeded in defeating the requested number of Red Colimen. Now go and talk to Roberta.	로베르타가 요구한 숫자의 몬스터를 물리치는 데 성공하였습니다. 이제 그녀에게 자세한 용건을 밝히세요.				
QUEST_LV_0400_20161005_001182	Defeat %s as Roberta requested	로베르타의 부탁대로 %s 처치				
QUEST_LV_0400_20161005_001183	Roberta seems to care more about the refugees recognizing Lord Joquvas as the owner of the land than their well being. Ask her what she wants.	로베르타는 대화보다도 피난민들에게 이곳이 요쿠바스 가문의 땅임을 밝히는 데에 주력하는 것 같습니다. 먼저 그녀가 원하는 것부터 물어보세요.				
QUEST_LV_0400_20161005_001184	Search the ruins at Arcmnys Lake for the shield	아크메니스 호숫가의 폐허에서 방패 찾기				
QUEST_LV_0400_20161005_001185	Roberta says that there is a building at Arcmnys Lake where the groundkeeper hired by the Joquvas family used to stay. Look for objects with the seal of the Joquvas family.	로베르타는 아크메니스 호숫가의 폐허가 과거 요쿠바스 가문의 고용인이 머무르던 거처라고 합니다. 그곳에서 요쿠바스 문장이 그려진 증거품을 찾아 보세요.				
QUEST_LV_0400_20161005_001186	You have found a shield with the seal of the Joquvas family. Take it back to Roberta.	요쿠바스 가문의 방패를 발견하였습니다. 이제 로베르타에게 방패를 건네 주세요.				
QUEST_LV_0400_20161005_001187	Roberta seems to think that the shield will not be enough to convince the refugees. Ask Roberta what else needs to be found.	아무래도 방패로는 피난민들을 납득시키기 부족하다고 생각하는 것 같습니다. 로베르타에게 무엇이 더 필요한지 물어 보세요.				
QUEST_LV_0400_20161005_001188	Go and check the Monument with Roberta	로베르타와 함께 기념비 확인				
QUEST_LV_0400_20161005_001189	Roberta says that monuments raised by the Joquvas family in the area will be good enough to prove that they are the rightful owners. Go and check the monuments at Paccituche Trail, Skalda Road and Lyfetie Cliffs with her.	로베르타는 과거 요쿠바스 가문에서 곳곳에 세워놓은 기념비들이 큰 증거가 될 것이라 생각하고 있습니다. 그녀와 함께 파키투시 오솔길, 스칼다 돌길, 라이프타이 절벽에 기념비들의 상태를 각각 확인하세요.				
QUEST_LV_0400_20161005_001190	You have checked all of the monuments. Now ask Roberta to make Lord Joquvas agree to a conversation between the two lords.	모든 기념비의 확인이 끝났습니다. 이제 로베르타에게 요쿠바스 영주와 리우다스 영주간의 대화 약속을 받아내세요.				
QUEST_LV_0400_20161005_001191	It looks as if the conversation isn't going too well. Ask Refugee Mylija about what happened.	두 영주간의 대화가 시작된 것 같지만 뭔가 분위기가 좋지 않은 듯 합니다. 피난민 밀리아에게 자세한 것을 물어보세요.				
QUEST_LV_0400_20161005_001192	Go to where the two lords are having a conversation	두 영주 간의 회합장소로 찾아가기				
