QUEST_20150317_000001	Please select the user requiring a quest update.
QUEST_20150317_000002	Statue of Goddess Vakarine
QUEST_20150317_000003	Please select a territory.
QUEST_20150317_000004	Select
QUEST_20150317_000005	Please select an item.
QUEST_20150317_000006	Select Group
QUEST_20150317_000007	Please select a cheat start group.
QUEST_20150317_000008	Select Zone
QUEST_20150317_000009	Please select a starting zone.
QUEST_20150317_000010	Select Advancement
QUEST_20150317_000011	Please select a class.
QUEST_20150317_000012	Bokor Master
QUEST_20150317_000013	So you are curious about this stone slate. {nl}If you wish, I shall show you the will of its creator.
QUEST_20150317_000014	Goddess Laima
QUEST_20150317_000015	By the time you get this message, much time will have passed. {nl}I am Laima, the goddess of fate and wisdom.
QUEST_20150317_000016	600 years ago while creating this revelation, I foresaw a great deal of death and suffering. {nl}If you are seeing this, then I am afraid what I foresaw has come to pass.
QUEST_20150317_000017	The demons have started the first of the cataclysms, and the goddesses have vanished. {nl}I knew all of this would occur and did everything I could to prevent this fate, but my power was not enough.
QUEST_20150317_000018	Instead, I wandered through far-seeing dreams for an answer. {nl}You were at the end of them... a Savior.
QUEST_20150317_000019	Unfortunately, the demons could not stay still, knowing that I possess strength in clairvoyance. {nl}I was forced to hide until the time of your appearance.
QUEST_20150317_000020	I decided to divide my being and remain within many revelations. {nl} Revelations that I continued to create secretly over a millennium.
QUEST_20150317_000021	Savior, if you can help me regain my form, we can stop the demons' sinister plans.{nl}You must recover the revelations that I have hidden throughout every axis of time.
QUEST_20150317_000022	This divine task may be a heavy burden, but it is something you must bear. {nl}Perhaps in the muddy midst of your trials and tribulations, something may come about.
QUEST_20150317_000023	Nevertheless, only we can save this world.
QUEST_20150317_000024	I have passed the next revelation to the first Paladin. {nl}He will be waiting for you at the highest flower garden.
QUEST_20150317_000025	The dark aura is indeed unpleasant... {nl}But if this message is truly from the Goddess Laima, then I am simply in awe.
QUEST_20150317_000026	Well, you should hurry and go find Sir Uska. {nl}He will tell you where to go next. {nl}May the goddess bless your fate...
QUEST_20150317_000027	Please select the preferred Smart Gen.
QUEST_20150317_000028	William
QUEST_20150317_000029	The fee's 100 silver. {nl}It's cheaper than cutting through monster central.
QUEST_20150317_000030	Cyneburg
QUEST_20150317_000031	That'll be 100 silver coins. {nl}That'll cover operations, labor, and other expenses.
QUEST_20150317_000032	Hey, wait a minute. {nl}You know you need more than that...
QUEST_20150317_000033	That's no good! {nl}I can't work for nothing, even for a Revelator.
QUEST_20150317_000034	Wandering Merchant
QUEST_20150317_000035	Like a dandelion's seeds, I am merely one who follows the wind. {nl}Since we've met in such a curious way, perhaps you could spare a moment to view my curiosities?
QUEST_20150317_000036	Kristina
QUEST_20150317_000037	Welcome! {nl}You're looking for a travel companion, right? {nl}You won't find a better place for partners than here!
QUEST_20150317_000038	You can make your companions watch you fight or train special attributes. {nl}Earn enough affection, and you can even buy some cool equipment!
QUEST_20150317_000039	Raising your companion's affection will increase riding stamina and evasion! {nl}So what do you think? Is that enough to make you consider one?
QUEST_20150317_000040	The box requires a matching key.
QUEST_20150317_000041	Select Quest
QUEST_20150317_000042	Modify Quest Status
QUEST_20150317_000043	Force start?
QUEST_20150317_000044	Items to be deleted
QUEST_20150317_000045	Select GenType
QUEST_20150317_000046	Select Coordinates
QUEST_20150317_000047	Knight Titas
QUEST_20150317_000048	If so, go see Knight Commander Uska in Klaipeda. {nl}But first, I have an important errand I would like to run by you, so follow me.
QUEST_20150317_000049	It would be nice if I could find a moment to relax...
QUEST_20150317_000050	Sparnas... {nl}is not someone to take lightly...
QUEST_20150317_000051	Soldier Moody
QUEST_20150317_000052	Let's deal with this monster before talking.
QUEST_20150317_000053	Joint Investigation Team - Scott
QUEST_20150317_000054	I long for a time when our team is no longer needed... {nl}What a peaceful age that would be...
QUEST_20150317_000055	I don't know where to start. {nl}Have you heard anything?
QUEST_20150317_000056	By royal orders, we've come to this forest to investigate some strange events. {nl}Witnesses have reported something with a big face and bony fingers. {nl}What in the world could that be?
QUEST_20150317_000057	In the past, pilgrims traveled through this forest. {nl}But now due to the presence of monsters, only soldiers gather here.
QUEST_20150317_000058	Up until four years ago, the goddesses often blessed us with signs of their presence. {nl}But now, even our combined prayers don't bring so much as a tremor. {nl}Have they truly abandoned us?
QUEST_20150317_000059	Vacenin personally goes to each region to deal with things. {nl}He gets uncomfortable when he stays in the city.
QUEST_20150317_000060	Do you plan on staying or enlisting? {nl}If you're interested, I'll gladly recommend you to the head commanders.
QUEST_20150317_000061	Don't let your guard down. {nl}Monsters can appear any time, anywhere.
QUEST_20150317_000062	Where in the world did Goddess Zemyna go...
QUEST_20150317_000063	What in the world do you call this?
QUEST_20150317_000064	I think Zemyna, the goddess of the earth would grieve more than anyone else.
QUEST_20150317_000065	The Pokubu have always been here, but sometimes unfamiliar monsters are spotted as well.
QUEST_20150317_000066	I've thought about it. There's no doubt that the goddesses have abandoned us all. {nl}If that weren't so, then there wouldn't be so many monsters.
QUEST_20150317_000067	They say there's a man blessed with the goddess' strength living in the forest.
QUEST_20150317_000068	I want to go home.
QUEST_20150317_000069	The number of monsters here doesn't seem to change no matter how many of them we kill.
QUEST_20150317_000070	Did Julian send you off, Revelator?
QUEST_20150317_000071	I'm amazed. {nl}You're the first person I've met here in several years.
QUEST_20150317_000072	I'll show you what I saw.
QUEST_20150317_000073	Please, forget about me and just leave. {nl}The flowers seem to be coming along beautifully.
QUEST_20150317_000074	Lena
QUEST_20150317_000075	Please, tell me your life story. {nl}We follow the will of Vaivora and record all that is in this world.
QUEST_20150317_000076	Henrika
QUEST_20150317_000077	Hello! {nl}Welcome to the Klaipeda branch of the Magic Association. {nl}We specialize in studying the strange phenomena that occur when special items are combined.
QUEST_20150317_000078	There's nothing to see here but steam and Vubbes. {nl}Wait, what's that thing with the big face that's approaching?!
QUEST_20150317_000079	The land needs our attention as well. {nl}The world still isn't ruined... right?
QUEST_20150317_000080	If we continue to have courtesy, then we still know the way of a righteous life. {nl}We should all consider whether or not this mess is our fault because we relied on the goddesses for everything.
QUEST_20150317_000081	Bulletin Board
QUEST_20150317_000082	Welcome to the mining town of Klaipeda!
QUEST_20150317_000083	Indifferent Widow
QUEST_20150317_000084	I'm not sure I understand it completely, but what I'm sure of is that the goddesses didn't disappear all at once.
QUEST_20150317_000085	The first to disappear was the Goddess Gabija. {nl}I heard it was a very long time ago. {nl}One by one, starting with Gabija, they stopped replying.
QUEST_20150317_000086	Goddess Vakarine left us shortly before Medzio Diena. {nl}Both Zemyna and Ausrine disappeared soon after. {nl}It's already been four years since.
QUEST_20150317_000087	That's right. The strangest one of all was the Goddess Laima. {nl}No one's really sure when she disappeared.
QUEST_20150317_000088	Besides, isn't Laima the goddess of fate and foresight? {nl}She probably knew all about it.
QUEST_20150317_000089	Resting Soldier
QUEST_20150317_000090	I used to be an adventurer like you. Then I took an arrow in the knee...
QUEST_20150317_000091	It doesn't matter. Come and face me, you monsters!
QUEST_20150317_000092	A goddess appeared in my dream just now... {nl}She was so enchanting...
QUEST_20150317_000093	Still, I have a duty to defend the kingdom. That's why I'm here.
QUEST_20150317_000094	Uska is an old friend of mine.
QUEST_20150317_000095	We did our tests to become knights together. Uska got to where he is now with my sincere support. {nl}Oh, those were some crazy days... It'd be nice to see him again.
QUEST_20150317_000096	Just don't believe everything he says. {nl}He was known for being quite the show-off back home.
QUEST_20150317_000097	Me? I find it funny, so I just leave him alone.
QUEST_20150317_000098	Uh, wait. I take back what I said about not believing everything he says.
QUEST_20150317_000099	Everything that flies out of his mouth is a lie. Don't trust him.
QUEST_20150317_000100	Siauliai Guard
QUEST_20150317_000101	There are monsters beyond this point. Be careful.
QUEST_20150317_000102	These woods aren't exactly peaceful, but it's better than other places. {nl}There are forests that have nothing but souls roaming about.
QUEST_20150317_000103	This is what people who have seen a goddess in their dreams are being called.
QUEST_20150317_000104	I thought the Revelators' visions were madness at first. {nl}After all, the goddesses have been gone for a long time.
QUEST_20150317_000105	Isn't it true that the goddesses haven't responded to any of our prayers since Medzio Diena four years ago?
QUEST_20150317_000106	You can find Class Masters all around the kingdom. {nl}Why don't you visit them and learn what you can?
QUEST_20150317_000107	You don't know about Medzio Diena? You must have come from really far away. {nl}Four years ago, things went out of control at the capital.
QUEST_20150317_000108	It was a disaster... Many people were either injured or killed. {nl}Once gentle creatures turned fierce and many new monsters emerged.
QUEST_20150317_000109	If you are still interested about what happened on Medzio Diena four years ago, try visiting Klaipeda. {nl}Many of its survivors took refuge there.
QUEST_20150317_000110	Eastern Woods Sentinel
QUEST_20150317_000111	Are you heading to the Eastern Woods? {nl}You mustn't! It's far too dangerous!
QUEST_20150317_000112	Damn, those stubborn things chased us this far!
QUEST_20150317_000113	Those screams... We're under attack!
QUEST_20150317_000114	Safety Instructions
QUEST_20150317_000115	1. Only authorized personnel may enter. {nl}2. Always follow the directions of the mining supervisor.
QUEST_20150317_000116	3. Do not approach closed-off areas. {nl}4. Any suspicious individuals should be reported to the knights of Klaipeda.
QUEST_20150317_000117	Supply Base Soldier
QUEST_20150317_000118	I've never been in a real fight before so I'm a bit nervous.
QUEST_20150317_000119	Farm Sentinel
QUEST_20150317_000120	My colleague is in the middle of a battle at the Miners' Village. {nl}I've thought of going to help, but the Eastern Woods is in trouble as well, so all I can do is worry.
QUEST_20150317_000121	I think this mission has shown me enough monsters for a lifetime. {nl}It used to be just groups of Vubbes.
QUEST_20150317_000122	Chupacabras are fond of the streams and lush vegetation of the northern area.
QUEST_20150317_000123	Klaipeda Guard Captain
QUEST_20150317_000124	You're the...
QUEST_20150317_000125	It looks like you can see into the upper forest from here. {nl}Try not to get into trouble.
QUEST_20150317_000126	You don't have the required quest item. Are you sure you want to continue?
QUEST_20150317_000127	Klaipeda Girl
QUEST_20150317_000128	My neighbor used to be a monster hunter. {nl}He's retired now though. It has gotten extremely dangerous.
QUEST_20150317_000129	It would be nice if all these Revelators being here meant that the goddesses are back.
QUEST_20150317_000130	It might be silly to hope for the goddess' return, but it's better than nothing.
QUEST_20150317_000131	Klaipeda Lady
QUEST_20150317_000132	We can still grow from the land, and have a warm hearth at our homes to rest at. {nl}I will always believe the goddesses are somewhere in the world.
QUEST_20150317_000133	Keep faith. {nl}The goddesses may still send a Savior to us.
QUEST_20150317_000134	Hoplite Master
QUEST_20150317_000135	If the sword is a symbol of power, then the spear is that of pure destruction. {nl}Power or destruction - what would you reach for on the battlefield?
QUEST_20150317_000136	Machine Worker
QUEST_20150317_000137	Even with the world as chaotic as it is, we can't stop working. {nl}It's been four years. Isn't it time to make peace with the past and start over?
QUEST_20150317_000138	Klaipeda is a town that lives off its mining. {nl}With Medzio Diena, we ought to work on planting trees or cutting them.
QUEST_20150317_000139	My old man did this thing where he checked around corners for anything nice. {nl}Sometimes, he'd get lucky and find a nice treasure chest. I wonder who leaves them there.
QUEST_20150317_000140	Retired Hunter
QUEST_20150317_000141	I remember this battle in a deep canyon where soldiers fought a huge monster. {nl}Seeing the giant thing fall was amazing, but what was more amazing were the spoils.
QUEST_20150317_000142	Old Potter
QUEST_20150317_000143	I put a prayer on my earthenware, one by one. {nl}That way, the pots will one day be filled with the goddess' blessings.
QUEST_20150317_000144	Swordsmen should have Strength, but you can also have Dexterity and Constitution. {nl}You'll need to think about what to start with.
QUEST_20150317_000145	Wizards work with Intelligence, but shouldn't forget Spirit for more spell-casting. {nl}You'll have to choose between being balanced or specialized.
QUEST_20150317_000146	Archers should have Strength, but Dexterity will prevent problems with movement. {nl}You'll need to think about what to start with.
QUEST_20150317_000147	Clerics work with Intelligence, but might need a lot of Strength or Spirit. {nl}You should really decide what you want first.
QUEST_20150317_000148	Doppelsoeldner Master
QUEST_20150317_000149	Worthwhile things always carry a degree of risk. {nl}Naturally, for big rewards, you'll have to put up with lots of danger.
QUEST_20150317_000150	Corsair Master
QUEST_20150317_000151	I won't help anyone in trouble if there isn't anything in it for me.
QUEST_20150317_000152	Boulder
QUEST_20150317_000153	A large boulder is blocking the way.
QUEST_20150317_000154	(This needs to be repaired.)
QUEST_20150317_000155	A boulder blocks the way.
QUEST_20150317_000156	Magical Research Material
QUEST_20150317_000157	It appears to be someone's research notes from Mage Tower. {nl}Should it be copied?
QUEST_20150317_000158	Hiding and sneaking won't solve all your problems. {nl}A true Scout must also be ready to fight.
QUEST_20150317_000159	You're gonna need a lot of things when traveling. {nl}Be sure to stock up your provisions in advance.
QUEST_20150317_000160	If the control magic is dispelled, the divine messages won't be protected.
QUEST_20150317_000161	Forgotten Thief's Monument
QUEST_20150317_000162	I, Zubeck, leave this epitaph. {nl}For the honor of being the greatest thief in history, I challenged a powerful sorcerer.
QUEST_20150317_000163	But could I, a mere thief, claim victory by merely stealing from her? {nl}Perhaps, if I could rob the greatest archmage blind.
QUEST_20150317_000164	Yet, I couldn't. {nl}I wanted to be the number one thief in all of history, not just today.
QUEST_20150317_000165	I have at last discovered a way to enter the Mage Tower. {nl}To do so one has to concentrate magic power at a specific place. {nl}Now, I only need take one more decisive step.
QUEST_20150317_000166	Then, my special device will activate. {nl}If you do as I did, you will be able to enter the tower as well.
QUEST_20150317_000167	After that, you too can show those dumb magicians a thing or two. Haha!
QUEST_20150317_000168	Commanding Monument
QUEST_20150317_000169	The thieves who entered this tower were burned alive. {nl}I leave this monument as a warning to other trespassers. {nl}- Agailla Flurry
QUEST_20150317_000170	Demon Queen Gesti
QUEST_20150317_000171	Insolent humans.
QUEST_20150317_000172	Just you wait. This isn't the end. {nl}Pray with your heart that Laima will save this world.
QUEST_20150317_000173	Klaipeda Officer
QUEST_20150317_000174	Welcome, welcome. {nl}Sir Uska is waiting at Klaipeda's central square. {nl}Oh, did you need anything else first?
QUEST_20150317_000175	Do you want to head to Klaipeda's gate right away?
QUEST_20150317_000176	Temporary Operator
QUEST_20150317_000177	Please change this character's status.
QUEST_20150317_000178	NPC HIDE/UNHIDE Setting!
QUEST_20150317_000179	Follower Algis
QUEST_20150317_000180	The moment that the goddess foretold to the first Paladin has finally arrived. {nl}Come. Ask me anything.
QUEST_20150317_000181	A long, long time ago, there were nomads who suffered from a cursed plague. {nl}The honorable first Paladin removed the curse with a Holy Relic.
QUEST_20150317_000182	The Watchers are the descendants of those nomads. {nl}However, the Holy Relic was not meant for healing those people.
QUEST_20150317_000183	One day, the goddess requested the first Paladin to safeguard a divine revelation. {nl}The cursed nomads appeared just as the paladin mulled on how to keep it secret.
QUEST_20150317_000184	They and the first Paladin made three pledges before breaking the curse.
QUEST_20150317_000185	To build the Tenet Church together. {nl}To conceal the Holy Relic within these grounds and worship its holiness. {nl}To gather and fight together when danger comes close to this location.
QUEST_20150317_000186	All this, was to protect the revelation hidden in the sanctum of the Tenet Church.
QUEST_20150317_000187	The Holy Relic was originally made to protect the revelation as a bait. {nl}With it, we will lure the Demon Queen here and destroy her.
QUEST_20150317_000188	Anything can happen though. {nl}If the plan fails, then the final battle will likely happen in the Tenet Church.
QUEST_20150317_000189	Pawndel
QUEST_20150317_000190	What's up?
QUEST_20150317_000191	Really?
QUEST_20150317_000192	Pawnd
QUEST_20150317_000193	What happened?
QUEST_20150317_000194	Gesti told us to protect this place.
QUEST_20150317_000195	So what do I do now?
QUEST_20150317_000196	Is this the right place?
QUEST_20150317_000197	Explaining
QUEST_20150317_000198	Shared the details of the revelation fragment found in the Crystal Mine.
QUEST_20150317_000199	I don't know how great you were in the past nor do I care. {nl}In here, you follow the Royal Army's orders, even you, Knights of Kaliss. {nl}In here, our word is law!
QUEST_20150317_000200	Grave Robber Hubertas
QUEST_20150317_000201	Hanging around in these ruins is driving me insane. {nl}Why the heck did he come here anyway?
QUEST_20150317_000202	Grave Robber Benjaminas
QUEST_20150317_000203	People call us grave robbers, but we prefer to call ourselves... archaeologists, {nl}scavenging and making use of all these items no one uses anymore. {nl}It sure beats leaving them to rot, right?
QUEST_20150317_000204	A Citizen's Journal
QUEST_20150317_000205	It's been a year since the civil war broke out. Prices in town have risen dramatically. {nl}Commander Ruklys has sent for aid, to restore the town's dwindling supplies. {nl}It's been a while since we've had any good news. There's talk about King Kadumel going after the general. {nl}Mood's not going to change soon.
QUEST_20150317_000206	A Sentry's Report
QUEST_20150317_000207	The guard posts have been reinforced in response to King Kadumel's forces' movements in the country. {nl}It's been confirmed that the king commands a large army. {nl}But if General Hayatin can muster enough volunteer soldiers, the incompetent king will likely surrender or retreat.
QUEST_20150317_000208	A Trader's Log
QUEST_20150317_000209	The city is running out of food and supplies. {nl}(The rest is illegible.)
QUEST_20150317_000210	Rumor has it that Ruklys has heard about the citizens' harsh conditions {nl}and is negotiating with Kadumel for their amnesty.
QUEST_20150317_000211	An Officer's Record
QUEST_20150317_000212	Premier Eminent is in talks with Commander Ruklys. {nl}We may have to move to the Fortress of the Land and let the royal forces claim the city. {nl}It's good news for the civilians at least. Despite the town being conceded, the Fortress will not be taken as easily.
QUEST_20150317_000213	King Kadumel is keen on persecuting the townspeople. {nl}The premier is pushing Commander Ruklys to negotiate terms ensuring that the civilians are safe from enemy forces. {nl}Despite the royal forces occupying the town, there has yet to be any threatening movement.
QUEST_20150317_000214	We should wait until Kostas gets here. {nl}We have a lot to do, so it'd be nice if he gets here soon.
QUEST_20150317_000215	Cryomancer Kostas
QUEST_20150317_000216	Everything will be resolved when the Symbol of Silk is found. {nl}With it, we can revive the city.
QUEST_20150317_000217	Grave Robber Rudolfas
QUEST_20150317_000218	The Royal Army and the Knights of Kaliss... I think we've struck gold. {nl}No one's around here or calling this place home any more.
QUEST_20150317_000219	A Royal Officer's Record
QUEST_20150317_000220	There has been no progress since Ruklys' group retreated to the Fortress of the Land. {nl}The priests under Maven's direction are reluctant to fight, and the King is hiring mages by paying them a hefty sum. {nl}But we expect little to no progress at all even after their participation.
QUEST_20150317_000221	Townsperson's Document
QUEST_20150317_000222	How could this happen?! {nl}Lydia Schaffen is aiding Kadumel's forces!
QUEST_20150317_000223	Army Official's Report
QUEST_20150317_000224	Lydia Schaffen, a person I've only heard of in rumors, came to the city with her followers. {nl}The officers and soldiers expect she'll change the tide of the battle. {nl}}His Majesty ordered us to support her to the best of our ability.
QUEST_20150317_000225	Citizen's Record
QUEST_20150317_000226	The Fortress of the Land has fallen! It's all over...
QUEST_20150317_000227	Commander Ruklys has fallen in battle, and the Fortress of the Land has been taken. {nl}Some people say the commander died to Lydia Schaffen's arrow, and others say he died to the royal magicians' magic. {nl}It is indeed sad news.
QUEST_20150317_000228	To support the Knights of Kaliss, I was dispatched here from the head office. {nl}If you've any concerns, visit the headquarters in the Square of Lamentation.
QUEST_20150317_000229	The higher-ups in the Knights of Kaliss are spending a lot on this place. I'm not sure how to feel about that. {nl}To make matters worse, grave robbers are here, so we're just waiting for support.
QUEST_20150317_000230	Up until now, I've only seen the cursed figures of the fallen. Now that I'm here, that's going to change.
QUEST_20150317_000231	Will lifting this city's curse bring back the dead? {nl}I doubt it, but our lords have put great effort into retaking this area. {nl}They've done all they could for that purpose.
QUEST_20150317_000232	Grave Robber Stephonas
QUEST_20150317_000233	We're different from those other grave-robbing hooligans. {nl}They've no pride or business sense! {nl}If you help us now, we'll return the favor someday soon.
QUEST_20150317_000234	Royal Army Guard Rofdel
QUEST_20150317_000235	You can see all sorts of things happening from this watchtower even if it's as if time in the city has stopped. {nl}The dust usually gets in the way, but you can see all the way to Ruklys' paths when it rains.
QUEST_20150317_000236	We've worked for centuries to revive these ruins. {nl}With your help, we might be able to learn about that day and finally succeed.
QUEST_20150317_000237	Bokor Edita
QUEST_20150317_000238	There is definitely a curse here. I'm sure of it.
QUEST_20150317_000239	Alchemist Saliamonas
QUEST_20150317_000240	This place is truly intriguing. This city is brimming with things to study and experiment on.
QUEST_20150317_000241	Grave Robber Amanda
QUEST_20150317_000242	Our family's different from those other grave-robbing animals. {nl}We might bend a few rules to make a living, but still...
QUEST_20150317_000243	Are the soldiers already dead? {nl}I've never seen the Petrifying Frost as strange as this before. {nl}It's like everyone in the city is trying to hide something by reliving that day.
QUEST_20150317_000244	High Speed Movement
QUEST_20150317_000245	Torn Letter
QUEST_20150317_000246	To my beloved brother in Fedimian...
QUEST_20150317_000247	Gesti has sensed it. Stay calm. It is not yet time.
QUEST_20150317_000248	Off-duty Supply Trooper
QUEST_20150317_000249	I have no idea what the royal household is doing. {nl}I even heard that the nobles have already fled the town.
QUEST_20150317_000250	In times like these, it's good to craft and use your own things rather than buying stuff. {nl}I was originally a supply trooper, but that work's not much different from a blacksmith's.
QUEST_20150317_000251	Follower Norma
QUEST_20150317_000252	I was not aware that you were the one who accepted our request, Revelator. {nl}It is truly an honor.
QUEST_20150317_000253	Gesti's demons keep attacking relentlessly. {nl}Their dark influence has reached the Panto that live here.
