QUEST_20151224_003482	The lord advanced the deadline for the barrier saying that protecting the people from monsters is more important than the restoration projects.{nl}Workforce from the restoration project will be reassigned to the construction of the barrier.
QUEST_20151224_003483	Officer's Diary, Part II
QUEST_20151224_003484	The barrier was completed thanks to the cooperation of the mages.{nl}We will be safe from all monster threats as soon as the lord finishes the last stage on the barrier.{nl}I had heard rumors that our lord is an alchemist that is recognized by even the Winterspoon family. They must not have been exaggerations after all.{nl}
QUEST_20151224_003485	I received reports to raise the watch level to maximum from guard posts located outside of the castle walls.{nl}They say that demons are coming.{nl}
QUEST_20151224_003486	The lord ordered that all soldiers including those stationed at guard posts are to accompany all residents and vassals within the castle to the device.{nl}We may finally be able to see the full might of the barrier.{nl}I divided the resident ledger by section and distributed it to all squads.
QUEST_20151224_003487	Monster of Absenta Reservoir
QUEST_20151224_003488	The astonishment of when coming across the uncanny monster called a Hydra at the Absenta Reservoir cannot be fully put into words.{nl}It has six serpentine heads, crawls on four finned feet and can also swim freely because it also has a large fin on its tail.{nl}
QUEST_20151224_003489	It lurks in the depths of the Reservoir and swallows prey in one mouthful after killing it with it's big mouth and fangs. {nl}While it is only as big as a grown man, it is very agile and has remarkable recuperative powers.{nl}Thankfully, it is not hostile towards humans allowing the nearby residents to simply call it a mystical creature and avoid it.
QUEST_20151224_003490	The sun was so nice that I decided to dry the books in the sunlight.{nl}I was afraid that they might have gone moldy if I had left them inside any longer.{nl}
QUEST_20151224_003491	If you ever wish to read something, please come in any time to have a look.{nl}It is always nice to have books read regardless of who is reading them.
QUEST_20151224_003492	(It looks as if there are a few books laying in the wooden chest.{nl}Which one should I read?)
QUEST_20151224_003493	Miscellaneous
QUEST_20151224_003494	(It looks as if there are a few books mixed in with the odds and ends.{nl}Which one should I read?)
QUEST_20151224_003495	Hirevan swallowed once.{nl}Then he lashed out at him and repeatedly used the same attacks against him{nl}Even though he knew that it was in vain..{nl}Vladislovas grew bored of toying with the young Hirevan.{nl}Next time it would be the sharpened blade instead of the hilt striking at Hirevan's throat.
QUEST_20151224_003496	Hirevan suddenly turned,{nl}drew a pistol out from it's holster and pulled the trigger.{nl}The bullet lodged itself precisely in the middle of Vladislovas' forehead, {nl}making his large body slowly collapse towards Hirevan.{nl}
QUEST_20151224_003497	Thud!
QUEST_20151224_003498	{nl}The small boat was unable to withstand the combined weight of Vladislova and Hirevan {nl}and tilted over.{nl}Waves continuously rocked the boat, {nl}and the seagulls that held their breath during the fight now started crying again.{nl}
QUEST_20151224_003499	Nobody was left standing atop of the sea.{nl}That is how the name of the Great Pirate was swept away by the waves.
QUEST_20151224_003500	You're awake! How are you feeling?
QUEST_20151224_003501	I have bad news for you.{nl}The end of the world is looming closer!{nl}
QUEST_20151224_003502	Even the Revelators that Laima is waiting for are no more...
QUEST_20151224_003503	The world is holding on for the goddesses.{nl}
QUEST_20151224_003504	But in such a state...{nl}Haha...{nl}
QUEST_20151224_003505	It will make no difference if you tell Laima or not.{nl}Don't you think so?{nl}
QUEST_20151224_003506	Where have your wings gone?{nl}An empty shell of a goddess without any powers or dignity...
QUEST_20151224_003507	But in such a state...{nl}Haha...
QUEST_20151224_003508	It will make no difference if you tell Laima or not.{nl}Don't you think so?
QUEST_20151224_003509	What happened to your wings?{nl}Oh, yes... It was me who did that, didn't I...?
QUEST_20151224_003510	Nothing more than a shell of a goddess devoid of any powers or dignity...
QUEST_20151224_003511	Mage's Writing Table
QUEST_20151224_003512	(There are two letters wedged inside the book.{nl}Should I read them?)
QUEST_20151224_003513	It's such a relief that the barrier has been deactivated!{nl}Now we will be able to pray to Zemyna.
QUEST_20151224_003514	Goddess Zemyna...
QUEST_20151224_003515	I beg of you to listen to my prayers...
QUEST_20151224_003516	Full Soul Stone
QUEST_20151224_003517	(The power that was protecting the Holy Relic of the Order disappeared as the thoughts that were confined within the Evil Thoughts Stone started slipping away.)
QUEST_20151224_003518	An unknown power seems to be blocking the way.
QUEST_20151224_003519	Pendulum
QUEST_20151224_003520	The pendulum is moving slowly in a circular pattern.
QUEST_20151224_003521	There seems to have been a subtle change in the speed at which the pendulum is moving.
QUEST_20151224_003522	The pendulum seems to have begun reacting to something.
QUEST_20151224_003523	The pendulum seems to have detected something.
QUEST_20151224_003524	The pendulum is revolving quickly.
QUEST_20151224_003525	There seems to be something nearby.
QUEST_20151224_003526	(The Grave Keeper's Spell Doll attacks the Holy Relic of the Order.)
QUEST_20151224_003527	Gimmick Scarecrow
QUEST_20151224_003528	Gimmick Statue
QUEST_20151224_003529	Everything is becoming clearer now.{nl}I thank you once more.
QUEST_20151224_003530	My hometown, the Delmore Castle... is a truly beautiful place.{nl}The neighbors are so kind and the lord is also generous.{nl}
QUEST_20151224_003531	I was able to receive many rewards and apply for a long vacation {nl}thanks to my diligent service as a liason officer.{nl}I was excited at the thought of hosting a feast with the neighbors.{nl}
QUEST_20151224_003532	But what I saw when I arrived home... was an empty town with nobody in sight.{nl}
QUEST_20151224_003533	Well, to be completely honest... It wasn't totally empty. {nl}Demons suddenly appeared from every direction.{nl}
QUEST_20151224_003534	I ran like hell. {nl}Some sights caught my eye even amongst all that chaos.{nl}
QUEST_20151224_003535	Light beads being moved somewhere, the red gemstone... I still can't forget it.{nl}That blackish red gemstone that was shining and shimmering in a nauseating way.{nl}
QUEST_20151224_003536	At first, I thought that it was a simple demon attack.{nl}That there would be survivors hiding somewhere... {nl}That my parents would have made it out safely...{nl}
QUEST_20151224_003537	I mean, it's not like demon attacks are uncommon these days...{nl}But it wasn't just an attack. All those light beads... {nl}I never knew that they were the souls of the townspeople...{nl}
QUEST_20151224_003538	You are regretting this, aren't you?{nl}I can feel it. We are sisters after all...{nl}
QUEST_20151224_003539	Are you sad?{nl}Do you... despise me?
QUEST_20151224_003540	All that pain and sadness... Despair...{nl}
QUEST_20151224_003541	All those will subside within that person...
QUEST_20151224_003542	Please, save me...
QUEST_20151224_003543	Please... the prophecy... {nl}Stop Giltine...
QUEST_20151224_003544	The chest is empty.
QUEST_20151224_003545	There is a what appears to be a pressure plate that seems to act as some sort of switch in the middle of the magic circle.
QUEST_20151224_003546	The red shards start to glow as soon as you approach the magic circle.
QUEST_20151224_003547	The red shards react to the crystal in the middle of the device.
QUEST_20151224_003548	You seem to have recovered some HP.
QUEST_20151224_003549	You seem to have recovered some SP.
QUEST_20151224_003550	Integration Device
QUEST_20151224_003551	It seems to be inactive.
QUEST_20151224_003552	You see a suspicious device.
QUEST_20151224_003553	The purpose of this magic circle is unknown.
QUEST_20151224_003554	The blue shards react as you approach the altar.
QUEST_20151224_003555	The shards form into the shape of a key accompanied by blue light.
QUEST_20151224_003556	Nothing happened.
QUEST_20151224_003557	It is a fairly old altar.
QUEST_20151224_003558	The Sicarius Key emits light.
QUEST_20151224_003559	A faint crystal appears in the center of the magic circle.
QUEST_20151224_003560	It seems to require some time to be reactivated.
QUEST_20151224_003561	Activate the magic circle?
QUEST_20151224_003562	Copied Diary
QUEST_20151224_003563	.... ......{nl}....Seir Rainforest... Novaha Mon..... {nl}......... ...........{nl}....exterminate ..... ....as planned...
QUEST_20151224_003564	Evil Energy Purifier
QUEST_20151224_003565	ESC : Launch
QUEST_20151224_003566	A key is required to open this locked chest.
QUEST_20151224_003567	Thank you for helping out.{nl}All the townspeople can go down safely thanks to you.
QUEST_20151224_003568	Mysterious Device
QUEST_20151224_003569	The 5th of X{nl}-{nl}I steamed some potato dumplings to try to get to know the new neighbors.{nl}I heard some loud noises when I knocked on the door.{nl}The neighbor seemed to be quite expressionless, but lightened up at the sight of the dumplings I had brought along.{nl}
QUEST_20151224_003570	It seems that everybody that says they are followers of the goddesses are half-witted.{nl}Do you still not know my strength after all that you have been through!{nl}
QUEST_20151224_003571	I was waiting for you to come here.{nl}I will take care of you and torture the priest until the chest is unlocked!
QUEST_20151224_003572	We have long prepared to receive the Revelator in accordance to the legends.{nl}
QUEST_20151224_003573	What stands below are four sacred candlesticks...{nl}They are crafted in accordance to legend passed only to the bishops of Orsha.{nl}
QUEST_20151224_003574	So that we could bring and confirm Revelators at any time.{nl}
QUEST_20151224_003575	Now. Step onto the magic circle between the candlesticks.{nl}If you are indeed a Revelator, the magic circle will react and {nl}you will be able to oppose the Demon Lord with that power.{nl}
QUEST_20151224_003576	I thought that someone would come and try to rescue their colleague...{nl}It seems that I have caught someone completely different.{nl}
QUEST_20151224_003577	Tell me... {nl}How are you free of my power within my sphere of influence?{nl}
QUEST_20151224_003578	Yes... Of course.{nl}You are the Revelator that miss Giltine was speaking of.{nl}
QUEST_20151224_003579	Today is my lucky day.{nl}Not only have I almost found where the orders are hidden, but I also get to catch a Revelator...
QUEST_20151224_003580	There is no need for I, Marnox, to step forward.
QUEST_20151224_003581	Unbelievably, the piece of lead turned into gold in front of Modestas after a flash of suspicious light. The alchemist impudently said the following.{nl}[Now you owe me a gold bar, so make sure you bring it to me.]{nl}Modestas protested and argued, but the alchemist had never explicitly stated that what he was holding was made of lead.{nl}
QUEST_20151224_003582	Mage Tower Guild Dungeon
QUEST_20151224_003583	Select Guild Event
QUEST_20151224_003584	Please select a Guild Event
QUEST_20151224_003585	Select Event
QUEST_20151224_003586	Select the event you want to use
QUEST_20151224_003587	Do you want to enter this Guild Event dungeon?
QUEST_20151224_003588	Abandon Event
QUEST_20151224_003589	There is an ongoing Guild Event. Do you wish to abandon it?
QUEST_20151224_003590	Acquired wood!
QUEST_20151224_003591	Acquired a Mushroom!
QUEST_20151224_003592	You've found the herbs being harvested by demons!
QUEST_20151224_003593	Collecting Ronjia Grass
QUEST_20151224_003594	You've collected Ronjia Grass
QUEST_20151224_003595	Burning the box filled with Poisonous Herbs
QUEST_20151224_003596	You've successfully burned the box filled with Poisonous Herbs!
QUEST_20151224_003597	Collecting relic
QUEST_20151224_003598	You've collected Experiment Victims' Relic
QUEST_20160224_003599	Listen up, a pretty good request just came in.
QUEST_20160224_003600	Welcome.{nl}Are you looking for any requests?
QUEST_20160224_003601	Hm... This cannot be done all by your own.{nl}Speak to me again once you've gathered a few allies.
QUEST_20160224_003602	Do you want to go?
QUEST_20160224_003603	Darn... I am sorry, but I don't have an appropriate request for you.{nl}Maybe I'll have something for you next time.
QUEST_20160224_003604	Don't bite off more than you can handle. You seem to have a request already.{nl}Please come back after you've finished your current request.
QUEST_20160224_003605	Only the party leader can accept our requests.{nl}Could you ask your party leader to come here?
QUEST_20160224_003606	Earth Tower Lolopanther Area
QUEST_20160224_003607	Earth Tower Lolopanther Area (Recommended Lv: 280) {nl}Only you and your party members can enter together. {nl}Are you sure you want to enter?
QUEST_20160224_003608	Valis
QUEST_20160224_003609	There's nothing better than sparring to improve your skills!{nl}What do you say, would you like to participate?
QUEST_20160224_003610	There seems to be some sort of mysterious power indwelling in it.{nl}Would you mind me taking a closer look?
QUEST_20160224_003611	It seems research worthy.{nl}I sense an unknown power.
QUEST_20160224_003612	Unfortunately you didn't bring enough to create a combination with.{nl}Come visit me again once you've found them all.
QUEST_20160224_003613	There seems to be something missing.{nl}I think you'll have to have everything in order to realize the full power.
QUEST_20160224_003614	There now seems to be enough ready.{nl}It's all thanks to you.
QUEST_20160224_003615	I've collected all that I need for my research.{nl}Thank you for helping.
QUEST_20160224_003616	Sister Aiste
QUEST_20160224_003617	I don't think I'll be able to ask for any more help today.
QUEST_20160224_003618	I think it'll be too much to ask for more help since only the most difficult tasks remain.
QUEST_20160224_003619	I'm doing my best to stop the demons, but it will become more difficult.{nl}I'm sure I'll manage to prevail if you lend a hand.{nl}Please help me.
QUEST_20160224_003620	Sister Lhasa
QUEST_20160224_003621	Please...{nl}Although we are weak, we are holding the demons back for the sake of humanity.{nl}But our strength alone is not enough. Please! We need your help.
QUEST_20160224_003622	Thank you so much for saving me!{nl}I'm Ruina from the second group that was supposed to demolish that gate.{nl}
QUEST_20160224_003623	We came here to destroy the gate at the request of Saalus Convent.{nl}They said that monsters have been coming through that gate that suddenly appeared one day.{nl}
QUEST_20160224_003624	The advance contingent succeeded in pushing back the monsters, but failed to destroy the gate.{nl}That's why we came with divine magic scrolls and bomb materials.{nl}
QUEST_20160224_003625	But we were ambushed by a group of Hogmas on the other side of the lower bridge...{nl}We ended up losing all of our prepared bomb material.{nl}
QUEST_20160224_003626	Please.{nl}I think we'll be just be able to procure the necessary firepower {nl}to destroy the gate if you can retrieve some usable materials.
QUEST_20160224_003627	Book written in Runic Characters
QUEST_20160224_003628	This is a story about the nearly forgotten runic characters.{nl}Runic characters had been used since before the foundation of the kingdom by smaller northern tribes.{nl}Peculiarly, these people believed that the characters held magical powers.{nl}That's the reason why the northern people spent a long time to find those powers.{nl}
QUEST_20160224_003629	Finally, a person was able to find the powers dwelling in the runic characters.{nl}They do not have any powers by themselves, but they are a channel for powers that can only be manifested through them...{nl}That was the secret behind the runic characters.{nl}
QUEST_20160224_003630	He went straight to Goddess Saule and told her of the hidden powers of the runic characters, and the goddess rejoiced and blessed him.{nl}
QUEST_20160224_003631	People came to call him a 'Rune Caster'.{nl}He became the first Rune Caster Master and fostered many more Rune Casters.{nl}He also created the Rune Stone so that the new Rune Casters would easily be able to use runic characters.{nl}
QUEST_20160224_003632	One day, he vanished leaving only his Rune Stone behind.{nl}The Rune Stone he left behind has become a symbol of the way of the Rune Caster and has been passed down from master to master.
QUEST_20160224_003633	People often say that the goddesses are always with us.{nl}This is right not only in a spiritual sense but also a practical sense.{nl}That's because it symbolizes the fact that the goddesses are tending over us from their abodes.{nl}
QUEST_20160224_003634	{nl}For instance, it is said that Goddess Vaivora manages a massive library only permitted to the goddesses.{nl}This library is also the dwelling place of Goddess Vaivora.{nl}
QUEST_20160224_003635	{nl}Another example is the residence of Goddess Jurate which is rumored to be on a mysterious sea where human ships cannot reach.{nl}They say that a ship larger than most islands is the residence of Goddess Jurate.{nl}
QUEST_20160224_003636	{nl}It is said that even Goddess Vakarine that goes around numerous locations has her own abode.{nl}Some say that there is a demon prison in a dimension that we do not know of, and that is the domain of Goddess Vakarine. {nl}But that is only one of the many locations that Goddess Vakarine visits.{nl}
QUEST_20160224_003637	{nl}There are also legends that Goddess Laima has a palace deep underground where nobody knows of.{nl}There is no way to find it, it is also said that the Demon Goddess Giltine also resides there.
QUEST_20160224_003638	The Rune Stone...{nl}I haven't heard of that in a long time.{nl}
QUEST_20160224_003639	In the past, I've met a person that was searching for the {nl}special powers hidden within the runic characters.{nl}He was filled with a pure passion for the task.{nl}
QUEST_20160224_003640	He eventually found the hidden powers in the runic characters and became the first Rune Caster.{nl}A channel for power... The power of the runic characters was their {nl}ability to allow the casters to realized their strength through them.{nl}
QUEST_20160224_003641	He crafted a Rune Stone to let others use the powers of the Rune Stone with easier access.{nl}Although his Rune Stone was nothing extraordinary, the following generations of {nl}Rune Caster Masters have carefully guarded his Rune Stone out of respect...{nl}
QUEST_20160224_003642	Unfortunately his Rune Stone was lost during the Petrified City incident.{nl}That is why the Rune Caster Master is still looking for his Rune Stone.{nl}
QUEST_20160224_003643	The fact that you've come to me with knowledge of the Rune Stone... {nl}Perhaps it means that you were led here by its powers.
QUEST_20160224_003644	Yes. Although it is an old tale...{nl}I do have an idea of where the Rune Stone may be.{nl}{nl}
QUEST_20160224_003645	The last place I sensed the Rune Stone was at the Royal Mausoleum.{nl}But that was a long time ago... I don't recall exactly where I sensed it.{nl}
QUEST_20160224_003646	I remember the traveler that came to me asking for a blessing a few hundred years ago.{nl}He said that he had seen a mysterious stone with {nl}strange characters engraved on it near a waterfall.{nl}
QUEST_20160224_003647	Unfortunately I was not able to know about what was occurring{nl}around the world after I had resolved to protect the revelation.{nl}Perhaps humans may know more about the whereabouts of the Rune Stone than I do.{nl}
QUEST_20160224_003648	Yes. Maybe a human family that has survived for a long time such as the Jonas family...{nl}Someone that has eternal life like the Amjinas is sure to know something.
QUEST_20160224_003649	You mentioned 'Rune Stone', didn't you?{nl}Ah, could it be...{nl}
QUEST_20160224_003650	If you are talking about a stone with strange characters engraved on it, yes I do have one.{nl}I don't know how long it has been, but it has been in {nl}the possession of the Jonas family for generations.{nl}
QUEST_20160224_003651	But it is treated as rubbish since there is no way of knowing what it is used for.{nl}Now I know it is Rune Stone thanks to you.{nl}
QUEST_20160224_003652	Why are you searching for it though?
QUEST_20160224_003653	I see.{nl}It is useless in our hands, so we'll give it to you if you absolutely need it.{nl}
QUEST_20160224_003654	No matter how valuable an object may be, {nl}it has to be in the hands of someone that needs it to be worth anything.
QUEST_20160224_003655	You've come here in search of the Rune Stone?{nl}
QUEST_20160224_003656	I don't know where you've heard of it, but I do have one.{nl}I threw a tantrum when I was young to get it when {nl}it was gifted to the Winterspoon family long ago.{nl}
QUEST_20160224_003657	Though, that's already a few hundred years ago.{nl}Now where did I put it...
QUEST_20160224_003658	Oh, as it happens, I have it right here.{nl}I have no use for it, so you may have it if you need it.{nl}
QUEST_20160224_003659	It may have been destined for you since you are the first person {nl}to seek something that nobody wanted for hundreds of years.{nl}As a handler of time, I am thinking that perhaps it was a future promised in the past.
QUEST_20160224_003660	I can't seem to find where I've put it.{nl}I'll keep an eye out for it, so would you mind coming back later?
QUEST_20160224_003661	Do you mean the Rune Stone?{nl}
QUEST_20160224_003662	I don't have anything like that...{nl}But I do have something that comes to mind.{nl}
QUEST_20160224_003663	There is a place in West Siauliai Woods that cannot be accessed through ordinary means.{nl}I had faintly sensed a mysterious aura for a few hundred years...{nl}But I couldn't find a way to get there.{nl}
QUEST_20160224_003664	Perhaps the item you are searching for may be there.{nl}How about taking a look if you know how to get there?
QUEST_20160224_003665	Do you know that there is a place in West Siauliai Woods {nl}that cannot be accessed by ordinary means?{nl}I had sensed a mysterious aura there for hundreds of years.{nl}
QUEST_20160224_003666	I don't know how to get there, or what to expect to find there.{nl}You might be able to find something if you find a way to get there.
QUEST_20160224_003667	Rune Stone
QUEST_20160224_003668	(Unrecognizable characters are glowing.)
QUEST_20160224_003669	(It seems as if you require more Rune Stones.)
QUEST_20160224_003670	Something glowing seems to be embedded behind the tombstone.{nl}Take it out?
QUEST_20160224_003671	You can see many interesting things if you sit here.{nl}
QUEST_20160224_003672	Not too long ago, a lady that seemed to be a mage came to ask something strange.{nl}I think she was looking for a stone engraved with characters that glow blue or something?{nl}
QUEST_20160224_003673	I said I didn't know anything of the sort since I have never seen anything similar.{nl}She said something about going somewhere past Escanciu Village... I can't quite recall.
QUEST_20160224_003674	Rune Caster Master
QUEST_20160224_003675	Eh? Why am I sensing rune powers in you?{nl}
QUEST_20160224_003676	Goodness! {nl}That is the Rune Stone of the first Rune Caster Master, isn't it?{nl}
QUEST_20160224_003677	How did you manage to find it?{nl}I've been looking all over for it...{nl}
QUEST_20160224_003678	That Rune Stone... Could you give it to me, please?{nl}Although it may not mean too much to ordinary people, {nl}it means a lot to Rune Caster Masters.
QUEST_20160224_003679	Thank you so much.{nl}The Rune Stone of the first Rune Caster Master is finally back in {nl}the hands of Rune Casters after hundreds of years thanks to you.{nl}
QUEST_20160224_003680	I don't know if it is sufficient as a reward, but let me teach you a little about runic characters.{nl}While extremely rare, there are some books written in runic characters.{nl}
QUEST_20160224_003681	Perhaps if your magic is compatible with the runic characters...{nl}You may be able to become a Rune Caster.{nl}
QUEST_20160224_003682	No, I am certain that you will be able to become a Rune Caster.{nl}I think that the will of the runic characters led you here to me.{nl}
QUEST_20160224_003683	Rune Casters can cast powerful magic through Rune Stones.{nl}However, it does take a long time to gather the required magic.{nl}
QUEST_20160224_003684	Oh... Have I been talking too much about Rune Casters?{nl}My bad, but thank you so much for finding the Rune Stone.{nl}
QUEST_20160224_003685	Come back to me if you wish to become a Rune Caster.{nl}
QUEST_20160224_003686	I don't know if you could call it a reward, but I will teach you some runic characters.{nl}Although quite rare, there are occasionally some books written in runic characters.{nl}
QUEST_20160224_003687	You may be able to obtain important information from long ago.{nl}Not a bad deal, don't you agree?
QUEST_20160224_003688	Wandering Bard
QUEST_20160224_003689	Ask an owl of the forest, and he will answer.{nl}Oh, birch tree, only the owls are there for you. {nl}Oh.... Only the owls...{nl}
QUEST_20160224_003690	Oh, the youth. Oh, the beautiful...{nl}To introduce my poor self, I am a a mere dandelion seed wandering as the wind takes me.{nl}
QUEST_20160224_003691	My song flows as the wind blows, as your soul glitters brightly...{nl}Do you have an interest in the songs of this poor bard?{nl}
QUEST_20160224_003692	But poor old me. {nl}Though I wish to tell you, your lonesome friend must soon leave. {nl}Farewell...
QUEST_20160224_003693	Hollow Thorn Forest Dungeon
