QUEST_UNUSED_20151022_001684	Herbalist Tales asked you to get some herbs that would cure his wounds.	약초꾼 테일스는 자신의 상처를 치유 할 수 있는 약초를 구해달라고 합니다.	QUEST_LV_0100_20151016_010278	Guide on the Second Step	중간 설명	
QUEST_UNUSED_20151022_001685	It seems that even with the effects of the herbs, the wounds of Tales won't recover. Talk to Tales.	약초의 효력으로도 약초꾼 테일스의 상처는 낫지 않는것 같습니다. 약초꾼 테일스와 대화하세요	QUEST_LV_0100_20151016_010276	Guide on the First Step	시작 설명	
QUEST_UNUSED_20151022_001686	Talk with Cleric Submaster	클레릭 서브 마스터와 대화				
QUEST_UNUSED_20151022_001687	Tell Cleric Submaster about the status of Herbalist Tales	클레릭 서브 마스터에게 약초꾼 테일스의 상태를 말해주세요				
QUEST_UNUSED_20151022_001688	Talk with Cleric Submaster	클레릭 서브 마스터와 대화하세요	QUEST_LV_0100_20151016_010276	Guide on the First Step	시작 설명	
QUEST_UNUSED_20151022_001689	Hand over the herb to Herbalist Tales	약초꾼 테일스에게 약 건내주기				
QUEST_UNUSED_20151022_001690	Hand over the herb which you obtained from Cleric Submaster to Herbalist Tales	클레릭 서브 마스터에게 받은 약을 약초꾼 테일스에게 건내주세요				
QUEST_UNUSED_20151022_001691	It seems that Rose found something. Go back to her and talk.	로제가 뭔가를 발견한 것 같습니다. 그녀에게로 가 대화하세요	QUEST_LV_0100_20151016_010276	Guide on the First Step	시작 설명	
QUEST_UNUSED_20151022_001692	Defeat the demons at the Demons' Base	마족의 근거지에 있는 마족 처치하기				
QUEST_UNUSED_20151022_001693	Defeat the remaining demons at the Demons' Base	마족의 근거지에 남아 있는 마족를 처치하세요	QUEST_LV_0100_20151016_010278	Guide on the Second Step	중간 설명	
QUEST_UNUSED_20151022_001694	Defeat the remaining demons at the Demons' Base	마족의 근거지에 남아있는 마족을 처치하세요	QUEST_LV_0100_20151016_010280	Guide on the Final Step	마지막 설명	
QUEST_UNUSED_20151022_001695	Talk to Rose	로제와 대화세요	QUEST_LV_0100_20151016_010276	Guide on the First Step	시작 설명	
QUEST_UNUSED_20151022_001696	Look for the information regarding the giant bracken	거대 고사리와 관련된 정보 찾기	QUEST_LV_0100_20151016_010277	Second Step	중간 할 일	
QUEST_UNUSED_20151022_001697	Look for the information regarding the giant bracken at the Demons' Base	마족의 근거지에서 거대 고사리와 관련된 정보를 찾으세요	QUEST_LV_0100_20151016_010278	Guide on the Second Step	중간 설명	
QUEST_UNUSED_20151022_001698	Go back to Rose	로제에게 돌아가기	QUEST_LV_0100_20151016_010279	Final Step	마지막 할 일	
QUEST_UNUSED_20151022_001699	You've found the information about the giant bracken. Go back to Rose.	거대 고사리와 관련된 정보를 찾았습니다. 로제에게 돌아가세요	QUEST_LV_0100_20151016_010280	Guide on the Final Step	마지막 설명	
QUEST_UNUSED_20151022_001700	Go back to Rose	로제에게로 돌아가기	QUEST_LV_0100_20151016_010275	First Step	시작 할 일	
QUEST_UNUSED_20151022_001701	Go back to Rose and tell her about the information about the giant bracken	로제에게로 돌아가 거대 고사리 관련된 정보를 알려주세요	QUEST_LV_0100_20151016_010276	Guide on the First Step	시작 설명	
QUEST_UNUSED_20151022_001702	Rescue Rose	로제 구출하기	QUEST_LV_0100_20151016_010277	Second Step	중간 할 일	
QUEST_UNUSED_20151022_001703	Rose was captured by unidentified wizard and demons. Rescue her.	로제가 정체를 알 수 없는 마법사와 마족에게 붙잡혔습니다. 그녀를 구하세요	QUEST_LV_0100_20151016_010278	Guide on the Second Step	중간 설명	
QUEST_UNUSED_20151022_001704	You've rescued Rose. Talk to her.	로제를 구했습니다. 그녀와 대화하세요	QUEST_LV_0100_20151016_010280	Guide on the Final Step	마지막 설명	
QUEST_UNUSED_20151022_001705	Defeat the demons that are trying to kidnap Rose	로제를 납치하려는 마족 처치하기	QUEST_JOBSTEP_20150323_002333	Defeat %s	%s 처치	
QUEST_UNUSED_20151022_001706	Tell Rose about the information about the giant bracken	로제에게 거대 고사리와 관련된 정보를 알려주세요	QUEST_LV_0100_20151016_010276	Guide on the First Step	시작 설명	
QUEST_UNUSED_20151022_001707	Eliminate the power supply of the device	장치의 동력원 제거하기	QUEST_LV_0100_20151016_010277	Second Step	중간 할 일	
QUEST_UNUSED_20151022_001708	Eliminate the power supply of the device which makes the giant bracken bigger	거대 고사리를 크게 만드는 장치의 동력원을 제거하세요	QUEST_LV_0100_20151016_010278	Guide on the Second Step	중간 설명	
QUEST_UNUSED_20151022_001709	You've eliminated the power supply of the device. Talk to Rose.	장치의 동력원을 제거했습니다. 로제와 대화하세요	QUEST_LV_0100_20151016_010280	Guide on the Final Step	마지막 설명	
QUEST_UNUSED_20151022_001710	Rose is waiting on the way to the monastery. Talk to her.	로제가 수도원으로 향하는 길목에서 기다리고 있습니다. 그녀와 대화하세요	QUEST_LV_0100_20151016_010276	Guide on the First Step	시작 설명	
QUEST_UNUSED_20151022_001711	Defeat the demons that are blocking the road	길목을 지키고 있는 마족 처치하기	QUEST_LV_0100_20151016_010277	Second Step	중간 할 일	
QUEST_UNUSED_20151022_001712	Defeat the demons that are blocking the road to the monastery.	수도원으로 향하는 길목을 지키고 있는 마족을 처치하세요.	QUEST_LV_0100_20151016_010278	Guide on the Second Step	중간 설명	
QUEST_UNUSED_20151022_001713	Defeat Gremlin	그렘린 처치하기	QUEST_JOBSTEP_20150323_002333	Defeat %s	%s 처치	
QUEST_UNUSED_20151022_001714	Talk to the herb gatherer	약초꾼과 대화하세요				
QUEST_UNUSED_20151022_001715	Release the trap	덫을 풀어주세요	QUEST_LV_0100_20151016_010278	Guide on the Second Step	중간 설명	
QUEST_UNUSED_20151022_001716	Destroy the magic circle that is protecting the caldron	솥을 지키고 있는 마법진 파괴하기	QUEST_LV_0100_20151016_010277	Second Step	중간 할 일	
QUEST_UNUSED_20151022_001717	Destroy the magic circle that is protecting the caldron	솥을 지키고 있는 마법진 파괴하세요	QUEST_LV_0100_20151016_010278	Guide on the Second Step	중간 설명	
QUEST_UNUSED_20151022_001718	Destroys the caldron	솥 파괴하기				
QUEST_UNUSED_20151022_001719	The magic circle that was protecting the caldron has been removed. Destroy the caldron	솥을 지키고있던 마법진이 제거됐습니다. 솥을 파괴하세요				
QUEST_UNUSED_20151022_001720	Burn the box which has the bracken in it	고사리가 든 상자 불태우기				
QUEST_UNUSED_20151022_001721	Burn the box which the demons put the brackens in	마족이 고사리를 담아둔 상자를 태우세요	QUEST_LV_0100_20151016_010278	Guide on the Second Step	중간 설명	
QUEST_UNUSED_20151022_001722	The settlers are being threatened by Poatas that appeared in front of the entrance of Orsha! Defeat Poatas to secure the safety at the entrance of Orsha.	도시 오르샤 입구에 나타난 포아타로 인해 이주민들이 위협받고 있습니다! 포아타를 처치하여 오르샤 입구의 안전을 확보하세요				
QUEST_UNUSED_20151022_001723	Settler Izna asked you to get Red Leaves by defeating Leaf Bugs at the 1st district	이주민 이즈나는 1번 지역에서 잎방개를 처치하여 연붉은 잎사귀를 구해달라고 부탁했습니다	QUEST_UNUSED_20151016_000866	Settler Izna has asked you to defeat nearby monsters and collect red leaves.	이주민 이즈나는 주변 몬스터를 처치하여 연붉은 잎사귀를 수집해달라고 부탁했습니다	
QUEST_UNUSED_20151022_001724	As Izna requested to you, you've obtained enough Red Leaves. Talk to Izna	이주민 이즈나의 요청대로 연붉은 잎사귀를 충분히 구했습니다. 이즈나와 대화하세요	QUEST_UNUSED_20151016_000864	Talk with Settler Izna	이주민 이즈나와 대화하세요	
QUEST_UNUSED_20151022_001725	Settler Izna asked you to collect the mucus which you can obtain by defeating Chinencys at the 1st and the 2nd districts	이주민 이즈나는 1/2번 지역에 치넨시를 처치하여 얻은 점액을 수집해달라고 부탁했습니다	QUEST_UNUSED_20151016_000869	Settler Izna has asked you to collect Rampas Mucus.	이주민 이즈나는 렘파를 점액을 수집해달라고 부탁했습니다	
QUEST_UNUSED_20151022_001726	Acquired enough Rampar Mucus as Izna requested to you. Talk to Izna	이주민 이즈나가 요청한 렘파르 점액을 충분히 수집했습니다. 이즈나와 대화하세요	QUEST_UNUSED_20151016_000864	Talk with Settler Izna	이주민 이즈나와 대화하세요	
QUEST_UNUSED_20151022_001727	In order to help the settlers who are isolated in the forest due to the gigantic monsters, Settler Izna asked you to set the bonfire at the resting areas in the district 3 and 4.	이주민 이즈나는 거대한 몬스터 때문에 길을 숲 속에 고립된 북쪽 지역 이주민들을 돕기 위해 3/4 지역의 쉼터 모닥불을 켜달라고 했습니다				
QUEST_UNUSED_20151022_001728	Set the fire on woodpiles at the resting area	쉼터 장작더미에 불 지피기				
QUEST_UNUSED_20151022_001729	Settler Izna asked you to set the fire on the woodpiles of the resting areas for the settlers to see clearly	이주민 이즈나는 쉼터 장작더미에 불을 지펴서 먼 곳에 있는 이주민들이 볼 수 있도록 해 달라고 부탁했습니다				
QUEST_UNUSED_20151022_001730	Defeat Woodspirit	우드스피릿 처치				
QUEST_UNUSED_20151022_001731	Settler Dallanas blessed your adventure. And she also advised you to pray in front of the Statue of Goddess Zemyna and receive the protection of the goddess.	이주민 달라나스는 당신의 모험을 축복해주었습니다. 그리고 제미나 여신상에 경배하여 여신의 가호를 받아보라고 조언해주었습니다				
QUEST_UNUSED_20151022_001732	Defeat the monsters at the temporal resting area	임시 휴식처의 몬스터 처치				
QUEST_UNUSED_20151022_001733	Settler Dallanas told you that the temporal resting area where the settlers are waiting to enter Orsha has become dangerous due to the ourburst of the monsters recently. Let's defeat the monsters at the temporal resting area.	이주민 달라나스는 이주민들이 오르샤로 들어가기 위해 대기하던 임시 휴식처가 얼마 전부터 몬스터들의 출몰로 위험해졌다고 합니다. 임시 휴식처의 몬스터들을 처리해 줍시다	QUEST_UNUSED_20150729_000346	Progress	진행	
QUEST_UNUSED_20151022_001734	Settler Dallanas has asked you to bring the settlers that were spreaded across the temporal resting areas	이주민 달라나스는 임시 휴식처에 흩어져 있는 이주민들을 데리고 와달라고 부탁했습니다	QUEST_UNUSED_20151016_000883	Settler Dallanas has asked you to bring the settlers that were spreaded across the area.	이주민 달라나스는 주변에 흩어져 있는 이주민들을 데리고 와다라라고 부탁했습니다	
QUEST_UNUSED_20151022_001735	Talk with Inesa Hamondale	이네사 해먼데일과 대화하세요				
QUEST_UNUSED_20151022_001736	Pray in front of the Goddess Statue	여신상에 경배해보세요				
QUEST_UNUSED_20151022_001737	Talk with the Item Merchant	잡화상인과 대화				
QUEST_UNUSED_20151022_001738	Talk with the Item Merchant	잡화상인과 대화하세요				
QUEST_UNUSED_20151022_001739	Talk with the Accessory Merchant	악세서리 상인과 대화하세요				
QUEST_UNUSED_20151022_001740	Talk with Agent Cherasia	정보원 체라시아와 대화				
QUEST_UNUSED_20151022_001741	Talk with Agent Cherasia	정보원 체라시아와 대화하세요				
QUEST_UNUSED_20151022_001742	Collect the pieces of the memo that belongs to the Priest Irma	사제 이르마의 쪽지 낱장 수집				
QUEST_UNUSED_20151022_001743	Collect the pieces of the memo that belongs to the Priest Irma by defeating the monsters nearby	주변 몬스터들을 처치하여 사제 이르마의 쪽지 낱장을 수집하세요				
QUEST_UNUSED_20151022_001744	Talk with Agent Moren	정보원 모렌과 대화				
QUEST_UNUSED_20151022_001745	Talk with Agent Moren	시작정보원 모렌과 대화하세요				
QUEST_UNUSED_20151022_001746	Defeat the monsters around Moren	모렌 주변 몬스터 처치				
QUEST_UNUSED_20151022_001747	Protect Agent Moren while he is analyzing the collected information. As you defeat the monsters around, Moren will calmly analyze the information more quickly.	정보원 모렌이 수집한 정보를 분석하는 동안 보호해 주세요. 주변 몬스터들을 처리할 수록 모렌이 안심하고 더 빨리 정보를 분석할 수 있습니다				
QUEST_UNUSED_20151022_001748	Talk with Agent Moren	정보원 모렌과 대화하세요				
QUEST_UNUSED_20151022_001749	Collect the half burnt memo	반쯤 타버린 쪽지 수집				
QUEST_UNUSED_20151022_001750	Collect the half burn memo	반쯤 타버린 쪽지를 수집하세요				
QUEST_UNUSED_20151022_001751	Talk with Chaser Ulysses	추적자 예울리스와 대화				
QUEST_UNUSED_20151022_001752	Talk with Chaser Ulysses	추적자 예울리스와 대화하세요				
QUEST_UNUSED_20151022_001753	Check the hideout of the priests	사제들의 은거지 확인				
QUEST_UNUSED_20151022_001754	Check the hideout of the priests	사제들의 은거지를 확인하세요				
QUEST_UNUSED_20151022_001755	Obtain the diary of Urbonas	우르보나스의 일지 습득				
QUEST_UNUSED_20151022_001756	At the hideout of the priests, you've discovered the diary of Urbonas. Pick that up and hand it over to Chaser Ulysses	사제들의 은신처에서 우르보나스의 일지를 발견했습니다. 주워서 추적자 예울리스에게 전해줍시다				
QUEST_UNUSED_20151022_001757	Defeat Minotaur	미노타우르스 처치				
QUEST_UNUSED_20151022_001758	Talk with Chaser Talbasi	추적자 탈바시와 대화				
QUEST_UNUSED_20151022_001759	Go meet Chaser Talbasi at Paupys Crossing	파우피스 나루에 있는 추적자 탈바시를 찾아가세요				
QUEST_UNUSED_20151022_001760	Talk with Chaser Pierneef	정보원 페르니프와 대화				
QUEST_UNUSED_20151022_001761	Talk with Chaser Pierneef	정보원 페르니프와 대화하세요				
QUEST_UNUSED_20151022_001762	Defeat the monsters around	지역 몬스터 처치	QUEST_UNUSED_20150729_000346	Progress	진행	
QUEST_UNUSED_20151022_001763	Chaser Pierneef asked you to defeat the monsters at district 1 and 2	정보원 페르니프는 1/2번 지역의 몬스터를 처치해달라고 부탁했습니다	QUEST_UNUSED_20150729_000346	Progress	진행	
QUEST_UNUSED_20151022_001764	Defeat Lapezard	라페자드 처치	QUEST_JOBSTEP_20150323_002333	Defeat %s	%s 처치	
QUEST_UNUSED_20151022_001765	Defeat Lapemiter	라페마이터 처치	QUEST_JOBSTEP_20150323_002333	Defeat %s	%s 처치	
QUEST_UNUSED_20151022_001766	Get rid of the smelly carts	악취나는 수레 처리				
QUEST_UNUSED_20151022_001767	Chaser Pierneef asked you to eliminate the wagon that is spreading the bad smell at the 1st and 2nd district	정보원 페르니프는 1/2번 지역의 냄새나는 수레를 불태워서 없애달라고 부탁했습니다	QUEST_UNUSED_20150729_000346	Progress	진행	
QUEST_UNUSED_20151022_001768	Talk with Chaser Germeja	추적자 게르메이야와 대화				
QUEST_UNUSED_20151022_001769	Talk with Chaser Germeja	추적자 게르메이야와 대화하세요				
QUEST_UNUSED_20151022_001770	Use the monster attracting agent	몬스터 유인제 사용				
QUEST_UNUSED_20151022_001771	Chaser Germeja asked you to create conflicts between monsters since there aren't enough hands	추적자 게르메이야는 일손이 부족하니 몬스터들끼리 영역다툼을 일으켜보자고 합니다	QUEST_UNUSED_20150729_000346	Progress	진행	
QUEST_UNUSED_20151022_001772	Talk with Chaser Raitis	추적자 라이티스와 대화				
QUEST_UNUSED_20151022_001773	Talk with Chaser Raitis	추적자 라이티스와 대화하세요				
QUEST_UNUSED_20151022_001774	Chaser Raitis has asked you to defeat the monsters that are appearing from the hallway of the 4th district	추적자 라이티스는 4번 지역 통로에 나타나는 몬스터들을 처리해달라고 부탁했습니다				
QUEST_UNUSED_20151022_001775	Destroy the habitat of the monsters	몬스터 군락지 파괴				
QUEST_UNUSED_20151022_001776	Destroy the habitat of the monsters	몬스터 군락지를 파괴하세요				
QUEST_UNUSED_20151022_001777	Defeat the Chafer that suddenly attacked	급습한 체이퍼 처치				
QUEST_UNUSED_20151022_001778	Talk with Chaser Talbasi	추적자 탈바시와 대화하세요				
QUEST_UNUSED_20151022_001779	Collect the memos of Priest Gelija	사제 겔리야의 쪽지 수집				
QUEST_UNUSED_20151022_001780	Collect the memos of Priest Gelija by defeating the monsters around	주변 몬스터들을 처치하여 사제 겔리야의 쪽지를 수집하세요	QUEST_UNUSED_20150729_000346	Progress	진행	
QUEST_UNUSED_20151022_001781	The memo of Priest Gelija	사제 겔리아의 쪽지				
QUEST_UNUSED_20151022_001782	Search the hideout	은거지 수색				
QUEST_UNUSED_20151022_001783	Chaser Talbasi asked you to search the hideout of the priests who were discovered recently before you go meet Agent Larena.	추적자 탈바시는 정보원 라레나에게로 가기 전에 얼마 전 발견된 사제들의 은거지를 수색해달라고 부탁했습니다.				
QUEST_UNUSED_20151022_001784	Talk to Agent Larena	정보원 라레나와 대화				
QUEST_UNUSED_20151022_001785	Talk to Agent Larena	정보원 라레나와 대화하세요				
QUEST_UNUSED_20151022_001786	Search the traces of the priest	사제들의 흔적 수색				
QUEST_UNUSED_20151022_001787	Agent Larena asked you to take the dog that was raised by the priests and look for the traces of the priests around	정보원 라레나는 사제들이 기르던 개를 데리고 주변에서 사제들의 흔적을 찾아와 달라고 부탁했습니다	QUEST_UNUSED_20150729_000346	Progress	진행	
QUEST_UNUSED_20151022_001788	Talk with Chaser Sendal	추적자 센달과 대화				
QUEST_UNUSED_20151022_001789	Talk with Chaser Sendal	추적자 센달과 대화하세요				
QUEST_UNUSED_20151022_001790	Rescue Priest Pranas	사제 프라나스 구출				
QUEST_UNUSED_20151022_001791	Chaser Sendal has asked you to rescue the Priest Pranas who was captured by the demons	추적자 센달은 마족에게 잡혀 위기에 처한 사제 프라나스를 구해달라고 부탁했습니다				
QUEST_UNUSED_20151022_001792	Talk with Priest Pranas	사제 프라나스와 대화				
QUEST_UNUSED_20151022_001793	Talk with Priest Pranas	사제 프라나스와 대화하세요				
QUEST_UNUSED_20151022_001794	Look for the traces of Bishop Urbonas	주교 우르보나스의 흔적 찾기				
QUEST_UNUSED_20151022_001795	Priest Pranas asked you to come back to Orsha after finding the traces of Urbonas at the hideout. Pranas has returned to Orsha first due to the wounds.	사제 프라나스는 은거지에서 주교 우르보나스의 흔적을 찾아서 오르샤로 돌아와 달라고 부탁했습니다. 프라나스는 부상 때문에 오르샤로 먼저 돌아갔습니다				
QUEST_UNUSED_20151022_001796	Talk with Agent Orwen	정보원 오르웬과 대화				
QUEST_UNUSED_20151022_001797	Talk with Agent Orwen	정보원 오르웬과 대화하세요				
QUEST_UNUSED_20151022_001798	Agent Orwen has asked you to defeat the monsters that are disturbing the search activities of the agents.	정보원 오르웬은 정보원들의 수색 활동 방해하는 몬스터들을 처치해달라고 부탁했습니다	QUEST_UNUSED_20150729_000346	Progress	진행	
QUEST_UNUSED_20151022_001799	Eliminate the demonic magic circle	마족 마법진 해체				
QUEST_UNUSED_20151022_001800	Agent Orwen asked you to disband the demonic magic circles that are scattered across the 1st and the 2nd districts	정보원 오르웬은 1/2 지역에 분포한 마족의 마법진을 해체해 달라고 부탁했습니다	QUEST_UNUSED_20150729_000346	Progress	진행	
QUEST_UNUSED_20151022_001801	Talk with Agent Notres	정보원 노토레스와 대화				
QUEST_UNUSED_20151022_001802	Agent Notres wants to check whether the 3rd district is safe for the safe emigration of the settlers that are coming to Orsha. He asked you if the monsters there can be defeated.	정보원 노토레스는 오르샤로 몰려오는 이주민들의 안전한 이주를 위해 사전에 3번지역이 안전한지 확인해보려고 합니다. 해당 지역의 몬스터들이 처치할 수 있는 수준인지 알아봐달라고 부탁했습니다.				
QUEST_UNUSED_20151022_001803	Defeat the monsters in the hallway	통로의 몬스터 처치	QUEST_JOBSTEP_20150323_002333	Defeat %s	%s 처치	
QUEST_UNUSED_20151022_001804	Check the camp region	캠프 지역 확인				
QUEST_UNUSED_20151022_001805	Agent Notres wants to check whether it would be alright to rest at the camp of the 4th district while the settlers are heading to Orsha. Let's check whether 4th camp district is safe.	정보원 노토레스는 이주민들이 오르샤로 향하는 동안 4번 장소의 캠프에서 쉬어도 좋을지 확인하고 싶다고 합니다. 4번 캠프 지역이 안전한지 확인해 봅시다				
QUEST_UNUSED_20151022_001806	Talk with Agent Notres	정보원 노토레스와 대화하세요				
QUEST_UNUSED_20151022_001807	Defeat the boss monster	보스 몬스터 처치	QUEST_JOBSTEP_20150323_002333	Defeat %s	%s 처치	
QUEST_UNUSED_20151022_001808	Collect Corrupted Blood	오염된 피 수집				
QUEST_UNUSED_20151022_001809	Agent Notres Notores told you that he found the traces of the demons from the monsters that had gone mad. Defeat the monsters and collect the polluted blood of them and hand them over to Agent Notres	정보원 노토레스는 광포해진 몬스터들로부터 마족의 징후를 포착했다고 합니다. 몬스터들을 처치하여 그들의 오염된 피를 수집해서 정보원 노토레스에게 전달합시다	QUEST_UNUSED_20150729_000346	Progress	진행	
QUEST_UNUSED_20151022_001810	Talk with Chaser Zegaus	추적자 제가우스와 대화				
QUEST_UNUSED_20151022_001811	Talk with Chaser Zegaus	추적자 제가우스와 대화하세요				
QUEST_UNUSED_20151022_001812	Chaser Zegaus asked you to defeat the monsters around since he is hurt	추적자 제가우스는 부상당한 자신들을 위해 주변 몬스터를 처치해달라고 부탁했습니다	QUEST_UNUSED_20150729_000346	Progress	진행	
QUEST_UNUSED_20151022_001813	Retrieve the pockets of the chasers	추적자들의 주머니 회수				
QUEST_UNUSED_20151022_001814	Retrieve the pockets of the chasers	추적자들의 주머니 회수하세요	QUEST_UNUSED_20150729_000346	Progress	진행	
QUEST_UNUSED_20151022_001815	Priest Pranas is waiting for you at the entrance of Ashaq Underground Prison at Paupys Crossing	사제 프라나스가 파우피스 나루의 아샤크 지하 감옥 입구에서 당신을 기다리고 있습니다				
QUEST_UNUSED_20151022_001816	Follow Priest Pranas	사제 프라나스 따라가기				
QUEST_UNUSED_20151022_001817	Priest Pranas told you that he would first go to the 1st floor of Ashaq Underground Prison. Follow Priest Pranas to the 1st floor of Ashaq Underground Prison.	사제 프라나스는 동료들과 함께 아샤크 지하 감옥 1층으로 먼저 진입하겠다고 말했습니다. 아샤크 지하 감옥 1층으로 사제 프라나스를 따라가세요				
QUEST_UNUSED_20151022_001818	Talk with Priest Pranas	사제 프라나스와 대화와 대화하세요				
QUEST_UNUSED_20151022_001819	Look for a method to relieve the curse totem	저주 토템을 해제할 방법 찾기				
QUEST_UNUSED_20151022_001820	Priest Pranas asked you to find a way to relieve the curse totem	사제 프라나스는 저주 토템을 해제할 방법을 찾아달라고 부탁했습니다				
QUEST_UNUSED_20151022_001821	Check the curse totem	저주 토템 확인				
QUEST_UNUSED_20151022_001822	You've defeated enough demons nearby. Check the curse totem again	주변의 마족들을 충분히 처리했습니다. 저주토템을 다시 확인해 봅시다				
QUEST_UNUSED_20151022_001823	Destroy the curse totem	저주 토템 파괴				
QUEST_UNUSED_20151022_001824	The Priest Pranas asked you to destroy the curse totem that is set up on the way to the hideout of Urbonas by using the same method	사제 프라나스는 같은 방식으로 우르보나스의 은거지로 가는 길에 설치되어 있는 저주 토템을 파괴해 달라고 부탁했습니다				
QUEST_UNUSED_20151022_001825	Eliminate the fragments of the curse totem	저주 토템 파편 제거				
QUEST_UNUSED_20151022_001826	The curse totem which the Priest Pranas asked you to eliminate has been destroyed by someone. But, it seems that those fragments are still operating. Eliminate the fragments of the curse totem	사제 프라나스가 처리해달라고 부탁한 저주 토템이 이미 누군가에 의해 파괴되어 있습니다. 하지만 그 파편들이 아직 작동하는 것 같습니다. 저주 토템의 파편들을 제거하세요				
QUEST_UNUSED_20151022_001827	Check the curse totem	저주 토템 확인을 확인하세요				
QUEST_UNUSED_20151022_001828	Defeat the boss monster that is protecting the totem	토템을 지키는 보스몬스터 처치	QUEST_UNUSED_20150729_000346	Progress	진행	
