QUEST_LV_0400_20161005_000001	Kedoran Alliance Merchant Alta	케도라 상단원 알타				
QUEST_LV_0400_20161005_000002	I came here since I was worried, but I won't dare to go in there by myself.{nl}That's why I am asking you.	걱정이 돼서 와 봤지만 혼자서는 저 안으로 들어갈 엄두가 안나는구먼.{nl}그러니 이렇게 자네에게 부탁하는 걸세.				케도라 상단원 알타
QUEST_LV_0400_20161005_000003	I can't just wonder into places like that you know.{nl}There are monsters just sitting there...	안에 뭐가 있을 지 어떻게 알고 들어가겠나.{nl}뻔히 저렇게 몬스터들이 있기도 하고..				케도라 상단원 알타
QUEST_LV_0400_20161005_000004	There's rumors of the Alembique Legend among the refugees.{nl}I wanted to know the truth.	피난민들 사이에서 알렘빅 전설이라는 것이 돌고 있더라고.{nl}그 실체를 확인하고 싶었지.				케도라 상단원 알타
QUEST_LV_0400_20161005_000005	{nl}There might be products that the Alliance is looking for...{nl}Since you were going to explore the cave anyways, it's like hitting two Popolions with one stone.	{nl}상단에서 찾는 물건이 있을지도 모르고..{nl}자네도 이 동굴을 탐험할 거였으면 겸사겸사 기고 용병단을 찾아주면 서로 좋은 일 아닌가.				케도라 상단원 알타
QUEST_LV_0400_20161005_000006	{nl}I'll give you this book as payment.{nl}It'll be better than going in blind will it not?	{nl}대신 이 책을 주겠네.{nl}아무 것도 모르고 들어가는 것 보다는 조금이나마 도움이 될테니 말이야.				케도라 상단원 알타
QUEST_LV_0400_20161005_000007	Priest Lintas is correcting the contents of the monument.{nl}The process is taking some time.	사제 린타스가 기념비의 내용을 수정 중이다.{nl}꽤 작업이 길어지고 있다.				사제 린타스
QUEST_LV_0400_20161005_000008	Thanks to you, the monument has been corrected.{nl}We need to check up on the status of Priest Kidas and Brunas.	덕분에 기념비를 수정했습니다.{nl}사제 키다스와 브루나스의 진행 상황을 알아봐야겠습니다.				사제 린타스
QUEST_LV_0400_20161005_000009	Even with the help, a flechette is nowhere to be found.{nl}I should go back to my master after sorting things out a bit in here.	도움을 받아도 플레세트는 못 찾았어요.{nl}일단 여기 일을 좀 정리해서 스승님께 돌아갈 겁니다.				우그니스
QUEST_LV_0400_20161005_000010	Aquilas	아퀼라스				
QUEST_LV_0400_20161005_000011	I came here to learn archery but am just running errands finding that blasted arrow...{nl}If I knew that I had to look for arrows. I would not have started this journey...{nl}	궁술을 배우려고 여기까지 따라왔건만 알려주는 건 별거 없고 화살을 찾으라니..{nl}화살 찾으러 다닌다는 사실만 알았어도 이런 고생길에 나서진 않았을 거야.. {nl}				아퀼라스
QUEST_LV_0400_20161005_000012	I mean, this is all because of Lydia Schaffen.{nl}She should have taken her Flechette or whatever if she had used it to kill Ghibulinas!	리디아 샤펜도 그렇지. {nl}플레세트인지 뭔지로 지부리나스를 죽였으면 화살을 수거해 가야지 그냥 두고가?				아퀼라스
QUEST_LV_0400_20161005_000013	{nl}Who cares if she is a legendary person.{nl}She doesn't know how to look after her things.	{nl}전설적인 사람이라고 추앙 받으면 뭐해.{nl}자기 물건도 소중히 안 다루는걸.				아퀼라스
QUEST_LV_0400_20161005_000014	{nl}I can't understand my master.{nl}I don't know how I can be forgiven if I find that Flechette or whatever.	{nl}스승님도 참 이해 안돼.{nl}플레세트인지 뭔지를 찾으면 용서를 구할 수는 있는 거야?				아퀼라스
QUEST_LV_0400_20161005_000015	{nl}Even if I do somehow agree that it is important... I don't get how reporting on the vegetation is supposed to be important.{nl}Ugh... Not my kind of work.	{nl}백 번 양보해도.. 찾으려는 화살은 안 찾고 식생이나 보고하라는 건 정말 이해가 안돼.{nl}으… 하기 싫어.				아퀼라스
QUEST_LV_0400_20161005_000016	I'd be really grateful if you'd offer any type of help.{nl}First of all, could you get me some Poppy Bracken, Aily Grass and Pria Flowers.	도와준다면야 나야 좋지.{nl}일단 포피 고사리와 아일리 풀, 프리아 꽃잎을 모아줘.				아퀼라스
QUEST_LV_0400_20161005_000017	{nl}What do they have to do with the legendary arrow?{nl}I have no idea either.	{nl}이게 전설의 화살이랑 무슨 상관이냐고?{nl}그건 나도 정말 궁금해.				아퀼라스
QUEST_LV_0400_20161005_000018	Stupid Flechette or whatever it's called...	플레세트인지 뭔지 참 내..				아퀼라스
QUEST_LV_0400_20161005_000019	Mechen	메켄				
QUEST_LV_0400_20161005_000020	I thought that Aquilas had come to report...{nl}This place is dangerous due to all of the monsters and demons.	아퀼라스가 보고하러 온 줄 알았는데…{nl}이곳은 몬스터들 뿐만 아니라 마족들도 돌아다녀서 위험한 곳입니다.				메켄
QUEST_LV_0400_20161005_000021	{nl}How about leaving if you don't have any important business.	{nl}별 일이 없다면 어서 떠나시는 것이..				메켄
QUEST_LV_0400_20161005_000022	{nl}Oh?{nl}Ah, you're a Revelator.	{nl}아..?{nl}오, 계시자님이시군요.				메켄
QUEST_LV_0400_20161005_000023	{nl}It seems as if you are curious as to what my apprentices and I are doing here.{nl}Have you heard anything from Aquilas?	{nl}저와 제자들이 여기서 무엇을 하고 있는지 궁금하신 듯 합니다.{nl}아퀼라스에게서 혹시 들으신 것이 있으신지..				메켄
QUEST_LV_0400_20161005_000024	{nl}Oh, I am a member of the Astral Tower and sibling to the former leader.{nl}I made a big mistake while Ignas was trying to take control of the Astral Tower.	{nl}아, 전 별의 탑 단원이자 별의 탑 전 단장의 친동생입니다.{nl}이그나스가 별의 탑을 장악하는 과정에서 실수를 저지르고 말았지요.				메켄
QUEST_LV_0400_20161005_000025	{nl}Ignas didn't miss out on the opportunity and took over the Astral Tower.{nl}Of course, the rest of the members don't look upon me so kindly.	{nl}그리고 제 실수를 놓치지 않은 이그나스는 별의 탑을 장악하게 되었습니다.{nl}당연히 별의 탑 단원들은 저를 좋지 않게 보게 됐습니다.				메켄
QUEST_LV_0400_20161005_000026	{nl}No matter how I tell them that it was a mistake, they refuse to listen.	{nl}고의가 아니었음을 이야기 해도 단원들은 들어주지 않았고 모두 제게 등을 돌렸습니다.				메켄
QUEST_LV_0400_20161005_000027	{nl}That's why I have decided to try and find Lydia Schaffen's Flechette to try and undo my wrongdoings.	{nl}제 실수를 만회할 수 있는 방법을 찾다가.. {nl}리디아 샤펜의 전승 중 하나인 플레세트를 찾기로 결심했습니다.				메켄
QUEST_LV_0400_20161005_000028	{nl}They'll at least pretend to listen if I bring back the Flechette.{nl}I've come to this place as I am almost certain that her Flechette must be in Ghibulinas Forest.	{nl}플레세트를 찾아 가면 단원들도 제 이야기를 들어줄 것이니까요.{nl}여러 가지 조사 끝에.. 지부리나스 숲에 플레세트가 있을 가능성이 높다고 판단했습니다.				메켄
QUEST_LV_0400_20161005_000029	{nl}My apprentices and I have been trying to look for the Flechette but there's been no progress.	{nl}그래서 제자들을 데리고 플레세트를 찾고 있지만 별다른 진척이 없군요.				메켄
QUEST_LV_0400_20161005_000030	I see you've gathered it all.{nl}Thanks.	모아왔구나.{nl}고마워.				아퀼라스
QUEST_LV_0400_20161005_000031	{nl}Go to the camp and ask my master if you're wondering why we had to do this.	{nl}이런 일을 시키신 스승님은 캠프에 계시니깐 이런 걸 찾는 이유가 궁금하면 가 봐.				아퀼라스
QUEST_LV_0400_20161005_000032	{nl}Well, I'd better start looking at these unremarkable things to find something different.	{nl}그럼 나는 별 특이할 것이 없어 보이는 것들을 들여다 보면서 특이한 점을 찾아봐야겠다.				아퀼라스
QUEST_LV_0400_20161005_000033	Hmm... I thank you for your eagerness, but this place is much too dangerous with all of the demons roaming around. {nl}I would appreciate it if you would simply ask my apprentices how they are doing.	음.. 매우 감사 드립니다만, 이곳은 마족들이 돌아다니고 있어 위험합니다. {nl}직접 찾기보단 제 제자들의 수색 상황을 알아봐주셨으면 합니다.				메켄
QUEST_LV_0400_20161005_000034	{nl}Woognis is at the Vilkas Nest, Jenonhas is at Kainen Crossing.	{nl}우그니스는 빌카스의 서식지에서, 제노나스는 카이넨 나루터에 있습니다.				메켄
QUEST_LV_0400_20161005_000035	Whoa, you scared me! Who are you?	으앗 깜짝이야, 누구십니까?				우그니스
QUEST_LV_0400_20161005_000036	{nl}The current situation?{nl}I haven't even gone anywhere near the area since I'm too afraid.	{nl}수색 상황이요?{nl}저는 지금 수색은 커녕 근처에 가는 것조차 무섭다구요.				우그니스
QUEST_LV_0400_20161005_000037	{nl}That over there is the Vilkas nest, but how am I supposed to get in there.{nl}I don't know, maybe I'll be able to get there if I cover myself with Vilkas fur...	{nl}저기가 바로 빌카스들의 주요 서식지인데, 어떻게 혼자 가요.{nl}빌카스의 털이라도 바를 수 있다면 모를까..				우그니스
QUEST_LV_0400_20161005_000038	We'll be put in danger if we go and fight Vilkas near their nest.{nl}There are a lot of Vilkas at Kyrba Lot as well.	서식지 근처에서 빌카스를 잡으면 오히려 우리가 위험해질 수 있죠.{nl}키르바 공터에도 이곳 못지 않게 빌카스가 많이 있어요.				우그니스
QUEST_LV_0400_20161005_000039	{nl}Why don't we try gathering Vilkas fur over there.	{nl}그곳에서 빌카스의 털을 모으도록 하죠.				우그니스
QUEST_LV_0400_20161005_000040	There's a lot of Vilkas at Kyrba Lot, so it should be easy enough to get their fur there.	키르바 공터에서 빌카스가 많으니 털을 모으는데 좀 수월할 겁니다.				우그니스
QUEST_LV_0400_20161005_000041	I think we'll be able to fool them into thinking we're one of their friends with this amount of fur.	이 정도 양이면 몬스터들이 천적도 동료라고 생각할 거에요.				우그니스
QUEST_LV_0400_20161005_000042	I'm thinking of going to search their nest with this fur all over me.{nl}It's quite large so I don't know how long it will take but...	이제 빌카스의 털을 이용해서 녀석들의 굴을 수색해보려고 해요.{nl}서식지가 꽤 넓어서 수색하는데 조금 벅차기는 하지만..				우그니스
QUEST_LV_0400_20161005_000043	There's no reason for me to decline your offer of help.{nl}Let's go.	제 일을 돕겠다고 하시면 거절할 이유는 없죠.{nl}가시죠.				우그니스
QUEST_LV_0400_20161005_000044	There doesn't seem to be a Flechette where I checked.{nl}Did you find anything?	제가 확인한 곳에는 플레세트는 없어요.{nl}찾으신 거라도 있나요?				우그니스
QUEST_LV_0400_20161005_000045	{nl}Ah yes...{nl}Nothing...	{nl}아 네..{nl}없었군요..				우그니스
QUEST_LV_0400_20161005_000046	So my search has resulted in nothing.{nl}You said that you were gathering reports?	결국 제 수색 상황은 제자리 걸음이네요.{nl}스승님이 당신을 통해서 저희들의 수색 상황을 알고 싶다고 하셨죠?				우그니스
QUEST_LV_0400_20161005_000047	{nl}There are two other apprentices.{nl}One is Aquilas and the other is Jenonhas.	{nl}저 말고도 스승님은 2명의 제자를 더 두셨어요.{nl}한 명은 아퀼라스 다른 한 명은 제노나스에요.				우그니스
QUEST_LV_0400_20161005_000048	{nl}Aquilas is on the road to Phamer Forest and Jenonhas is at Kainen Crossing.{nl}You said that you've already met Aquilas, so try looking for Jenonhas.	{nl}아퀼라스는 파마르 숲으로 향하는 길에 있고 제노나스는 카이넨 나루터에 있어요.{nl}아퀼라스는 이미 만나셨다고 하니.. 제노나스에게 가보세요.				우그니스
QUEST_LV_0400_20161005_000049	I'll return after wrapping things up here.	조금 마무리하고 스승님께 돌아갈 겁니다.				우그니스
QUEST_LV_0400_20161005_000050	Jenonhas	제노나스				
QUEST_LV_0400_20161005_000051	Thank you so much.{nl}I wouldn't have made it if you hadn't come here.	정말로 감사합니다. {nl}당신이 아니었다면 전 롬펠누카들에게 당했을 거예요.				제노나스
QUEST_LV_0400_20161005_000052	Yes, that is correct.{nl}I am looking for the Flechette.	네 맞아요.{nl}플레세트를 찾고 있었어요.				제노나스
QUEST_LV_0400_20161005_000053	{nl}If it was something that could have been found so easily, people would have already taken it, don't you think?{nl}This is pointless.	{nl}그런데  이런 식으로 찾는다고 찾아질 물건이었으면 누군가 벌써 가져갔겠죠.{nl}정말 아무 소용이 없는 일이에요.				제노나스
QUEST_LV_0400_20161005_000054	{nl}There are even demons here.{nl}I can't understand my orders this time round.	{nl}심지어 마족이 있어 목숨까지 위험하다고요.{nl}스승님의 이번 지시는 이해가 안돼요.				제노나스
QUEST_LV_0400_20161005_000055	{nl}I'm going to have to talk about this later.	{nl}따지러 가야겠어요.				제노나스
QUEST_LV_0400_20161005_000056	Everyone is exhausted since they're searching for an arrow that seems to be non-existant.{nl}Especially where there are so many demons roaming around...	어디에 있는지도 모르는 화살을 찾으라고 하니 다들 힘들었을 겁니다.{nl}더구나 마족이 이렇게 돌아다니는 곳에서..				메켄
QUEST_LV_0400_20161005_000057	{nl}It's all because I am not skilled enough.	{nl}모두 제가 부족한 탓입니다.				메켄
QUEST_LV_0400_20161005_000058	The first Fletcher Master crafted the Flechette for Lydia Schaffen.{nl}Of course I thought about asking the Fletcher Master.	플레세트는 현재 플레처 마스터의 선조가 만들어 리디아 샤펜에게 주었습니다.{nl}저라고 플레처 마스터에게 말 해볼 생각을 안 해 봤겠습니까?				메켄
QUEST_LV_0400_20161005_000059	{nl}But the Fletcher Master and the other members of the Astral Tower... They won't talk to me because they think I am a traitor.{nl}That's why I am not even thinking about it.	{nl}하지만..플레처 마스터나.. 별의 탑 단원들은 절 배신자라 생각해 도와주지 않을 겁니다.{nl}그래서 기대도 하지 않고 있어요..				메켄
QUEST_LV_0400_20161005_000060	Of course I would appreciate the help but...{nl}I'm sure that it won't make a difference.	그렇게 나서 주시겠다면 감사한 일입니다만..{nl}청해봐도 소용없을 겁니다.				메켄
QUEST_LV_0400_20161005_000061	{nl}Don't be too disappointed though.{nl}The Fletcher Master is at the Goddess' Ancient Garden.	{nl}그래도 너무 실망하지 마십시오.{nl}플레처 마스터는 여신의 옛뜰에 있습니다.				메켄
QUEST_LV_0400_20161005_000062	Fletcher Master	플레처 마스터				
QUEST_LV_0400_20161005_000063	You said that Mechen asked you to find the Flechette?{nl}You still came to me knowing what kind of person he is correct?	메켄이 플레세트를 찾도록 도와달라고 하셨소?{nl}그 자가 어떤 자인지 알고 내게 부탁하고 있는 거요?				플레처 마스터
QUEST_LV_0400_20161005_000064	{nl}Of course I might think of helping him if he agrees to return the Flechette after finding it.{nl}However, he'll show his true colors as soon as we find the Flechette.	{nl}그 자가 플레세트를 찾고 내게 돌려준다면 조금이라도 도와줄 의향이 있소. {nl}하지만 플레세트를 찾으면 분명 속내를 드러내 그것을 차지할 것이오.				플레처 마스터
QUEST_LV_0400_20161005_000065	If you say that, I'll agree to help.	그렇게까지 하겠다면 당신을 믿어 보겠소.				플레쳐 마스터
QUEST_LV_0400_20161005_000066	{nl}This is a recipe for detecting the Flechette.{nl}Take this to Mechen.	{nl}여기 플레세트를 탐지할 수 있는 장치의 제작서요.{nl}이걸 가지고 메켄에게 가시오.				플레쳐 마스터
QUEST_LV_0400_20161005_000067	The Goddess' Ancient Garden...{nl}It will be a long trip.	여신의 옛뜰입니다.{nl}먼 길이 되실 겁니다..				메켄
QUEST_LV_0400_20161005_000068	He gave you a recipe that will allow us to craft equipment that will help us detect the Flechette?	플레세트를 탐지 할 수 장치를 만드는 방법이 적힌 제작서를 줬단 말입니까?				메켄
QUEST_LV_0400_20161005_000069	{nl}How did he decide to help us?	{nl}어떻게 그가 저를 도울 생각을 하게 된 거죠?				메켄
QUEST_LV_0400_20161005_000070	{nl}Ah... 	{nl}아.. 				메켄
QUEST_LV_0400_20161005_000071	{nl}I see.{nl}He agreed to help us under the condition of having my life if I do not give the Flechette.	{nl}그렇군요.{nl}제가 플레세트를 내주지 않을 땐 제 목을 치겠다는 말을 듣고서야 돕겠다는 거군요.				메켄
QUEST_LV_0400_20161005_000072	{nl}I don't think that will be necessary.{nl}I'll take a look at this recipe then...	{nl}제 목을 쳐야 하는 상황은 없을 겁니다.{nl}그럼 저는 이 제작서를 좀 읽어보겠습니다.				메켄
QUEST_LV_0400_20161005_000073	Mechen is the person who allowed the previous leader for the Astral Tower, his brother, to be taken down.	메켄은 별의 탑 단장이자 자신의 친형을 단장 자리에서 끌어내리는데 일등 공신을 한 인물이오.				플레쳐 마스터
QUEST_LV_0400_20161005_000074	{nl}How can I trust such a person.	{nl}그런 인간을 어찌 믿겠소.				플레쳐 마스터
QUEST_LV_0400_20161005_000075	The Flechette is said to be crafted from the divine energy of the Goddess.{nl}It says that we have to get the energy of a powerful demon since it will react to their energy.	플레세트는 여신의 신성력으로 만들어진 물건이라는군요.{nl}강력한 마족의 마력에 반응하니 마족의 마력이 필요하다고 제작서에 나와있습니다.				메켄
QUEST_LV_0400_20161005_000076	I'm worried that he might make us go and find capture a demon.	제자들에게 마족의 마력을 구해오라고 지시를 했지만 잘해낼지 걱정입니다.				메켄
QUEST_LV_0400_20161005_000077	You've collected a lot.{nl}Now what we need is...	꽤 많이 모아 주셨네요.{nl}그럼 이제 필요한 것은..				메켄
QUEST_LV_0400_20161005_000078	The recipe says that we need Vilkas essence in order to control the demon's energy.	제작서에는 마족의 마력을 제어할 수 있는 빌카스의 정수가 필요하다고 적혀있습니다.				메켄
QUEST_LV_0400_20161005_000079	My apprentices have gone to different locations to gather Vilkas essence.{nl}Could you please go to Kyrba Lot?	제자들은 각기 다른 장소로 가 빌카스의 정수를 모으고 있습니다.{nl}당신은 키르바 공터에서 빌카스의 정수를 모으면 됩니다.				메켄
QUEST_LV_0400_20161005_000080	All you have to do is gather Vilkas essence from Kyrba Lot.	키르바 공터에서 빌카스의 정수를 모아주시면 됩니다.				메켄
QUEST_LV_0400_20161005_000081	We have gathered all of the materials needed to create the detector.{nl}I'll start crafting it then.	탐지기를 만드는데 필요한 재료들은 모두 모였군요.{nl}그럼 탐지기를 만들어 보겠습니다.				메켄
QUEST_LV_0400_20161005_000082	I've finished crafting the detector.{nl}I'm going to give it to my apprentices to try and find the Flechette.	탐지기가 완성됐습니다. {nl}플레세트를 찾도록 제자들에게 탐지기를 나눠 줄 겁니다.				메켄
QUEST_LV_0400_20161005_000083	{nl}I guess it will make it easier to find the Flechette.	{nl}이제 플레세트를 수색하는데 조금이나마 수월해지겠군요.				메켄
QUEST_LV_0400_20161005_000084	If you wish to participate in finding the Flechette, please start at Taylie Lot.{nl}The other places will be covered by my apprentices.	플레세트를 찾는데 동참하시겠다면 테일리 공터에서 찾아주십시오.{nl}다른 곳은 제자들이 각각 흩어져서 수색할 테니까요.				메켄
QUEST_LV_0400_20161005_000085	{nl}Try using the detector at Taylie Lot at places you think the Flechette might be.{nl}It will react if the Flechette is nearby.	{nl}테일리 공터로 가셔서 플레세트가 있을 법한 예상 위치에 탐지기를 사용해 보십시오.{nl}플레세트가 근처에 있으면 반응이 있을 겁니다.				메켄
QUEST_LV_0400_20161005_000086	Go to Taylie Lot and look for the Flechette.	테일리 공터로 가서 탐지기로 플레세트를 찾으십시오.				메켄
QUEST_LV_0400_20161005_000087	Ah, have you found the Flechette?{nl}It feels a bit abrupt after all that fruitless time we spent searching for it...	오, 플레세트를 찾으셨습니까?{nl}그렇게 찾아 다니던 시간이 허무할 정도로 금방 찾아오셨군요..				메켄
QUEST_LV_0400_20161005_000088	{nl}Of course, none of us are Revelators...{nl}Good job.	{nl}역시 계시자님이십니다.{nl}고생 많으셨습니다.				메켄
QUEST_LV_0400_20161005_000089	{nl}Now it's time to take the Flechette to the Fletcher Master.	{nl}이제 플레세트를 플레쳐 마스터에게 전달해야겠지요.				메켄
QUEST_LV_0400_20161005_000090	Please be careful.{nl}I wish that this would help resolve the misunderstanding between us.	잘 전해주십시오.{nl}이렇게 해서 플래쳐 마스터의 오해만이라도 풀렸으면 좋겠습니다.				메켄
QUEST_LV_0400_20161005_000091	This... it is the Flechette that was created by my elders.{nl}I didn't think that Mechen would give it this easily.	이건..선조께서 만드신 플레세트가 맞소.{nl}메켄이 이렇게 순순히 내줄지는 몰랐소.				플레처 마스터
QUEST_LV_0400_20161005_000092	{nl}Hmm...{nl}Take this.{nl}Tell him that this is a sort of reward for finding me the Flechette.	{nl}흠..{nl}이걸 가져 가시오.{nl}나를 대신해 그가 플레세트를 찾아 준거에 대한 보상이라 생각하라고 전해 주시고.				플레처 마스터
QUEST_LV_0400_20161005_000093	{nl}I don't know how much good it will do for his honor...{nl}But people will at least know how much he went through to find the Flechette.	{nl}떨어졌다고 하는 그의 명예를 얼마나 회복시켜 줄 지는 모르겠지만..{nl}플레세트를 찾아 헤맨 정성 정도는 다들 알아 줄 거요.				플레처 마스터
QUEST_LV_0400_20161005_000094	A promise is a promise, so I'll hand it over.	약속은 약속이니, 일단 돌려드려야지요.				메켄
QUEST_LV_0400_20161005_000095	This... it's an Arrow of Proof crafted by the Fletcher Master...{nl}I hope people will listen to me a bit more if I have this.	이건..플레쳐 마스터가 만든 증명의 화살이군요..{nl}이거면 다들 제 진심을 조금은 알아 줄 겁니다.				메켄
QUEST_LV_0400_20161005_000096	This will help Mechen recover some of his honor.	그것으로 어느 정도 메켄의 명예는 회복이 될 거요.				플레처 마스터
QUEST_LV_0400_20161005_000097	Hello there.	여행자님이십니까.				사제 린타스
QUEST_LV_0400_20161005_000098	{nl}We are apprentices of Maven.{nl}We are rewriting the misinformation that has been spread about the Ruklys incident on this Monument.	{nl}저희는 메이번님의 제자들입니다.{nl}루클리스에 관해 왜곡되어 적힌 카듀멜 선왕의 기념비를 수정하는 일을 하고 있습니다.				사제 린타스
QUEST_LV_0400_20161005_000099	{nl}These were almost destroyed because of the actions for King Kadumel.{nl}However, King Barynwell decided to cast magic on them to make them unreadable instead.	{nl}사실, 카듀멜 선왕의 행적 때문에 이 기념비들은 파괴될 뻔 했죠.{nl}하지만 바린웰 국왕께서는 기념비들을 파괴하는 대신, 변형 마법을 걸어 읽지 못하게 만들었습니다.				사제 린타스
QUEST_LV_0400_20161005_000100	{nl}We are preparing to undo the magic and make the corrections.{nl}The monsters are stopping us from doing anything though.	{nl}저희는 변형 마법을 풀고 기념비를 수정하기 위해서 여러 준비를 하고 있습니다.{nl}그러나 몬스터의 습격으로 모두 허사가 될 수 있는 상황에 왔습니다.{nl}				사제 린타스
QUEST_LV_0400_20161005_000101	We will gladly accept any help you can offer us.	도와주시겠다니 염치불구하고 부탁을 드리겠습니다.				사제 린타스
QUEST_LV_0400_20161005_000102	{nl}First of all, we need to find the documents.{nl}These documents contain instructions on how to dispell transfiguration magic, but they've been scattered due to monster attacks.	{nl}일단, 문서를 찾아야 합니다.{nl}변형 마법을 풀 수 있는 방법이 적힌 문서인데, 몬스터의 습격으로 흩어지고 말았습니다.				사제 린타스
QUEST_LV_0400_20161005_000103	{nl}We were careful in making any further moves since we don't want to provoke any more monster attacks.	{nl}문서를 찾으려고 해도 언제 또 몬스터가 습격을 해 올 지 몰라 이렇게 소극적으로 움직이고 있습니다.				사제 린타스
