QUEST_20151001_002512	I've heard the demons failed to occupy the Mage Tower because of the Revelator,{nl}who has appeared recently. But, if I was one of them, {nl}I would have prepared enough so that no one could try occupying the tower. {nl}Unlike what had happened to my family.
QUEST_20151001_002513	How dare a Demon Lord insult the teachings of Maven...{nl}Naktis has paid the price for it.
QUEST_20151001_002514	I have heard about the Revelator who drove out the demons from the Mage Tower.{nl}The Masters didn't do anything. Of course, I didn't do anything neither.
QUEST_20151001_002515	Everyone is just busy trying to survive after Medzio Diena, {nl}so they don't have time to think about going to the great cathedral.{nl}But everyone relies on the Great Cathedral. {nl}The Revelator completed a huge task.
QUEST_20151001_002516	I don't know who the Revelator is, but I could have saved Mage Tower better than the Revelator. {nl}Of course, my fees would have be met.
QUEST_20151001_002517	Even a person like me who goes after money, I know how important the Great Cathedral is.{nl}But, one thing that keeps my attention... The necklaces of the wise man, Maven. {nl}They are not in the hands of the demons right?
QUEST_20151001_002518	I came here by passing through rough winds and waves, {nl}while you've came here by going through the Thorny Vines Forest.{nl}You must be joking that you haven't found the goddesses. Seriously, how did you do that?
QUEST_20151001_002519	If the Mage Tower collapses, Fedimian won't be safe.{nl}The Demon Lord Helgasercle... the end of the obsession ends in such vain. 
QUEST_20151001_002520	Ever since the Revelators who dreamt of the goddesses appeared, {nl}the hands of the demons released them one by one.{nl}The same goes for the Great Cathedral. {nl}The proof that the Goddesses didn't abandon us is them.
QUEST_20151001_002521	Leaving the kingdom
QUEST_20151001_002522	A gigantic tree rose up from deep underground the capital city.{nl}The size of the tree was big enough that it couldn't even be compared against any mountain.{nl}As a result, many cities and towns were destroyed and many people lost their beloved ones.{nl}
QUEST_20151001_002523	But, the disaster did not end there.{nl}The evil energy started to surround the grounds and the monsters started to become feral. {nl}The demons started to attack.{nl}It was like an incurable disease, we didn't see any sign of recovery.
QUEST_20151001_002524	Still, the goddesses were no where to be found.{nl}The goddesses who we trusted disappeared without a trace and responded to nobody's prayers.{nl}People became mad and depressed, and soon only resignations were left behind.{nl}We started to prevent the chaos as much as we could, {nl}but as we did so, more misunderstandings were created. {nl}Death was always close-by and we gradually became dreary. 
QUEST_20151001_002525	We are becoming dreary to all the sadness and the pains.{nl}As if lifeless, we give up on everything and try not to do anything.{nl}It is like we are seeing the end of the history of the kingdom...{nl}We are just keep repeating the names of the goddesses.{nl}
QUEST_20151001_002526	I will end my writing here and leave the kingdom.{nl}I don't like my feeling of helplessness and the depressions.{nl}I am going to leave to a place where I can dream for hope again...
QUEST_20151001_002527	Savior...{nl}Laima told us that she had dreamt about the collapse of the world.{nl}And among many Revelators, one Savior would save everyone.{nl}
QUEST_20151001_002528	However, I cannot fully trust Laima's foresight.{nl}
QUEST_20151001_002529	For the Savior that would appear some day...{nl}I should have been responsible for the flames of the world, but I neglected my duties.{nl}
QUEST_20151001_002530	I thought the reason why I had to follow the revelation on behalf of Agailla Flurry,{nl}was related to her death and the ill-fated relationship with Helgasercle.{nl}
QUEST_20151001_002531	But, everything was accomplished as foretold by Laima.{nl}After Medzio Diena, I had to endure the long fight with my weak power.{nl}
QUEST_20151001_002532	Thanks for rescuing me, Savior.{nl}I should've listened to Laima sooner... and I regret the days in the past.
QUEST_20151001_002533	Perhaps I shall soon lose my breath. {nl}Pilgrims, may the blessings of the goddess be with you!
QUEST_20151001_002534	What was the thing she was looking for until the end?{nl}I am sure it has a sad story behind it.
QUEST_20151001_002535	Tree Root Crystals are slowly killing me.{nl}It feels as if I am drowning.{nl}
QUEST_20151001_002536	I have lost all desires. Am I dying? {nl}Eating and even breathing feels meaningless to me.{nl}
QUEST_20151001_002537	This surely isn't a teaching of Maven. {nl}Greed? Laziness? How can we call killing each other a lesson? {nl}I even envy Dion for dying first.{nl}
QUEST_20151001_002538	If only I had a little more time... {nl}The data I've collected near Dykyne Fork... I can't leave them...
QUEST_20151001_002539	The archer gives an arrow as a present, but the enemy take it as death.{nl}I think the world is like that now.
QUEST_20151001_002540	I will stay here with the Believers. {nl}I will somehow prevent the Thorn Forest from expanding any more.{nl}
QUEST_20151001_002541	Don't tell them about me for a while.{nl}Humans need a place to rely on...{nl}When they find out the powerlessness of the goddesses, this world will be filled with chaos and sighs.{nl}
QUEST_20151001_002542	The guardian of the Royal Mausoleum where the next revelation awaits is quite far from here.{nl}So I will open a portal for you as a shortcut.{nl}In the name of Saule, the goddess of the sun, I will pray for your safety.
QUEST_20151001_002543	Speaking of eternal life... look at Tesla. {nl}You would think that there is no aging in eternal life, don't you agree?
QUEST_20151001_002544	(There are barely legible words written here.) {nl}...Juros could not hold his breath any longer so he ended up inhaling the spores and died. {nl}Mushworts hunt people with the cruelest method I've ever seen. {nl}They walk around our gathering places and shake out mushrooms that release spores.{nl}
QUEST_20151001_002545	Even when the goddesses are not around, the Oracles still deliver the goddesses' message to people. {nl}Surely that is proof that the goddesses still exist.
QUEST_20151001_002546	Medzio Diena was not nature's will.{nl}After all, nature is governed by the goddesses, and they would never do harm to us all.
QUEST_20151001_002547	I offer this Goddess Statue, which I have put all my heart and soul into, to the goddess of great honor and light.
QUEST_20151001_002548	Among my disciples, two of them followed me until my latter years and they will also be my successors after my death. {nl}
QUEST_20151001_002549	...I am thinking whether I should thank the goddesses for this discovery or worry that my craving for knowledge could ruin the world.{nl}
QUEST_20151001_002550	I can't sleep well due to the fear of my research results being spread by interrogations from the demons. {nl}That's why I wish to pass the rest of the research to the one I can trust.
QUEST_20151001_002551	Are you interested in the eternal life?{nl}We, Necromancers control the dead, so it's easy when you think about that.{nl}
QUEST_20151001_002552	If he asks about the weather, then tell him that it will be sunny.{nl}Okay then, I will be counting on you as I wait.
QUEST_20151001_002553	If he asks about the weather, then tell him that it will be cloudy. {nl}Okay then, I will be counting on you as I wait.
QUEST_20151001_002554	If he asks about the weather, then tell him that it will be rainy. {nl}Okay then, I will be waiting for you.
QUEST_20151001_002555	I am a merchant selling goods at Fedimian.{nl}Do you need anything from me?
QUEST_20151001_002556	Yes, we have a long way to go so I hope it won't rain.{nl}The weather won't get bad today, right?
QUEST_20151001_002557	So you are the one sent by the Monk Master.{nl}We've received the goods well.{nl}Please send my gratitude to the Monk Master.
QUEST_20151001_002558	Is that so... I must hurry then.
QUEST_20151001_002559	Unfortunately, we don't have any goods to sell at the moment.
QUEST_20151001_002560	Be careful on your way back.
QUEST_20151001_002561	I'll never forgive the monsters that killed my family. {nl}Though my body returns to the ground, my soul still burns with anger. {nl}Oh, goddess. Only the cold blood of the monsters can cool my rage.
QUEST_20151001_002562	King Kadumel finally dies.
QUEST_20151001_002563	The balance of power between the demons and the goddesses, while fragile, has been stable for a long time.{nl}So long as they didn't cross each other's territories.{nl}
QUEST_20151001_002564	But, the demons broke through first.{nl}With the Petrifying Frost... even the spirits became stones.
QUEST_20151001_002565	As the demons started casting their petrification curse on this region, the goddesses tried to save the humans.{nl}However, the demons advised the goddesses that doing so would violate the rules that they mutually agreed to...
QUEST_20151001_002566	Excuse me for a bit. It is a horrible memory...{nl}They brought the catastrophe. {nl}A strong catastrophe which made goddesses to give up rescuing this place.
QUEST_20151001_002567	The goddesses already gave up rescuing once as they couldn't do anything on Medzio Diena.{nl}But, we can't just give up.
QUEST_20151001_002568	Savior.{nl}As you can see, I cannot do anything myself at the moment.{nl}As you have heard, after Medzio Diena my powers have become weak...{nl}
QUEST_20151001_002569	In this prison, a new disaster is about to happen.{nl}The demons are keep coming over from the dimensional crack,{nl}and they are trying to take this prison as their new camp.{nl}
QUEST_20151001_002570	I don't have any power left to close the dimensional crack.{nl}But, I think there is still a way.{nl}
QUEST_20151001_002571	Your help is the only way to turn this situation around.{nl}Since I am powerless, please lend me your power to close the dimensional crack.
QUEST_20151001_002572	Unforgivable.
QUEST_20151001_002573	Additionally, the heart of a Stoulet is required after offering the flowers.{nl}Do you wish to dedicate a Stoulet Heart in exchange for my blessing?
QUEST_20151001_002574	(A dubious black powder covers the pillar. Try scraping them off?)
QUEST_20151001_002575	(It's unreadable.)
QUEST_20151001_002576	(You can see number 1 on the pillar.)
QUEST_20151001_002577	(You can see number 2 on the pillar.)
QUEST_20151001_002578	(You can see number 3 on the pillar.)
QUEST_20151001_002579	(There is something vaguely written on the pillar. Is this a piece of symbol?)
QUEST_20151001_002580	Hammer? You need it to make a sanctum?
QUEST_20151001_002581	{nl}I can't give you what I was using so take this if you want. It will be gone once you use it. 
QUEST_20151001_002582	Hammer, I've already given it to you. Why are you asking for it again?
QUEST_20151001_002583	Repairing the Sanctum...
QUEST_20151001_002584	In usual circumstances, I would sell it, but I will just give it to you for free this time. {nl}But, it can be only used once.
QUEST_20151001_002585	You're too greedy. One will be enough.
QUEST_20151001_002586	Kedorlaomer Notice Board
QUEST_20151001_002587	This region is the excavation site for the Kedorlaomer Merchants. {nl}All pilgrims need to be cautious.
QUEST_20151001_002588	Received the benefits of the merchants of Kedorlaomer.{nl}Energies are accumulating.
QUEST_20151001_002589	There is a sacred object near the upper right side.
QUEST_20151001_002590	There is a sacred object near the upper side.
QUEST_20151001_002591	There is a sacred object near the upper left side.
QUEST_20151001_002592	Is it below?
QUEST_20151001_002593	There is a sacred object litter further from the upper right side.
QUEST_20151001_002594	There is a sacred object little further from the upper left side.
QUEST_20151001_002595	There is a sacred object little further from the upper left side.
QUEST_20151001_002596	There is a sacred object far from the upper right side.
QUEST_20151001_002597	There is a sacred object far from the upper side.
QUEST_20151001_002598	They say there is a sacred object far from the upper left side.
QUEST_20151001_002599	Haha, thank you.
QUEST_20151001_002600	The Monocle detected a special force. It's the box at the front.
QUEST_20151001_002601	So you are saying that there wasn't any special force or demons at the place where I've told you, and that only an old man who manages the Fortress of the Land was there, right? Did you tell him anything about me?
QUEST_20151001_002602	So you didn't tell him anything about me? That's good!
QUEST_20151001_002603	You need a certificate in order to go to the next region.
QUEST_20151001_002604	Wait! Can you hear something?
QUEST_20151001_002605	Stop thinking that this is a bad method. It's the best method that I can think of to help you at the moment.
QUEST_20151001_002606	Ruklys' Squad Member Spirit
QUEST_20151001_002607	I want to go beside the goddesses.
QUEST_20151001_002608	Premier Eminent
QUEST_20151001_002609	The revelation of the goddesses which we were looking for is near.
QUEST_20151001_002610	So you activated the magic circle again!
QUEST_20151001_002611	Even if I die, I will block you from obtaining the revelation!
QUEST_20151001_002612	My loyal subordinate, Mandara! Kill that arrogant Revelator!
QUEST_20151001_002613	It is so fortunate that I am able to see you again.
QUEST_20151001_002614	Do you remember when I asked you to check if the Monocle detected any strong powers?{nl}You've told me that there's only an old manager there. {nl}The things that we thought were hidden under the special force were actually demons. {nl}And even more absurd, the object that we felt the strong power was in fact the manager.
QUEST_20151001_002615	After I separated from you, I've been searching for Monocle... {nl}There were only demons at the place where the special force was detected.{nl}So I thought maybe Monocle can only be seen by the demons...
QUEST_20151001_002616	I will go to the left side. You go to the right side and look for the parts.
QUEST_20151001_002617	We were almost killed by the demons.
QUEST_20151001_002618	(This guard lost his consciousness. Let's pick up the bomb.)
QUEST_20151001_002619	We've succeeded distracting the guards.{nl}Let's go deep inside!
QUEST_20151001_002620	I don't want to meet you as an enemy next time.{nl}Let's return to where Delus is.
QUEST_20151001_002621	You're an intruder, but I guess we have no choice.{nl}I will go to the place where my colleagues are.
QUEST_20151001_002622	Darn... To think I have to ask an intruder for help...{nl}Anyway, I will return.
QUEST_20151001_002623	We can't just let go of your intrusion into the Fortress of the Land. {nl}Of course, we can't just forget about your help.
QUEST_20151001_002624	We appreciate for your help, but we can't just ignore the royal order.
QUEST_20151001_002625	Please get out of the Fortress of the Land.
QUEST_20151001_002626	Ruklys' Army Spirit
QUEST_20151001_002627	Take him to the goddess.
QUEST_20151001_002628	(The resistance has been weakened. I should use the Restraint Token.)
QUEST_20151001_002629	Premier Eminent is giving some orders to the demons.
QUEST_20151001_002630	I will be stationing one of our guards here in case you're planning to run away.
QUEST_20151001_002631	Beyond Pilgrim's Way is the Great Cathedral, which was built by Maven. {nl}Ruklys, Lydia Schaffen, and Agailla Flurry were all his disciples.{nl}
QUEST_20151001_002632	Among them, the Paladin Master was a hero who saved many lives in the capital. {nl}Currently, he has gone to Srautas Gorge to fight a great evil...
QUEST_20151001_002633	Many people made bets with Modestas to find out who the statue of the goddess is, but Modesta has never lost before he died.
QUEST_20151001_002634	By the end of my life I hope to see Fedimian completely restored.{nl}If there's one thing I can do, I can make 1,000 pots in dedication to this wish.
QUEST_20151001_002635	I hope I can make it big off of the excavation site at Zachariel's Royal Mausoleum...
QUEST_20151001_002636	I beg to the goddess. {nl}I hope the day when my oath to the Watchers is realized never comes...
QUEST_20151001_002637	When I close my eyes at last, I hope my many disciples will protect me at my side.
QUEST_20151001_002638	Now is the moment that we become one with our blades. My last wish is to die beside the one I love.
QUEST_20151001_002639	Why did you come back?{nl}
QUEST_20151001_002640	It is so fortunate to hear that Grazina is okay.{nl}But, I guess Grazina can't be relaxed since she gave this to me.{nl} 
QUEST_20151001_002641	This is the second page of the Roxona Conflict that I gave to you a while ago.{nl}It was among the objects which Grazina stole. Please receive it.{nl}
QUEST_20151001_002642	And Alina... I am not sure.{nl}She ran to the lower side so I think she may be near there.
QUEST_20151001_002643	You've passed the object and the story of Grazina.
QUEST_20151001_002644	Please find Alina...
QUEST_20151001_002645	2nd page of the Roxona Conflict
QUEST_20151001_002646	The time went by and the summer, the season of new green leaves came...{nl}Lydia Schaffen wandered around to find the one who'd killed her parents and relatives.{nl}The goddesses were on her side after all.{nl}The time that she's been waiting for has finally come.{nl}
QUEST_20151001_002647	One by one they fell in the dark to her unexpected arrows.{nl}Although it should have been an easy fight for them, they never knew where she was.{nl}The sound of her arrows ripped through air and skin.{nl}Soon there were no one other than Lydia Schaffen, who stood still.{nl}
QUEST_20151001_002648	Lydia Schaffen raised her torch.{nl}The flame wavered ominously, causing her shadow to waver as well...{nl}She wanted to see the faces of the villains who killed her parents and neighbors as well as burnt the village.{nl}Many of the faces she saw for the first time, but some of them were familiar.{nl}They were loyal subordinates of Ruklys and she knew very well about them.{nl} If it had been a brighter time and different location, she may have noticed the incident before it occurred.{nl}But, the incident had occurred and it was irrevocable.{nl}Just as Lydia Schaffen had her reasons to kill her enemies, Ruklys now had his: to defeat her for killing his subordinates.{nl}
QUEST_20151001_002649	With a gloomy sense of shame and unfamiliar embarrassment, {nl}she quietly picked up her bow and left the place.{nl}The news soon reached Ruklys.{nl}They both comforted themselves by thinking that they just fell into a wicked plan.{nl}But, it was useless. They felt the vague shadow of the wicked plan behind them.{nl}
QUEST_20151001_002650	But, it was too late.{nl}There was nothing she could do except for put an end to Ruklys, {nl}with the arrows that she now love and hate.{nl}Or else his sword will guide her to the goddesses... There was nothing she could do. 
QUEST_20151001_002651	There is one more thing I must tell you. {nl}Follow the name of Ruklys.{nl}
QUEST_20151001_002652	His final battleground...{nl}Laima's revelation at the Fortress of the Land is waiting for you.{nl}
QUEST_20151001_002653	Goddess Laima...{nl}The Revelator who you foretold has finally come...{nl}
QUEST_20151001_002654	After a thousand years of sleep, I am finally able to meet you, {nl}the one whose coming the goddess foretold.{nl}I am also relieved to see that the effort I put into building {nl}the Royal Mausoleum during my rule was not futile.{nl}
QUEST_20151001_002655	Although I founded the kingdom,{nl}I wish to speak to you as the guardian of the revelation rather than as king.
QUEST_20151001_002656	You are the Savior of this kingdom.{nl}I can feel that you will save this world and become the one who the goddesses would rely upon.{nl}
QUEST_20151001_002657	After spending a thousand years of worshiping the providence of the goddess,{nl}I shall now show you the great will that was left to you in the revelation.
QUEST_20151001_002658	The soldiers will die if I don't make it. {nl}I have to be strong. 
QUEST_20151001_002659	...Only after three years since Ruklys learned from my teachings...
QUEST_20151001_002660	If the demons cross the dimensional crack, {nl}and join hands together with their brethren at the Demon Prison...{nl}The world will be in for another kind of threat.
QUEST_20151001_002661	I've told sister Vakarine to promise me that she'd prepare for the worst.{nl}But the uprising of the demons that broke through might be hindering her.
QUEST_20151001_002662	Bishop Aurelius, who was ordained at a young age, soon took ill and lost his life.{nl}
QUEST_20151001_002663	His last request was for the Divine Mission for Maven to be fulfilled even after his death, {nl}and the Church accepted.
QUEST_20151001_002664	I am sorry, Officer Gorman.{nl}I couldn't complete the mission due to the monsters' attacks.{nl}
QUEST_20151001_002665	Take some rest. It is fortunate that you came back alive.{nl}I will pass the mission to another person.
QUEST_20151001_002666	You will have to think a lot since when you touch on something, {nl}many things that are near get also influenced.{nl}I will write down which one to turn on. I am counting on you.
QUEST_20151001_002667	Let's see... For now, just activate the shrine above.{nl}When you activate one, the shrines near it would get also influenced, {nl}so you will have to think a lot.
QUEST_20151001_002668	Let's see... For now, just activate the shrine on the left.{nl}When you activate one, the shrines near it would get also influenced,{nl}so you will have to think a lot.
QUEST_20151001_002669	Let's see... For now, just activate the shrine on the right.{nl}When you activate one, the shrines near it would get also influenced,{nl}so you will have to think a lot.
QUEST_20151001_002670	Let's see... For now, just activate the shrine below.{nl}When you activate one, the shrines near it would get also influenced,{nl}so you will have to think a lot.
QUEST_20151001_002671	The Order of the Tree of Truth worships the Divine Tree that stands in the capital city.{nl}The greeds of the humans are getting bigger, so the Divine Tree is punishing them for it.{nl}
QUEST_20151001_002672	The Order of the Tree of Truth will be the ones selected by the Divine Tree,{nl}and they will help starting to build a new era.
QUEST_20151001_002673	Margiris once told us. The salvation can't be achieved easily.{nl}What we are doing is washing off the sins of the ignorant ones and washing off our sins.{nl}The ones who die are because they are weak. Only the survivors would receive the salvation.
QUEST_20151001_002674	The ones who came to this place before Utara came here are the guys from{nl}the Order of the Tree of Truth.{nl}They are the disciples acknowledged by Goddess Zemyna.{nl}
QUEST_20151001_002675	This land is blessed by Goddess Zemyna, so they thought they should make a will of the goddess.{nl}How can I stop it.
QUEST_20151001_002676	Fake Box
QUEST_20151001_002677	It doesn't seem to be this box.
QUEST_20151001_002678	It's not enough to destroy the Holy Relic of the Order, but you did release Carlyle...{nl}
QUEST_20151001_002679	You will pay with your life!
QUEST_20151001_002680	Truth Token
QUEST_20151001_002681	The divine energy subsided when the Truth Token was lit.
QUEST_20151001_002682	The mysterious girl with the light has appeared. Talk to her.
QUEST_20151001_002683	The mysterious girl ran away without saying anything. Follow her.
QUEST_20151001_002684	Suspicious Basket
QUEST_20151001_002685	The stench offends your nose. Looks like rotten food is hidden underneath.
QUEST_20151001_002686	The mysterious girl with the light has appeared once again.
QUEST_20151001_002687	Quickly! We have no time!{nl} My power is over here!
QUEST_20151001_002688	Aldona! Zydrone!{nl}Now!
QUEST_20151001_002689	Aldona, Zydrone...{nl}I'm sorry for being a burden to you both because of my feebleness.{nl}
QUEST_20151001_002690	But, let's not waste any time.{nl}You've brought the Savior here... who has the power to get rid of this disaster.{nl}
QUEST_20151001_002691	I will ask the Savior to help me.{nl}You two should get ready to quickly make the Evening Star Key.{nl}
QUEST_20151001_002692	The many deaths of demons could not fill the emptiness in my heart. {nl}Once the goddess' great mission for me is over, {nl}I will be left with a long life full of boring moments.
QUEST_20151001_002693	Ugh, I thought it would die after its throat had been cut.{nl}I hope it can just behave now and die slowly.
QUEST_20151001_002694	A fake revelation... all this so you can lure me out and get rid of me?{nl}How disappointing to see such trickery is the best that Laima can prepare.
QUEST_20151001_002695	But for all your preparations, you are powerless against me...{nl}It's amusing how your foolishness blinds you from the overwhelming gap of power between us.
QUEST_20151001_002696	Right. I can feel where the real revelation is located.{nl}Try struggling once more.
QUEST_20151001_002697	So, this is where the revelation is hidden.
QUEST_20151001_002698	Demon Lord Marnox
QUEST_20151001_002699	Such are the fools who follow the goddesses.{nl}Have you not witnessed enough to know me?{nl}All this time I've been waiting for you all to come at your own will.
QUEST_20151001_002700	After I defeat you, I will continuously disturb the priest until he opens the box himself.
QUEST_20151001_002701	I was able to retrieve my soul thanks to you... {nl}Isn't this the Chain of Reversion that shredded my soul?
QUEST_20151001_002702	Collecting the Shiny Moss
QUEST_20151001_002703	Obtained Shiny Moss!
QUEST_20151001_002704	Failed to obtain the moss!
QUEST_20151001_002705	Obtained Nachi Mushroom!
QUEST_20151016_002706	So, this stone slate is the Light of Salvation?{nl}It looks like just an old slate to me.
